"42nd B'day ideas: authentic Houdini padlocks, handcuffs, correspondence."
"In honor of #NegroniWeek, we went to @Eataly and had a fantastic lunch. Wow, David has never looked better. http://t.co/ocMmpXmbH5"
"It's officially June, which means my birthday is only 15 days away. I'll start tweeting my awesome random gift wish list soon. Prepare."
Psst: know someone that you'd like to have the surprise of their life on my new show? Click here &amp; nominate them: http://t.co/bO1JHp260k
"A gigantic Happy 40th Birthday to @DavidBurtka, who looks fantastic, laughs constantly, and loves life. I'm a lucky husband! #DILF #DIF"
Happy Memorial Day - a day to honor the heroes of past and present. #grateful
I proudly raise a pint glass of Guinness and toast the people of Ireland for voting by a sweeping majority to legalize same sex marriage!
"Err, #RedNoseDay is tonight, not tomorrow. Awkwarrrrrd..! So, um: Watch and donate TONIGHT at 8/7c on NBC. Nailed it. http://t.co/wZdpBtTVvc"
Excited to be a part of @RedNoseDayUS! Donate and watch me\ntomorrow at 8/7c on @NBC. #RedNose http://t.co/NEIYvaJ7Ud
I already miss David Letterman... #legendary
So impressed by the large turnout and delicious food from the local chefs here at the @HarlemEatUp event. @MarcusCooks did an awesome job!
Loved LOVED watching @AmericanInParis today on B'way. Being swept up by people doing super human feats..! Now I need to take a dance class.
"Name Change: I'm officially NPH now on Instagram! Follow me here: http://t.co/J6UFNgwMk9 (if you're already following me, you're all good)"
"Enjoyed a delicious steak dinner at @BenjaminSteak after David's show. Dee-licious! A great post theatre option. Very large, very macho."
"This night's awesome. Had a stellar dinner at @CatchNY, now heading to NBC shindig to shake many a hand. Can't wait for you to see the show."
"At the NBC Upfronts, as they announce their new season, including my variety show: Best Time Ever w/ Neil Patrick Harris. I hope you dig it."
"Happy Mother's Day. I am blessed with an absolutely fantastic mom - wonderful person, doting grandma, beautiful soul. I love her lots. \U0001f339"
Just saw @HandtoGodBway. Maybe the craziest shit I've ever seen. In the best possible way. The entire cast deserves a hand. But just one.
Come join the madness: I'm headlining a big variety show at the @Just_For_Laughs Festival in Montreal on 7/27. Tix: http://t.co/8RopsPt4gJ
"Mind kinda blown by the movie Ex Machina. The cinematography, commentary, coolness - loved it. @ExMachinaMovie https://t.co/foxRSdFKB4"
"Happy birthday to my friend in life and in magic, @derek_del. He's one of the great ones..."
"Happy Cinco de Mayo, everyone! Hope your night is filled with celebration and drinks - a tequilabration, as it were. \xa1Salud!"
"What a night! Thanks @Zegna for the couture tuxes, courtesy of the great @samspector. @Davidburtka &amp; I felt like $1M! http://t.co/fsI1mKKCbm"
On my way to the fancy Met Ball with the ever handsome @DavidBurtka. Looking forward to a very James Bond evening. http://t.co/8dMvia5RuP
"Break a leg, @DarrenCriss. Your stint in @HedwigOnBway begins in a few short hours. Can't wait to see you rock those heels!"
This I Love: Bitmoji. An app that lets you create your own avatar and use it in texts. A hilarious time suck. \nhttps://t.co/C6f9VbaXJs
"This I Love: the acrobatic troupe of Sequence 8, the latest show from 7 Fingers (@7doigtsdelamain). Truly amazing: http://t.co/e0JjgFb6xc"
Spring dun sprung! #huzzah http://t.co/UiMjxjHiF8
"Had a fun, busy, quick trip to Calgary in the amazing land of Canada. Awesome people, swank hotel, delicious food. Can't wait to go back."
I'm just crazy proud of @Davidburtka as tonight @ShouldaBeenYou opens on B'way! Bravo! http://t.co/I1k4D4YQZ8
This I Love: http://t.co/f8b7yyCRLZ  Any future project starring @NathanFillion and @alan_tudyk will be brilliantpants. #conman #hireme
Belated congrats to @LenaRockerHall for her epic year+ portrayal of Yitzhak in @HedwigOnBway. 2nd best husband ever! http://t.co/1dbEsDWh9l
Happy Easter from the Burtka-Harris bunnies and one lil' chick! http://t.co/dZS8DZWxqK
"Even though it's raining, the warm weather of NYC makes for a very #GoodFriday. Enjoy your weekend! http://t.co/vusvtJ78Gh"
"Eleven years ago today, I went on a date with @DavidBurtka. Now we're married, have two kids, and great good times. Happy Anniversary!"
"I guarantee Heineken Light is the #BestTastingLight you\u2019ve ever tasted. Err, I can't personally... I should explain.\nhttps://t.co/IKP7o4kOKd"
"Happy One Year Anniversary, @HedwigOnBway! Glad to see the old cat still has her claws! #imissthoseheels"
\u201c@7paws: @ActuallyNPH you were a puzzle on @WheelofFortune last night\u201d Th_t'_  Aw_s_m_!
"This I Love: the podcast @Radiolab. It's fantastic. ""A show about curiosity"", as they put it. Intelligent, creative, witty. Do listen."
"I keep finding things to recommend. So, I'm starting a new thing called 'This I Love'. Not paid endorsements, just random stuff I dig."
\u201c@elsiete: @ActuallyNPH thanks in advance for helping out!\u201d My plezsh. Hope he gets an A.
\u201c@elsiete: 1) fav animal? Dolphin 2) what do you miss about ABQ? Green chile 3) what's the 1st magic trick you learned? Nickels to dimes\u201d :)
"\u201c@elsiete: @ActuallyNPH My son chose you for his 4th grade paper ""famous people from NM"" he has a few questions for you...\u201d Okay. Go."
Watch #BreakingBorders (@travelchannel): @MVoltaggio travels the globe cooking meals for people with opposing views and films their debates.
"Had a stellar time last night on @itvtakeaway with the brilliant, kind and classy @antanddec. Excited to bring this show to the states!"
"Loving London. Soaking in all of the behind the scenes producing of my new variety show, based in Ant and Dec's Saturday Night Takeaway."
Congrats @Davidburtka and the entire cast &amp; creative team of @ShouldaBeenYou for a job well done at their first preview last night! #success
Happy St. Patrick's Day!  Look out for leprechauns! http://t.co/wZ0aH31mNx
"Just realized it's Friday the 13th! All makes sen-Wait, someone's at the door. I'll let him in. Hmm. He has a hockey mask and a machet-OHNO!"
"I picked up a face down penny, stepped on cracks in the pavement, a dog started howling and a bird flew in my window. Today be crazy! Hmm..."
"Blurg! There's a water leak in the living room! Oh wait, here's an umbrella. I'll just open it up and use it to protect the couch. Hmm..."
Ug! I'm trying to eat lunch and this darned salt shaker keeps dropping onto the floor! There's salt everywhere!  Hmmm...
RT @nikomcgregor: @ActuallyNPH #lookout http://t.co/mLYIUr3myd
"Following the kitty. Under a ladder? Okay crazy cat, if you insist! Hey, look there's a mirror. Hope it doesn't fa- oh, it shattered! Hmm..."
"Happy 13th, everyone! What a lovely Friday. Oh look, a cute little black kitten just walked right in front of me. Hmm. What could that mean?"
"Spectacular night with the kids. Karate class, dinner with Daddy, sneaking in to see him sing and dance at his @ShouldaBeenYou rehearsal. :)"
"I'm loving this downtime with the kids - taking them to school, preparing meals, reading books. Lots of work but so worth it. #grateful"
Just saw The Audience on B'way. All hail Helen Mirren! Phenomenal! Reignited my love for the theatre. #masterclass #bravo
Surreal. Just had the honor of introducing @BillClinton at an event for the amazing Clinton Foundation (@ClintonFdn). http://t.co/mP28Rx1OMm
Go to @funnyordie and watch this video of me shouting at some seriously #ThomasObsessed kids! http://t.co/tnBYYjbNNR http://t.co/c6yMUyDj7I
I kinda like that this winter storm is called Thor. #avengers
Here's a taste of the madness you can expect from my new video out today on @funnyordie. #ThomasObsessed http://t.co/xKsm1iS5zJ
"Now that I'm back in NYC, I want to thank the @MontageBH for my LA digs. Such a remarkable place to stay - awesome room, great staff. #loved"
"So first I saw the dress as white and gold, and only that. Now, it's absolutely blue and black. How?!? Does this make me bi-dress-ual?"
"Hilarious.  An R-rated version of Scattergories!  Oh, how I love Kickstarter. http://t.co/5tmOu2DH7p #pledged"
My iphone shattered the morning of the Oscars. I probably should have read more into that. #harbinger
"It's the day of the show, y'all. #Oscars @TheAcademy"
"Hey, I know that dude! @TheAcademy http://t.co/f3t9ooOMhM"
I'm super appreciative for the group of writers we hired for my #Oscars content. If only they could write everything I say always. #proud
"My brain hurts from all the #Oscars overthinking. It's time for the fine tuning, rewording, and 3rd guessing. So much minutiae! @TheAcademy"
No turning back: Dropped off my official #Oscars predictions to the two people in charge of the ballots at @pwc_llp. http://t.co/WXawVsDcbu
"Congrats, SNL - 40 years of classic, cool, courageous current comedy. Well played. @nbcsnl"
Question: what you're favorite movie that wasn't - and shouldn't have been - nominated for an #oscar? My choice: The movie Clue.
So fortunate to see You Can't Take It With You today on B'way. Closes 2/22. Wish it could play forever! Absolutely loved it! @CantTakeItBway
"\u201c@Obliviouswb: @ActuallyNPH From EW- CLUE?!  I LOVE that movie!  The cast, the quips, and multiple endings!\u201d Right?!? Best. Movie. Ever."
RT @Davidburtka: May this heart be with you! http://t.co/mYv5NzjG0A
RT @Davidburtka: I am giving everyone a big kiss for Valentine\u2019s Day!! http://t.co/nRz1B2OOGU
"\u201c@Davidburtka: I\u2019ll think about it okay yes!\u201d Yes! If my Valentine's night was now up for an Oscar, it'd be for Best Original Score!"
"Hey @Davidburtka - Will you be my Valentine? Ok, I realize you're already my husband, but a 'yes' would sure make my day/night/life."
Congrats to the North Carolina Powerball winner! Way to make winning an #Oscar seem that much less impressive. @TheAcademy
"Rehearsals are intense for the Oscars.  And by rehearsals, I mean me singing\ninto a hairbrush in front of a mirror.  #Oscars2015 @TheAcademy"
Had a tremendous meal last night at @MVinkLA. Massively impressed by food is both exquisite to look at and delicious. http://t.co/YS1IckPucT
"Tonight, I'll be joining the hilarious @PaulGreenberg1 in the season finale of @IGIHollywood at 8:30e/p only on @AudienceDIRECTV #haunted"
"Looking over the preparations for the #Oscars set. After last night, we've installed a second layer of Kanye-proofing, just in case."
"As always, unbelievable respect for the crew working backstage at the Grammys. Changing out set after set - their work is amazing."
"GAH! Our best of friends just had a child! Sorry Grammys, but the godfathers have to meet themselves a new baby! #goodnight"
Hmmm. Jamie Foxx reading braille next to Stevie Wonder. Not sure how to feel about that.
Amazing. Beck and Chris Martin sure did... stand there super well. So much energy!
Sam Smith is awesome.
Who knew Kristen Wiig was such an amazing dancer! Wait. I think someone put something in my drink. This ain't right. #whatishappening
Shia Lebouf sure knows how to read a teleprompter.
Prince is so shiny..!
Sam Smith is awesome. Add Mary J. Blige- just wow.
"""This would be a real good tiiiiime.. to take a nap."""
"Just loving the Grammys. Thanks to CBS and Jack Sussman for creating such an amazing show, year in and year out. If you get a chance, GO!"
Usher can sing. But did that harpist come from the Ariana Grande school of hair design?
It's Ga Ga Game time! http://t.co/z8cYAQOT95
Wow. That was awesome. @katyperry as Princess Leia has never sounded better.
Pharrell just can't stop wearing shorts..! Is this a Wes Anderson movie? Does he work at the Grammy Budapest Hotel?
"So @Davidburtka and I have agreed that if Nick Jonas responds to this tweet, our wedding vows will sort of kind of change a bit."
"Annie Lennox is awesome. Not only can she sing, but her bird calls worked! They are everywhere! #don'tcare #standingovation"
Annie Lenox makes everything better. Especially church.
Adam Levine must be some sort of super hero person. Doesn't he want to have my baby?
Gwen Stafani must be some sort of super hero person. Didn't she just have a baby??
"I thought Beyonc\xe9 had a middle part, not a beehive. #goodtoknow"
Josh Duhamel is everything.
"Madonna is losing the Running of the Bulls. Oh wait, here comes a gospel choir. She's good. Oh, no. She's dead. She lost."
Sam Smith is awesome.
"Who knew Miranda Lambert's set designer was her biggest fan? She's hot, but cool."
Pharrell is actively disrespecting everyone on the frozen East Coast by wearing shorts in the winter. #howdareyousir
Marion Cotillard is up for an Oscar AND singing on the Grammys with Tom Jones? What can't she do?!?
Ariana Grande's eyelids seem really heavy.
Anna Kendrick looks hot. No bra. Well played.
I'm one envelope away from seeing Taylor Swift's lady parts.
LL Cool J is talking. All I can hear is ringing in my ears. I think they're bleeding. #oldpersonjoke
"AC-DC opened then show, and now everyone is effectively deafened. And I think six people had seizures. And 50+ got 3rd degree burns."
"I gotsta live tweet the Grammys! Get ready: as a non-winner, I'm eleven drinks in."
"Aw, nerts..! We didn't win a Grammy for @HedwigOnBway. Kudos to Beautiful, but @stephentrask's music still rules my rock-ish world."
Thinking of going with a solid gold tuxedo for Oscar night. Thoughts? #chafing @TheAcademy
"In honor of Birdman, we\u2019re going to do the whole #Oscars broadcast in one continuous shot."
Calling all foodies: Watch my bud @ChefAntonioPark's debut on Chopped Canada tonight at 9:00 p.m. ET/PT - Food Network.
"Oof. I am knee deep in #Oscars rehearsals. Why, oh why did I ask for a wading pool..."
"Good on us, Lance and Michael. Represent! -- Why Lance Bass\u2019s Big Gay Wedding Matters http://t.co/64ypKfbyFk via @kpfallon"
Here's a wrap up of today's #oscar nomine luncheon: http://t.co/J3u9Dl84Ln + a pic. They all look so white! #toosoon http://t.co/WtM3EFAUZZ
"@katyperry just crushed it at the Super Bowl! But, umm, that was my entire opening number for the #Oscars. Soooo, uhhhh... @TheAcademy"
Here's one more #OscarAnagram:\n\nThrob Sex Toll\n\n\U0001f601
Let the #OscarAnagram continue:\n\nValid Enema
Another #OscarAnagram:\n\nWhoopee Reinserts
Next:\n\nTrachea Drill Rink\n\n#OscarAnagrams
Well played. Next:\n\nAnal Ruder
More #Oscars Anagrams!\n(Late Night Edition)\n\nWho dis:\n\nLet Sperm Rye
Prepping for the Super Bowl. This is my first attempt at a Super Plate. #nachos http://t.co/Lfb0jrTob3
"Thanks, Mr. Verizon Man, for your inspired work installing the phone lines for my production office. Worth the wait! http://t.co/JBcjjKoazJ"
"Prepping for my #Oscar night party. Anyone know a good onion dip recipe that serves 3,000?"
Super Bowl revelers: Do drink. Don't drive. May I suggest Uber? First ride's free (up to $20). Try it: https://t.co/TZ67uy2GSa
"Multitasking in my #Oscar prep: watching Best Cinematography nominees on mute, while listening to audio of the Best Sound Mixing nominees."
Check out my Twitter video #Oscar exclusive! I gots me a scoop! http://t.co/SGQ3oJHDqZ
Good times. Last one for tonight:\n\nThink Gayer Like\n\nSleep tight. #OscarAnagrams
Movie-ing right along:\n\nOtherwise Reopens\n\n#OscarAnagrams
So many Oscar contenders have oddly appropriate anagrams.  Like:\n\nA Ruled Narration Jig\n\n#OscarAnagrams
Games are fun!  Next:\n\nRectal Elves\n\nYou're welcome. #OscarAnagrams
You're good! How about this:\n\nReefer Envy Thigh Toothy\n\n(also the password to McConaughy's post Oscar party)\n\n#OscarAnagrams
Let's do some #Oscar Anagrams! 'Cuz why not! Ready? Who's this:\n\nMr Decent Butch Cabbie\n\n#OscarAnagrams
Thinking about wearing a Janet Jackson headset at the Oscars.   Just \u2018cause.  #Oscars
"Due to the Patriots ball scandal, I\u2019ll personally be making sure all the Oscars are fully inflated this year. #Oscars"
"This year's #Oscars will be a little different: In addition to acceptance speeches, all non-winners must deliver concession speeches."
"Today we honor the legacy of Dr. Martin Luther King Jr., a remarkable humanitarian and civil rights leader. #greatness #respect"
"Another good #Oscar read, again via Deadline: http://t.co/ml04aDrP8v"
"Interested in a smart, insider conversation about this year's #Oscar drama? Check it: http://t.co/DkBdVmC6bU via Deadline."
Had an absolutely delicious dinner with the family at St. Anselm in Brooklyn. One of the best restaurants in NYC. http://t.co/g4i96jUtnZ
Tonight is the opening of brilliant artist Patrick Jacobs' new show at @PerogiGallery in Bklyn. Gideon approved! http://t.co/okDl68LQxu
"Last night was great: dinner at @Guarnaschelli's resto Butter, then @HedwigOnBway with the superb Michael C. Hall! http://t.co/EdAKfexYj5"
My new Oscar commercial. Dig it. http://t.co/VLWYO4rUGO
My #Oscars nominations thoughts: http://t.co/ZM1gylH4cu
"Can't wait for tomorrow, @neilmeron and @craigzadan. Let the #Oscars commence! BTW, we should probably start creating content soon..."
"What's Chester got up his sleeve in tonight's #AmericanHorrorStory ? My guess is it's not good. And I should know, I filmed it. #Marjorie"
"The Oscar nominations come out tomorrow morning. Damn, I really need to finish counting all these ballots..! #Oscars #procrastination"
RT @billboard: We spoke to @ActuallyNPH about #Hedwig's Grammy nomination and more: http://t.co/dQbN1TQn4S
My stint in the American Horror Story: Freak Show begins tonight! Watch it.  I double-doll dare ya! #AHSFREAKSHOW #Marjorie
"Rosamund Pike was spectacular in Gone Girl. Glorious, absolutely remarkable. Oscar worthy, for certain. My boner concurrs."
"Attended a New Years Day Hangover party today. Everyone wore PJs, and I brought @TheIVDoctor, who rehydrated us all. Highly recommended."
"Happy New Year! May your 2015 be filled with health, humor and happiness. Love, the Burtka-Harris Bunch @Davidburtka http://t.co/UVehE2SStz"
\u201c@nbeiter14: @ActuallyNPH I think you'd appreciate our Christmas card ! http://t.co/BX0F7KT4H0\u201d -- Well played.
"Merry Christmas Eve! Hope your night is filled with love - whether it be by romance, friendship, or random circumstance. 'Tis the season!"
"Took the family to see @Aladdin on B'way. Awesome watching Gideon be confounded by a carpet that actually flies, while Harper missed Abu."
Massive congrats to Sir Elton John &amp; David Furnish - now officially married! @DavidBurtka are I are thrilled for you both! #sharethelove
"And if you're looking for a swank gift for your lady, check out http://t.co/tmFJVmkNBP. Exquisite clothes and one of a kind jewelry. #classy"
Like laughing? Watch this. Plus I guest on it in Feb. @IGIHollywood on @DIRECTV ch.239 Tonight 8:30pm. w/ @PaulGreenberg1 &amp; @DAnthonyHiggins
\u201c@jayceedoubleu: Your baby can read too with the help of @ActuallyNPH http://t.co/IdtXiNaBjJ\u201d The book is magic!
"All done with my Q&amp;A. Good times. And oh oh oh man, is my book a great holiday gift idea! It has words and stuff! http://t.co/2WrsTX0swd"
"Kay (@kmssssssssss) asks: What feels more natural to you acting, singing, writing or hosting? #AskNPH http://t.co/jZDdxVnuaK"
Robin Chesser (@Raechef2) asks: If you could have a cohost on The Oscars who would it be? #AskNPH http://t.co/d2fjF3MGD6
Selena Kyle (@Jamybitch) asks: please tell us something about the oscars! Any plans? #AskNPH http://t.co/S6NcHoMyIQ
Samrin Hirani (@Sams_lfc) asks: what magic trick and recipe is your favourite from.your book? #AskNPH http://t.co/exkNGgwIjd
.@LindsayHarper Did you find it difficult to talk about anything in your book? Did u enjoy the nostalgia? #AskNPH http://t.co/bfPIrbSJdl
Vicky Evans (@yic147) asks: what are you reading at the moment? #AskNPH @kristopherjans @bjnovak http://t.co/I17weacF9T
".@dcestates: what part of the book was most challenging/if you were a dog, what type of dog would you be? #AskNPH http://t.co/LPMCdKvpj9"
Lauren Peterson (@Aerodiver7) asks: in the audio version why does a British guy narrate for your friends? #AskNPH http://t.co/nz8CXNFSQM
@emmyxoxo84 asks: Was there anything that you didn't want to include in your book but did anyways?#AskNPH  http://t.co/MU6ugiua2Q
".@rapawnish1133 : Did you ever experience writers block while writing and if so, how did you get unstuck? #AskNPH http://t.co/xYkKYyRgrM"
"Jasmin(@Jasmin_96_) you were so busy how did you find time to write a book with Hedwig, HIMYM, Gone Girl #AskNPH http://t.co/CyCFNTh2YN"
Rebecca Stinson (@96Becky) asks: What\u2019s your favorite ending in your book? #AskNPH http://t.co/rxI9ft0UXO http://t.co/Tjrt3NWfBo
Joe (@JGH1211): what gave you the idea to write your autobiography as a choose your own adventure book? #AskNPH  http://t.co/nr7M7VnRsI
Dani Francine (@DoctorSwarley) asks: Can your book still make me levitate even if I'm buying it late? #AskNPH http://t.co/qvMPNdKUMR
Jenna N (@Jennateur) asks: Why were people posting pics of themselves levitating while reading your book? #AskNPH http://t.co/ZQFTWEfkJ5
"#AskNPH Introduction - This is how I am, um, introduced. http://t.co/DndTNtOz1W"
"About to start sending answers to your Twitter questions! Ready, set... GO! #barrage #AskNPH"
Dudes. I'm answering questions at a live Twitter thing on 12/15 about my book http://t.co/E7vv4IyAEr. Tweet me your queries now w/ #AskNPH
May I present my Academy Award writing team! (It took four of us to craft that last sentence) #Oscars http://t.co/HiooVFDIjx
Just finished filming my last scene for American Horror Story. I need to take a shower. Wash off all this horror.
The @HedwigOnBway cast recording was just nominated for a Grammy! So proud! Now what happens? Bribery? Sexual favors? #WhatWouldHedwigDo?
"I'll be watching #PeterPanLive tonight at 8 pm on NBC. You? Can't wait to see what will happen!  Break a leg, cast. But not a wire..."
Support a cause near and dear to Team #HIMYM by going here and clicking on GIVING:  https://t.co/cDyEXqcn8c \u2026  #GivingTuesday
"David and Gideon are digging these Disney days, too. Great waltdisneyworld memories all around..! http://t.co/GuR4EvCmkP"
Having a great time in waltdisneyworld hosting the Candlelight Processional at EPCOT. Harper is in\u2026 http://t.co/pIAc29pfVj
"Bid on my Hedwig beehive wig, all money goes to support NY Stage &amp; Film. It smells just like... the crown of my head. http://t.co/GNr6x2goQa"
"Happy Thanksgiving! I'm super thankful for all of the blessings in my life, especially these three. http://t.co/a4gpjZOMl8"
"Heading home after @Davidburtka 's one man show. He crushed. So proud. If you get a chance, please  spend some time with this wonderful man."
INC(RED)IBLE: These Apps Save Lives. For 2 weeks 100% proceeds go to @RED to fight AIDS. #AppsforRED Only @AppStore http://t.co/om1EOjWkEq
\u201c@CaraCompass: I'm getting a calico cat what should I call her\u201d I'd name her Puppy.
\u201c@smichelle2121: @ActuallyNPH With more than 11 million followers how much tweets do you get to read in a day?\u201d 83.
\u201c@DieselPitman: I found your 70's doppelg\xe4nger! http://t.co/5o3cW7lVdt\u201d GAH! My secrets are slipping. You never saw this.
"A loverly review of my tome: http://t.co/xPf3jCWTua It makes a terrific stocking stuffer, assuming your stockings are stretchy."
"RIP, Mike Nichols. Brilliant director, lovely gentleman. Total class act. His work will live on forever."
I haven't yet entered the Show of Freaks. But fair warning: I'm a'comin'..! #AHSLiveTweet #chameleons
...I was almost so sexy...
R. A. Montgomery: thanks for all of the (Choose Your Own) adventures over the years. Rest in peace. \nhttp://t.co/7RgtoOvdv2
\u201c@MackaMettey: @ActuallyNPH's new book makes me lighter than air! #nphbook #levitation http://t.co/yHJK88RLbg\u201d Yes! http://t.co/2WrsTWIRo9
"I'm solo in NOLA! Ate dinner at Cochon, unbelievably delicious. Pics of the dishes at @NPHFoodPorn, worth a look. Oh, and I'm filming AHS:FS"
"Welcome to Broadway, Emma Stone! Can't wait to see your Sally Bowles in @Cabaret_Musical, starting tonight. Break a leg. And a heart."
48 hrs left to support a lovely cause by hanging w/ @himymcraig and @CarterBays at the inspiration for Maclaren's!  https://t.co/fRluIwleKS
It's Veterans Day. Sincere thanks to all those who have served in the U.S. Armed Forces for protecting our country. I salute you.
Vote for my book to be the funnierest of them all! https://t.co/2WhM7Pptuo
\u201c@CaraCompass: @ActuallyNPH Who won the #nphbook competition?\u201d It's still in play!!
"Early holiday shoppers: May I suggest my autobiography? It's entertaining, educational, and easy to wrap! http://t.co/2WrsTWIRo9 #beatbox"
"Penny made me laugh at Absinthe in Vegas, and also in this, her Kickstarter plea. Worth a look &amp; some scratch: http://t.co/KUUprLTJdF"
"\u201c@henrysodt: Some levitating at Costco with a great read... #nphbook #levitating http://t.co/YyWpu2KxUa\u201d Yes! Costc-OH, I'm floating!"
"\u201c@samoss22: Just doing some ""light"" reading at walmart.. #nphbook #literallymagic #wow http://t.co/yMC6UoxKzE\u201d Yes!"
"Took the family to the @BigAppleCircus today. Had an amazing, circustacular time! #metamorphosis http://t.co/qonrD1Lt16"
Know this: my variety show will absolutely be crafted by union writers. I've been assured by ITV that it will be a WGA show. Period.
"Watching American Horror Story: Freak Show. While everyone in the ensemble is amazing, @MrJCLynch is sublime. Wow. Bravo. #Twisty"
This video of the 2014 Albuquerque Balloon Fiesta makes me proud of/miss/love NM! Amazing! http://t.co/mj58cLF1kO (via @Colossal )
\u201c@dannisiminerio: Hedwig and Yitzhak think that @ActuallyNPH's book is magical. #nphbook #levitation http://t.co/9mYRY3MVaP\u201d Yes!
