"It seems the vanishing gold brick from @inandofitself appeared on the @todayshow set. Where'd it end up tonight,\u2026 https://t.co/DPKGPv1RqV"
Tonight @derek_del opens his one man show @InandOfItself in NYC. An extraordinary talent and genuine great person.\u2026 https://t.co/xJHnRFmJns
I AM ________? Screenshot to find your answer. @InandOfItself opens TONIGHT! https://t.co/gBFy2jWh1l https://t.co/JlW7lEm17Q
"Podcast recommendation: S-Town. It's epic, intimate, crazy, mysterious, informative, tragic and downright brilliant. https://t.co/6V8i3Nw8qh"
Vancouver. Trump Tower. It's twisted. https://t.co/jiAzPbEOQh
Loving Vancouver. It's awesome. Still trying to find the right awesome place to stay while I'm here. #help Digs4nph@gmail.com
"Performances to see @derek_del and the phenomenal @InandOfItself begin tonight. I'm telling you, get tickets quick,\u2026 https://t.co/Qp8pLBQNpx"
"Platinum tix are still available for @InandOfItself. First row, limited edition print, &amp; meet @derek_del #worthit https://t.co/Q7yPq02kf8"
"Check out the cover for my new book, The Magic Misfits, coming sooooon: https://t.co/vEJc8pscgj #themagicmisfits #veryexcited"
Love this Kickstarter: I can draw something from afar and Joto replicates it at home. A Dry Erase Never Bored! https://t.co/KlExtfCMtk
"RT @InandOfItself: An experience so different, it\u2019ll blow your mindhole. #inandofitself @ActuallyNPH https://t.co/ediyZllUZl"
"Podcast Recommendation: Rabbits. Fictional mystery involving immersive theatre, intrigue and puzzles. Addictive. https://t.co/n3JyhUBkYA"
The @nytimes has written a brilliant piece on @derek_del &amp; the backstory for his upcoming @InandOfItself. MUST READ: https://t.co/8JRLMXvR1O
"David and I just watched the Meet the Queens preview for @RuPaulsDragRace and I'm already obsessssed. YAS, queens, werk! #imissHedwig"
"I just finished my first at home spin class with @RidePeloton. Loved it! Tough workout, great music, fetching instructors. I'm hooked."
"Proud to be part of @OutoftheBoxDoc, about TV\u2019s impact on #LGBTQ history. Join me in supporting this new series: https://t.co/bibEyqK5aI"
We got picked up for Season 2 of A Series of Unfortunate Events. I got this to celebrate.\u2026 https://t.co/7N8ILbxl8m
"A Series of @Unfortunate Events has been renewed for season two. Exciting! Unless, of course, you're a Baudelaire... https://t.co/aqXwxJdZwt"
"Saw @SundayBroadway. Thanks to Jake Gyllenhaal, @theaashford the rest of the brilliant cast and\u2026 https://t.co/NPVjqW3j3V"
I was proud and honored to bike with #teamLuke at the awesome @equinox @Cycle4Survival this\u2026 https://t.co/BpkEqAdd7S
The reinvention of dominoes. Super cool idea on Kickstarter. 10 days left: https://t.co/gI1U6yqsBO
"B'way documentary, worthy of a purchase. @NYTimes named it a Top 10 Film of 2016. @BestWorstFilm is NOW on @iTunes: https://t.co/wuJ3F5utNd"
"I feel bad for all involved: Warren, Jimmy, Marc Platt and the incredible La La Land team. That said, congrats to Moonlight. It's brilliant."
Warren Beatty seems to be opening an envelope that says 'Actress in a Leading Role'. He must have been handed the w\u2026 https://t.co/Wr4QuRaKQX
What the what what?? What just happened?!? How did Emma Stone's name get in a second envelope? Weirdest. Ending. Ever.
I'm loving watching @jimmykimmel host the #Oscars and make it look effortless. He's awesome.
"Well played! You won't regret it, Mr. Famous Handsome Builder Man. https://t.co/iu1ZbbubNC"
"Thanks @jimmyfallon for having me on the show tonight. I'm familiar with the term 'egg on your face', but that was ridiculous. #salmonella"
"May be late to the game, but I'm loooving @Daredevil on @Netflix! Well written/shot, amazing fight sequences and talented cast. #bingeworthy"
So I may be heading back to Vancouver for a while. Anyone have a sweet penthouse in Yaletown that they aren't using..? Digs4NPH@gmail.com
"Happy Presidents' Day, for the most part."
Happy Valentine's Day! I've had a wonderfully relaxing day full of romantic surprises. #staycation #flowers #hotel\u2026 https://t.co/0k5U1BkbWq
Holler. https://t.co/VvDc1rEKGC
"I'm happy that more people get to see this impossibly amazing show. It sold out in LA. Get tickets quick, yo.\u2026 https://t.co/Axvnw4prbq"
I've created the account '@nphfoodporn' on Instagram. If you crave pics of deliciousness give it a follow. Last night's meal is my 1st post.
I'm gagging over @ladygaga and her halftime show. She was everything. Creative and fearless and inclusive. Loved.
"My big brother Brian's birthday was yesterday. A better, smarter, more clever or well spoken brother ne'er exists. Love you @PrettyBlueFox23"
"My friend @DanielVosovicNY just launched THE KIT. A new women\u2019s brand that is the future of designer fashion, fast!\u2026 https://t.co/BMNg372y8Q"
"Excellent time in London seeing @Immersivegatsby. Great cast, great direction, Great Gatsby. Recommended!\u2026 https://t.co/DPWNsrnVmU"
"Thanks, @PasteMagazine for this @Unfortunate article. All who work/ed on the show appreciate it. https://t.co/HYcEFUXRlr"
"Proud of all who marched and/or took action today around the world. It was inspiring and, try as others might, impossible to ignore."
Where should we eat on our date? @bflay restaurant? @Mariobatali? What show should we see? @HamiltonMusical? Hurry! https://t.co/bCVIhdmYRe
"'I have decided to stick with love. Hate is too great a burden to bear.' - Martin Luther King, Jr."
"Loving the positive response for A Series of @Unfortunate Events, especially this one from @nerdist: https://t.co/xYXxFo2aJ8"
I want YOU to come for dinner &amp; a show with me in New York! It\u2019s all to help @CocaCola &amp; @RED #endAIDS. GO:\u2026 https://t.co/XQRNVPA3XR
"Spending an hour with @HowardStern has been a highlight of my year. Granted, it's only 1/11. But still. Thanks @sternshow for being rad."
"Just found out I'm going to be interviewed on @HowardStern tomorrow morning. Very, very excited. Listen if you can, I'm allowed to curse..."
Broadway Riff-Off between @JKCorden and myself. All kinds of good times. @latelateshow @TheFilharmonic @Unfortunate https://t.co/6NqJtDbV91
The pleasure was all mine. Welcome! https://t.co/5uNhqSqxfU
"Watch me get my sing on tonight, Broadway style..! Well played, @JKCorden. @latelateshow #LateLateShow https://t.co/4pfb74bkLD"
Follow this madman: @whoisgreggarcia  He\u2019s funny and giving away money and stuff.
"On behalf of Count Olaf I graciously accept all of these awards, but, umm, with so much range how did they forget B\u2026 https://t.co/5m9uCSZDNP"
"They forgot selfless, charismatic, and brilliant. Will Count Olaf ever get the credit he deserves? https://t.co/IYe3XvGU1u"
"Thank you @Gogo for allowing me to be online while in flight. I appreciate the bandwidth.  That said, I'm just sitting here. Any questions?"
"Happy birthday to the late David Bowie, who would have been 70 today. He was the coolest. Makes me miss Hedwig..."
8 to 800. https://t.co/F9n1FkxJk2
"HA! So am I. You will LOVE it. Okay, clarification: everyone who understands social media should see\u2026 https://t.co/s2MkzSn2El"
"Wowow. If anyone between 16 &amp; 45 loves theatre, they MUST see @DearEvanHansen. Complicated, emotional, original, and oh @BenSPLATT.  Bravo!"
"It was meant for comedy, Stacey. Happy New Year. https://t.co/evHiZsIUMq"
"My 2017 Resolutions: 1) do less, enjoy more. 2) stand tall. 3) take time for reflection, find contentment. 4) fly private more often."
"A great organization, indeed. https://t.co/3ZRigW9UI6"
"Debbie Reynolds played my grandma once, and she was the best. Hilarious, smart, bawdy, kind, classy. Losing her and Carrie this way? So sad."
"So a Bed, Bath and Beyond opened up around the corner. I'm spending way too much time collecting coupons from mail &amp; newspapers. Who am I?!?"
Gidget is really effing cute. https://t.co/F6itLz98BO
"This year, I partnered with @tylenol to celebrate all families and their holiday traditions. We love books! \U0001f46b+\U0001f385+ \U0001f4d6=\u2026 https://t.co/AThQ7CRh8V"
I am so impressed by everything that #themckittrickhotel presents. Go see The Strange Undoing of\u2026 https://t.co/2Pq8YRxDGr
"Hope you dug my digs, @voguemagazine. I certainly enjoyed your barrage of queries. Watch me answer 73 questions: https://t.co/Psrc58wPeS"
I was a fan of Alan Thicke since the Thicke of the Night days. A true class act. It was a great honored to be pumme\u2026 https://t.co/bLNir93kzV
"Good times had by all. Well, by three. https://t.co/Qw4Z8XlG7v"
"Sorry, Tara. I had to rush to the NY Public Library and read holiday books to kids. 'Twas quite the busy day. https://t.co/jB3VYBVlCS"
I did the hilarious @ALNpodcast w/@adamraycomedy &amp; @funnybrad! 'Twas a blast of super random freshness. Get it here: https://t.co/01idhWpjpF
About to go onstage and present at the @CNNHeroes Awards. An unbelievably moving and inspiring night. So proud to be a part of positivity.
Dinner at Red Rooster. Gideon got the ribs. They were the same size as his head. He wasn't scared. #devour\u2026 https://t.co/SGSupyzKgf
Got a surprise visit from the oh so energetic Chrysler Pacifikids who taught me a thing or two about the new\u2026 https://t.co/sZAxhbrQj9
How lovely are thy branches! #trim https://t.co/cN01L0mVLg
"Thankful for @RachaelRay\u2019s generosity, donating $10k to support @animalleague. Follow her pet food brand @nutrish f\u2026 https://t.co/ZnE5A5Q5eS"
"This is either a super cool Haunted Mansion figure I recently acquired, or how I feel when I\u2026 https://t.co/byUGLzoW2V"
"Look, it's a newerer trailer for the @Unfortunate story of a handsome actor and three selfish orphans. Coming 1/13! https://t.co/iDmoll1Kxh"
"A very surreal reality today. It feels like I'm on some strange Netflix show. Oh, wait...\u2026 https://t.co/UhunbyzWcc"
On my way to Comic-com madness in \U0001f1e7\U0001f1f7! #netfliccxp https://t.co/zF2MWv1V6t
YOU could join me &amp; David for dinner and a B'way show in New York! It\u2019s all to help @RED this #WorldAIDSDay. WIN:\u2026 https://t.co/PgSROa3Fni
There's nothing like chips/guacamole and a margarita from @cavadeltequila in the Mexico pavilion at #Epcot. A highlight of the park. #hiccup
"Well played, my good man. #cooties https://t.co/H0cChwAwD7"
Getting in the holiday spirit at @DisneyEpcotUS narrating the #CandlelightProcessional thru Friday. 'Tis a stellar way to start the season.
Musical theatre lovers: a new documentary about #sondheim &amp; #merrily is out and amazing. Support it: https://t.co/aFV4r0HuH4 @bestworstfilm
I love my friends. I LOVE my family. But in some ways they all pale in comparison to the Day-After-Thanksgiving-Dinner sandwich.
Egads! The screen on my camera broke! Just got it in June! @lumixusa is there some way to repair\u2026 https://t.co/VrZcwW6Vrp
It's Black Friday. Support @RED with NPH Playing Cards. Every deck makes a difference in the fight to end AIDS.\u2026 https://t.co/1Bgtkepqja
"I'm thankful for twitter, for social media. For amusing and entertaining. For educating me on stuff that is occasionally accurate. Gobblex2!"
"Ah, the joys of a new dog... This year I am thankful for @Dyson for giving me the ability to be cord-free and\u2026 https://t.co/DqsloWPZsz"
Saw @greatcomet1812. Wonderful staging but there is one reason to see this show: @joshgroban. He\u2026 https://t.co/lDwmZOCh3r
"NPH Playing Cards. Been working on them for over a year. Legendary, premium playing cards for a\u2026 https://t.co/Kve9ZKdEGC"
YOU can help deliver the first AIDS FREE GENERATION. Here\u2019s how:\nhttps://t.co/SUJEyB4S9k
"At long last, the long first trailer for Lemony Snicket's A Series of Unfortunate Events | Official Trailer [HD] ... https://t.co/NEbqXDHXHv"
A new @Unfortunate trailer drops tomorrow. In the meantime take a peek at this Very Fetching Disguise of Olaf's - t\u2026 https://t.co/pe34utdz7P
My @Unfortunate sneak peeks continue in anticipation of Thursday's new trailer. Revel in my rakish Reptile Room rus\u2026 https://t.co/Qf2Q6rnwCR
I'm giving you sneaks peeks all week counting down to the @Unfortunate trailer release on Thursday. Prepare to swoo\u2026 https://t.co/JHT8HlnQpJ
Just got back from a week long @Unfortunate press junket in London and Berlin. Good times. Soooooo... What did I miss?
"""Our lives begin to end the day we become silent about things that matter. - Martin Luther King\u2026 https://t.co/kLKJ7AgWt8"
"L.A. immersive theatre just got deeper, darker, and better with @the_tension_exp show ASCENSION. An awesomely exhau\u2026 https://t.co/WYYU8fp8l3"
Time to meet the incredibly handsome Count Olaf in this incredibly @Unfortunate teaser. Coming to Netflix Friday th\u2026 https://t.co/UEJtECgLIg
\U0001f4fd\U0001f39eHooray for Halloween!\U0001f39e\U0001f4fd#Marilyn #Groucho #Chaplin #JamesDean dbelicious @ Hollywood https://t.co/eev76HpMJ8
"Listen2this: I'm on @ThisAmerLife singing a song as @PRyan, written by @lopezbobby and @Lyrikris10. Thanks @iraglass https://t.co/Pu0m50ULWb"
Egads! It's almost Halloween! I haven't been to a single haunted house or freaky immersive experience this year. Where should I go?
"#TBT to last week - no work, meetings, smartphones, or responsibilities. Just family. Thanks again @clubmedofficial\u2026 https://t.co/poY7GSTzVJ"
Broadway is coming out in force tonight for @HillaryClinton! Tune in tonight at 8:30pm ET for live performances! https://t.co/6hQAZfXTMh
At @clubmedpuntacana we dug their partnership with @cirquedusoleil and took to the skies! #trapeze #CREACTIVE\u2026 https://t.co/F5bxGQDF1f
When theatre meets foodies. Come join the fun: https://t.co/y1f22MbCLF @NYCWFF
"Spent the last four days at clubmedpuntacana. Sun, surf and circus training - for joy we jumped!\u2026 https://t.co/7A3kW9owcJ"
Check out my friends @WhateverHangOut and will_mayo_film 's award winning short film. Here's a Vimeo link: https://t.co/oRsUJOhYkl
"Then congrats, you have options a'plenty! #awesome #lgBt https://t.co/aBSQY9oY3q"
It's National Coming Out Day. If you're a chick who chooses chicks or a dude who digs dudes today's a swell day to let it be known. #allgood
"Bully, good man! https://t.co/2zmEXVcVOH"
"Let's add an old-timey word into our vernacular. My pick: bamboozle. 'He opened the door for me, then took my cab! I've been bamboozled!'"
"Final four hours to order a creepy, awesome, mysterious, literary adventure like no other. A grand and garish gift: https://t.co/lYVeDlqwuw"
It's @Unfortunate and coming to Netflix Jan 13. The incredibly handsome villain Count Olaf is played by yours truly. https://t.co/h5wQsPvuun
I'm really more of a grammar/punctuation whore but that's just me. https://t.co/8JrJ8FEhTJ
25 years strong leads to a lifetime of strong bodies. Happy 25th Anniversary. You've never looked better. @Equinox #Equinox25
So @Davidburtka and I are being interviewed by @gzchef Monday at 7:30 in NYC if you'd rather chat and not debate: \nhttps://t.co/cxS0bAtSbw
"If a video is written and directed by @Joss Whedon and called 'Important', I'd say it's worth a look: https://t.co/P0TETNdKjF"
"Thanks @awallenstein for the kind words in Variety: ""..always seem to be trying so hard onstage that they risk projectile flop sweat."" #ouch"
"Thanks, current cast of @HamiltonMusical for tonight's show. Our 5 year olds loved it - know most of the lyrics. What you do is profound."
Thanks again for putting me up this weekend @Airbnb and @Audi. Wouldn\u2019t have\nminded if it had been this house! https://t.co/FMdCVuoKmO
"Thanks for the questions everyone. And for those who didn't see it, seek out Life's A Party with @Davidburtka on @FoodNetwork. It's rad."
"Good question: JJ Abrams, Amy Schumer, Barack Obama, Amy Sedaris, Nick Jonas. https://t.co/Y5azaxByZP"
RT @ChrisMichaelW: @Davidburtka sure can cook! @ActuallyNPH is awesome. Those kids are cute. Love @KellyRipa  @FoodNetwork  #LifesAParty
Haggis. https://t.co/0xu7lGEk7P
I like a simple citrus vinaigrette. Flavorful but not overpowering. https://t.co/a2pi90miuN
"Be yourself. Judgements are theirs, not yours. https://t.co/R1RcM1r3vD"
"Well played, good man. https://t.co/aLrB9anc7I"
"I did! 'Twas my idea, actually. Turned out well. https://t.co/j0d6FgkOlW"
Only in October. https://t.co/LeZHS2xz3p
"20,000. https://t.co/wvHdaduOeE"
Gideon is quite an amazing sous chef. Harper loves to eat as she preps. https://t.co/kCAj9WUX5t
"Sloppy Joes, I think..? https://t.co/3zKJVbWZAR"
Sharpen the knives. https://t.co/OSDCCgp7PR
"Umm, err, cereal? https://t.co/jHzh9n9tMI"
"20,000 https://t.co/efBVA2290V"
Green chile chicken enchiladas at the moment. Beyond. https://t.co/Qw3jwIPHlr
I WANT to do this! #so proud https://t.co/GKTC1Iz7Sg
"Ok, fine. https://t.co/WdYVADoxFf"
I'm on this very episode..! https://t.co/n1KDpVgmHT
"I'm live tweeting during @Davidburtka's show, starting in 7 minutes on @FoodNetwork. Ask questions about him and the show and such."
My baby daddy has a cooking show! Life's A Party w/ @Davidburtka -watch TODAY at 12:00pm EST/PST on the Food Network. Super proud of it/him.
RT @Audi: @ActuallyNPH @Airbnb Anytime\u2014there\u2019s enough house and horsepower to go around. #LiveToDrive https://t.co/v7bM5foPbJ https://t.co/\u2026
"For moi? Thanks for the home &amp; ride this weekend, airbnb and @Audi. What amazing award\u2026 https://t.co/RDxzbz7G3o"
"Edward Albee passed away. Prolific playwright, Pulitzer Prize winner, friend and mentor to my husband @Davidburtka. He will be missed. #RIP"
"Thanks for the sweet story on @Davidburtka and our family. Come back for tacos any time. Well, any Tuesday... https://t.co/R6MWuTJP2B"
Start your Fun Friday with me and @KellyRipa. Today we fondle my husband's meatballs &amp; I get kicked in the stomach. @LiveKelly @Davidburtka
Happy to be co-hosting @LiveKelly again today with @KellyRipa. Today Colin Firth reveals his accent is fake. Or maybe promotes his new film.
The Mysterious Package Company makes these incredibly cool tactile experiences. Their latest is Filigree in Shadow: https://t.co/NINq1fR59K
I'm co-hosting @LiveKelly tomorrow with @KellyRipa. We're gonna talk physics with Renee Zellweger. Or just talk about her movie. Not sure.
"Proud to be a NYer on this day. I still remember 9/11 in such vivid detail, first dividing and then uniting. Can't forget. #NeverForget"
"The twins' first day of kindergarten. So many feels: excited, nervous, giddy, wistful. But mostly proud. Can't wait to see who they become."
"Gene Wilder passed away. Wow what a lovely career. Wonka, Dr. Frankenstein, Jim the Waco Kid... Sending strength to his wife of 25 yrs. #RIP"
"Thanks @montagebh for making our vay-cay stay in LA so enjoyable. The rooms are classy, the\u2026 https://t.co/mNKLSOS0wX"
"Donald Trump - for Pete's sake (and I don't even know Pete), release your tax returns."
"Some friends are hosting a magic event at Cicada Club in downtown LA. If magic is your thing, check it out: https://t.co/ndp8UJKgz3"
One of the world's best choreographers @sonyatayeh is creating a new show and needs Kickstarter help. Worth a look: https://t.co/f3zqEe4ig4
RT @PrettyBlueFox23: On my brother's recommendation I saw Nick Speegle today.  He's amazing.  A real pro.  I think my back is on the mend n\u2026
My latest obsession: Sugru. Moldable glue that you can shape into anything. It's awesome. Check it out: https://t.co/3SIhRz8fKj
"Albuquerqueans, help! My brother's back is out, ribs locked. Needs professional relief, stat. Suggestions? (Everyone else, sorry to bother.)"
Loved reading this in depth story about @HowardStern in the @nytimes. He really does give great  interview. https://t.co/HxjYx5PV0n
I'm excited to announce I will co-host the 2016 #GCFestival! It should be epic! Take action to earn your tickets\u2014https://t.co/6jULt6McW1
"Last chance to see @derek_del. Must see. As one who loves watching magic, I'm deeply honored to witness his choices. https://t.co/UATBDWphCa"
"In Toronto for the weekend, what should I do? Looking for recommendations: Theatre? Fitness? Restaurants? Massage? Museums? Lemme know."
Watched the Dallas shooting live on TV from Toronto last night. Such trauma. I yearn for positivity in a seemingly endless cycle of sadness.
Today is my father's 70th birthday. Ron Harris is an extraordinary father. I'm beyond lucky to\u2026 https://t.co/ydfs8eOPhk
Yay! Go Amy! #attentionmustbepaid https://t.co/ui0nO0184k
Wow. A light-based Zeotrope. @Colossal curates the coolest stuff: https://t.co/QKfGoGJWO3
Right? I'm on 240something. Lots of boxes. https://t.co/QV50PZXWp5
Awesome. https://t.co/9skLaEKEW0
I can't stop playing Two Dots. Just acquired the Token of Love. Happy Pride! https://t.co/rpMa41KFWJ #TwoDots https://t.co/0vsFCPHUXS
LA: The most awesomest magi @derek_del has extended his 1-man-show again! Breaking records! Brilliant effects! Go! https://t.co/UATBDWGStI
"Happy Pride Ever'one! Open your hearts, your eyes, your minds. All is love, all is good. Stand tall. Smile. Dance. Live life large! #pride"
"Happy Father's Day! I'm so grateful for David being an amazing person, and for his selfless and\u2026 https://t.co/4TppvlXKcD"
Thanks for all the amazing birthday love! You Twitterers are the awesomest..!
"On this day 43 years ago - June 14th, 1973 - my mom was bustin' with baby."
So honored to have been part of the @TonyAwards2016 and @HamiltonMusical 's historic night. Great to be in the room where it happened...
The tragedy in Orlando is just beyond sad. My deepest regrets to all those suffering. There are no words that suffice. I'm...stunned.
"A locked room book? I'm obsessed: Mysterious Cases contain codes, puzzles, letters, and boxes within boxes! Um, yes. https://t.co/cSihdJKKTP"
"Happy Memorial Day. Seems a strange adjective, happy, given the gravity of the occasion. My deep condolences to those who lost a loved one."
"Happy Birthday, @Davidburtka. Every year spent with you seems better and more exciting than the last. May this grand adventure never end..."
Thanks @DrWillKirby for the awesome shoutout last night on @PriceIsRight. You have great taste in words. And game shows. Much love.
"I love flying home for weekends. I do. But if the ENTIRE time is spent building Star Wars LEGOS, is it worth it? Time well spent?@LEGO_Group"
It hides my Olafiness. Thanks for the spectacular night. #fortunate https://t.co/bHhVBhJJ4E
"Ooooh - It's Saturday the 14th! Be careful today: you never know what luck has in stor... Oh, wait. Scratch that. I think I'm off by a day."
"(Non-Tony) Attention Must Be Paid: Big @HamiltonMusical props to @OakSmash, @JasCephasJones and @Anthony_Ramos1 for their amazingness. #werk"
I know I\u2019m not up for any awards... but Siri and I remain optimistic. #iPhone6s https://t.co/MAIuU1Nln5
"Happy Cinco de Mayo, everyone! Celebrate with some tequila - I wouldn't know, but I hear it's delicious."
Another boffo review for @derek_del and his L.A. show In &amp; Of Itself (@GeffenPlayhouse). Grab tix quick! https://t.co/Lb3FXoyQoC
"LAers: One of the best people I know, @derek_del, has a new live solo show. Read this review then get tickets quick: https://t.co/zUcw00jgVd"
"As it's May, the force be with you to donate to @MakeAWish &amp; win prizes. #ForceForChange will double your donation! https://t.co/xERqlotQKN"
Big congrats to @Lin_Manuel and @HamiltonMusical for your 16 @TonyAwards2016 nominations - the most in history. Well deserved! #satisfied
"LOVE Foster Brooks! Oh man, he makes me laugh. Well worth tracking down on the Tube of You. https://t.co/5WrQFJ7e4h"
Too cool for school. But not really - it's just an expression. Kids: stay in school. https://t.co/SVHbV7SxyM
"Working with @Hellmanns+Peppers+Allspice+Coconut=unexpectedly delicious spread. Got my #Strangewich, what\u2019s yours? https://t.co/U2vwKUwQa2"
"Apparently the wording in my last post wasn't approved. Please forgive the ensuing redundancy, and in appreciation expect a kids pic."
"Happy 4/20. (snicker, snicker...) Ooh, a Snickers..! #munch"
Just saw @thatsnotusfilm a funny &amp; touching film about real relationships starring my bud @mpberger. Watch it now! https://t.co/C5U6jOB6k0
YES! YES! YESSSS! Congrats to @Lin_Manuel! #Hamilton won the Pulitzer! So well deserved! https://t.co/Y502peGNlU
"Thanks, Ryan. Nice chatting with you all. Have a great night. https://t.co/8XlR07C3Oh"
Survivor. https://t.co/fZ1uXlc9LB
Hooker Card Rise performed by John Gaughan at the Conference on Magic History. Stellar. https://t.co/GdD5RMba9S
Done. Eleven! https://t.co/XAHPvkiqcr
Bob the Drag Queen. https://t.co/JK3yYprKUI
He's gotta be in the hundreds of thousands. #yeahidid #yeahhedid https://t.co/B34CBin0xO
Fletch. https://t.co/uc1o9fTsic
"Umm, yes. Right. Well said. https://t.co/oR0opAVPCx"
"Nothing at all. Wish more people appreciated its awesomeness, but I wasn't that involv...oh wait, yes I was. https://t.co/j8lofOnXBe"
In production currently. My on/offscreen disposition is getting nastier and nastier. https://t.co/qsAmrAryyE
"Right now? Satisfied. But I'm digging hard on @DaveedDiggs, the Lancelot of the Revolutionary Set. https://t.co/zjPJOB1yKv"
#umm #noKyle #notfromme https://t.co/XeoTYdrPUr
Discourage. Unless it was snuff films. I hear they pay a bundle. https://t.co/NK3Xh06pE9
"They're awesomepants. Love them, but their taste in pants is exquisite. https://t.co/aZsdjgLlkP"
"I'm bored, Twitter. Let's chat."
"If, like me, you like apps and the earth, this is for you. #AppsforEarth raises money for @World_Wildlife. Go to: https://t.co/S2NbbnHWh2"
Kudos: @SParker &amp; @ParkerICI bringing together top scientists &amp; industry partners in #immunotherapy to #beatcancer. https://t.co/xyy44d6qFI
"Well played, @springsteen. You represent the ideals of millions. Hopefully many will value your words and morals. https://t.co/dTBFaF9jD1"
