"Ben Folds Five did a music video with the Fraggles! Two great tastes that taste great together: http://t.co/YrFIRcCh  Good get, @Nerdist"
Formulate your frightening fall festivities fast! First and foremost: Delusion. Fancy a fun informal film? Phuck yeah: http://t.co/0HBmmhNm
Duuuuudes! We just won an Emmy for last year\u2019s Tony Awards!  What whaaaat? http://t.co/pTDbWZcG
This HIMYM monologue took me over seven years to memorize:  \nhttp://t.co/0DJVZbep
"If you love @JaneEspenson as much as I do, YOU MUST CHECK OUT HER AWESOME WEB SERIES NOW!!! http://t.co/ifBN2moi  Here, here! Great show!"
"You\u2019re not gonna believe it, but The Book of Mormon is funny! Like, hilarious funny. I bet it\u2019ll be a hit. Congrats, tour cast. You rocked!"
"On my way to the Book of Mormon opening in L.A.  Can\u2019t wait for the funny!  Break legs, @GavinCreel"
I wish I could move to Vegas just so I could work out at this gym: http://t.co/r85766OG  I want an acrobat\u2019s body!
"Loving the game show brilliance (or lack thereof): 11 Awkward Canadian Game Shows \u2014 http://t.co/Ke3HzgcD  Thanks, @mental_floss"
"It's been 11 years since the 9/11 tragedy. Can't believe so much time has passed, and yet in some ways it feels so recent. #remember"
"Please dig magic. If you liked that last tweet, just wait a few weeks. I\u2019m about to blow your mind hole\u2026"
"People in L.A.: If you like magic, as I do, check out @Justin_Willman and his show at Club Nokia 9/29. He'll explain: http://t.co/AsYyLHlo"
Spent the weekend with the family at one of the most fantastic weddings I\u2019ve ever attended. Good times. So much love.
"Another amazing display of artistry, courtesy of @colossal . This time: cut away art on actual leaves! Unreeeal! http://t.co/gi5MSASm"
Hi Twitterland. Sorry for my lack of tweets recently. Apparently I have babies and stuff. I'll try harder. xo
Check out my good bud @ashermonroe in his new video #HereWithYou on @mtvbuzzworthy\n\nhttp://t.co/Q22eo25y
"Happy Labor Day! Or, since you\u2019re hopefully not working, Happy LayBRO Day!"
It\u2019s a full moon tonight. How ominous. A perfect time to start formulating your scary plans for fall. Might I suggest http://t.co/ixgBjTOs
"Take a look: One man, 100,000 toothpicks, and 35 years - An incredible kinetic sculpture of San Francisco  http://t.co/w2IT31cy"
\u201c@francoberry: no way! Pixar Studios!!\u201d Way. Waaaay.
"Oh man, I just toured what is perhaps the coolest place of all time! Bucket list moment. Almost started crying. #woody http://t.co/0yhncYzy"
I teamed up with Hasbro on Catchphrase - check it out! Don\u2019t dither (or get DITHER in Catchphrase - it\u2019s impossible)! http://t.co/nv429dvD
"Relaxing at the beach, sipping on a drink from my good friend\u2019s company. Cheers! @drinkneuro http://t.co/HsrLDpOc"
"From one Neil to another: You affected the history of the world, Mr. Armstrong. Few will ever achieve that. Rest in peace."
\u201c@istandabove_: Are you acting in it as well?\u201d Depends on the night. Go and find out. :) Never know who you\u2019ll see\u2026 http://t.co/JHB9R5iR
I\u2019m co-producing a terrifying interactive horror play in a 107yr old mansion in L.A! Limited tix per night. Check it: http://t.co/ixgBjTOs
Guess who visited HIMYM just now? Olympic Gold Medalist @McKaylaMaroney ! Here I am pointing at her: http://t.co/UnSipt7R
"Good Morning! G&amp;H are rocking their rad high chairs, about to have pancakes &amp; bacon. A lovely day! @babybjornUS http://t.co/ppBB1mU1"
We have had amazing meal after amazing meal in San Francisco. An embarrassment of gastronomical riches. Food porn pics to come\u2026
Crossing the bridge to San Francisco. Excited to perform in back to back variety shows for @SFOutsideLands later today! http://t.co/1LRiQMDE
"Bret Easton Ellis thinks gay actors can\u2019t play straight roles. Totally unrelated, I thought Christian Bale was amazing in \u2018Welsh Psycho\u2019."
"Had a first rate dinner: @ScarpettaBH  Thanks for the deliciousness, @conantnyc  Food pics aplenty: @NPHFoodPorn"
"Ah, this explains the new necklace and why my legs are so sore..! http://t.co/EB4IU53E"
"Goodbye, Nice! I\u2019ll miss you, fancy vacation! Take care, dream reality! Back to work, driving, and changing diapers. http://t.co/6fsZ0ZDO"
Two sentences I never thought I\u2019d say: I just hung out with Bono and The Edge at Elton\u2019s. All three are spectacularly cool.
I absolutely love the views here in the South of France! :) #District14 http://t.co/9Fxwhhy0
I absolutely love the views here in the South of France! :) #District14 http://t.co/47cGDDjI
Thanks to everyone who called and are supporting the firefighters who saved the Magic Castle. All 150 tickets sold! A resounding success!
Less political: travelogue photos of a dog Maddie and her precarious and absurd situations. Enjoy. http://t.co/McieZy9T
"Federal funded bigotry from my home town, Albuquerque. This one hits home: http://t.co/JQ2IQjQk"
"\u201c@koppitegrrrl: my fiancee just died of leukemia, help me raise money for research with this link http://t.co/A97LttVI\u201d Leukemia sucks."
The Magic Castle is opening its doors for 1 night only to 150 callers to honor the brave firefighters who saved our club. 8/6. 323-851-3313
"And now: Miniature people living in a world of giant food, by artist Christopher Boffoli. Made me smile. http://t.co/eVxRWmmd"
Super random question: does anyone have a contact number for an Air France person at LAX? I left something on a flight and need to find it!
RT @Davidburtka: On our way to the family picnic!  So chic! http://t.co/kSLCjyZ0
"Spending time with the Burtka family in Michigan. I love this part of the country. Great people, beautiful weather. Loving life."
My favorite thing about Paris is the \u2018double kiss on the cheek\u2019 greeting. It is both intimate and disarming. I\u2019m totally stealing that.
"When I am with @DavidBurtka, Paris is steamy and culinarily complex. When I am alone, Paris is rainy and underseasoned. #homesick"
"Annnnnd, scene."
"Ug. What a day. I need a smoke. No matches. There's a lit candle, nice. What's with these cracks in the sidewalk? I'll use the stree - WHAM!"
You won't believe this! The mirror slipped out of my hands and is now cracked! Merde! What did I ever do to deserve all this?!?
"Damnit. Dropped the salt shaker accidentally. Salt is everywhere. Oh well. Not my day, I guess. At least this mirror is still intact..."
I just bought an adorable victorian hand mirror and a small crystal salt shaker - still filled with salt!  What luck!
"Found a cool antique store while walking around Paris. Weirdly, my umbrella won't seem to stay closed while I'm shopping in here. Oh well."
"So hard to tweet while I walk. And all of this construction on the street! Oh, wait. There's a space there under that ladder. Perfect."
"Happy Friday the 13th! Have a great day! Ooh, look - a kitty walking my way. Dark as night. Here, kitty!  Aw man, she went right by me..."
"Looking forward to the new Big Brother tonight. But if there aren't any super hot people that are also cool, I'm out! #MajorTimeCommitment"
"I was very moved by this story when I read about it at @tlrd, happy to hear its becoming a documentary. Support: http://t.co/gebM0oHR"
My great friend and outstanding UK magician @DerrenBrown is finally available to the US via Hulu. http://t.co/3athjTNS Run! Do not walk!
Thanks to @PaulFrankTweets for the very cool kid\u2019s clothes! Gideon really seems to love his shirt. http://t.co/JLZ1FGVM
\u2018Night. It\u2019s late in Paris and I must sleep now. I\u2019m this tired: http://t.co/z0AhZS5D
Broadway costume designer Martin Pakledinaz passed away this morning from cancer. He was a wonderful man and will be missed.
Had the loveliest of evenings/mornings with an even lovelierest friend in Windsor. Exquisite home. One of the gardens: http://t.co/QVMeXhIv
"Taking the train from Paris to London. Am I wrong, or is travel by train the greatest, calmest, classiest thing ever? http://t.co/aJw3IhTy"
\u201c@daddycolebomma: @ActuallyNPH If I had to go gay for one person it would be you dude. #rockoutwithourcocksout\u201d Love it.
Pip pip! I\u2019m in Londontown! The fanciest of pics to follow. Cheers!
\u201c@MrElliottJack: my dad said I looked like u yesterday\u2026Does that make it wrong to have a crush on you?\u201d Nope. Just good taste in genetics.
"\u201c@SteakkWhisperer: @ActuallyNPH I like boobs , can i get a retweet :\u2019)\u201d Totally. Boobs rule."
\u201c@tabret2004: I found the other week you were gay. I refuse to believe it.\u201d You\u2019re wearing a tank top and a cowboy hat. You believe it.
"\u201c@404_no_username: @ActuallyNPH my great grandma turned 95 today, can I get a whoop whoop?\u201d Would she even know what that means?"
.@ireno9 the NE article is bunk. D and I are awesometown. No wedding plans because it\u2019s not legal yet. All is good in our world.
"I think I just worked out next to @MarcJacobs at a gym in Paris. If so, he\u2019s looking great and I\u2019m a fan. If not, other dude has mad tats."
"Paris: Dinner at Kong. Waited an hour for our table, wine uncorked onto my pants, entree dropped on my jacket. Bad form! #tweetpercussions"
"Happy 4th of July, everyone! Enjoy your BBQs, burgers, and freedom fries!"
Paris is not so exciting and romantic when you\u2019re jet lagged and alone. #crankysmurf
"Good for you, @AndersonCooper. You're awesome.  http://t.co/sVvtzIXO"
"Since I\u2019m back in LA, David threw me a belated birthday party today! Thanks @Perrier_jouet for the champagne! I\u2019m D-runk!"
"I love my gym. Just going to @Equinox makes me feel healthier. Working out is hard, yet easy. Plus they supply towels, which I dig."
This is what I yearn for my dreams to look like: http://t.co/WBJEYXTD
My final meal in MTL was an epic sushi feast at Park. Thanks @ChefAntonioPark for your spectacular taste in food! http://t.co/7e8b36cY
"Goodbye, Montreal! I had such a great time - the sights, the food, the people - I think you might be my favorite city in Canada!"
".@athorn90 is still pretty f\u2019in awesome for even doing the first costume. Respect. You, sir, are rad."
\u201c@Colossal: Ukranian street gymnastics: Parkour meets contortionism meets gymnastics meets whooooa. http://t.co/vNvzZeqb \u201d OUCH!
"I love me some dominoes action. Saw this video, called Starry Night by Vincent Van Dominough. Well done.  http://t.co/3PuDz5VN"
"Dr. Will Kirby, the greatest Big Brother contestant ever (and my good bud) is now on twitter: @ReallyWillKirby  Welcome!"
"It's been 18 days, @athorn90 .  Where's my emmer effing clown pic?!?"
Just saw a most creative and inspiring music video. Love it! Gotta watch:  http://t.co/B4UYjnHL
"\u201c@SamEckhardt3: was this for HIMYM, or a movie role?\u201d I'm still filming the Smurf sequel. HIMYM starts back in August."
This was me tonight. I love my job! http://t.co/5O1ti7ts
Ate a gigantic meal at Le Filet in Montreal. Super delicious! I took pics - food porn on its way. Check out the courses at @NPHFoodPorn
I love artist Scott C. (@scottlava) &amp; his Great Showdowns pieces. A book full of 'em comes out soon (foreword by me): http://t.co/siIa75X7
"\u201c@eve1dissolved: need the leather sofa in your living room for my new home! Where can i buy one!\u201d Restoration Hardw, err, totally custom!"
"Mike Tyson is heading to Broadway in a one man show directed by Spike Lee?!? Sweet gods of comedy, now I have to host the Tonys again!"
"And now a most disturbingly awesome video to get you through the rest of the weekend: http://t.co/SOsbrobn  Thanks, @TonySepulveda!"
"Happy Father's Day to all the amazing Daddies and Papas out there, especially this one, @DavidBurtka: http://t.co/UmfvDhSP"
"We had lunch at Park (enjoy the pic), saw the new Cirque show, Amaluna, then dinner at Au Pied de Cochon! Yum! http://t.co/GlJ81UzD"
Thanks so much for all of my B'day tweets! I had a spectacular day in Montreal w/ the delicious @DavidBurtka. I'm liking this 39 stuff!
"\u201c@SweetThang444: If you don't have it, gotta get kinect disneyland adventures for the xbox. You will love it!\u201d Gah! Must have!"
"Other excellent birthday gift suggestions: puppets, skin pics, anything magic or Disney theme park related. Games. Or scotch."
My last b'day gift suggestion didn't fit everyone's price range. Don't fret - you could instead get me this: http://t.co/r24cgeZD
"Congrats to my friend @DanBucatinsky whose hilarious new book ""Does This Baby Make Me Look Straight?"" is now here: http://t.co/U380k3qB"
"My birthday is Friday, so if you haven't already purchased your gift(s) for me, might I recommend: http://t.co/fLjUVZiu"
My great friend is a survivor &amp; has started: Living With Breast Cancer NEW SUPPORT GROUP @ L.A. Gay &amp; Lesbian Center http://t.co/gL9kVSc3
More unreal art! Are you kidding me?!? http://t.co/Df8yERHN
This art is unbelievable! Now I know what I want for my birthday: http://t.co/LXajV49O
"\u201c@dcedillo: The guy sitting behind the Lion King head was unamused by the prank\u201d He was my writer, the hilarious Paul Greenberg."
\u201c@NicoleTesta05: What do you say to a production of Blood Brothers with @Davidburtka starring with you?\u201d Love that idea!
"Ok, off to set. Have a swell, twitterific day."
\u201c@ekwalsh416: How is it being away from David and the kids?\u201d It's the worst part. Miss them like crazy. Thank heaven for FaceTime!
"\u201c@Alexanism: how was it to perform with Ms. Patti LuPone?\u201d She's brilliant, and game for almost anything. Love her!"
"\u201c@NicoleTesta05: Out of all the shows running on Bway right now, which would you want to be in?\u201d One Man, Two Guvnors. Physical comedy gold."
"\u201c@Tamster21: If you could of switched with any of the performers to do their number, which would it be?\u201d James Corden. Physical comedy rocks"
"\u201c@don_vare: Do you get to hang out with trey and matt from the book of mormon?\u201d No, they're too fancy. They shooed everyone away."
"\u201c@amnosjenn: What was with the crowd surfing girl? And the man with the Lion King head!\u201d I wanted some 'WTF, DVR back!' moments throughout."
\u201c@dmmolloy: Did you write any of the jokes?\u201d Indeed.
\u201c@samsvirtuallife: Did you sing the last note of the out of time song for the live audience?\u201d No. Same gag for them.
"\u201c@josieXjonas: did you meet @nickjonas?\u201d I did, backstage. Tried not to gush. Or stare."
\u201c@RedJello: How long was the preparation time from inception of numbers to show night?\u201d Almost a month? Constant changes and refinement.
\u201c@shaygabby: How long did it take you to rehearse that opening number?!\u201d 3 days? Rob Ashford's staging &amp; amazing backup dancers helped a lot
"\u201c@CulbeK: did you write the songs?\u201d No, David Javerbaum &amp; Adam Schlesinger: opening and closing. Michael John Lachiusa: mid show mashup."
\u201c@caseyimperial: What does Steve Kazee smell like?\u201d Heaven.
"\u201c@Chris_M_Stern: what's next for you?? Any features?\u201d Yup. I'm back in Montreal, still filming the Smurf sequel."
\u201c@CinWicked: How uncomfortable was the Spiderman rig?\u201d Not so bad when upside down. Upright? Hulk Smash!
Finally got some rest. The Tonys are over! Had a blast. Thanks so much for watching! Happy to answer any questions...
Theatre Report: saw Evita. @Ricky_Martin sounds great. But Rob Ashford's musical staging was superb. Best part of the show.
.@TheTonyAwards are tomorrow. I really should start preparing something...
"I was a huge Mr. Rogers fan growing up, and still am. Love this new remixed,  groovy, autotuned tribute: http://t.co/YkLMu1nM"
Here's a nice article from the Hollywood Reporter about preparing for @TheTonyAwards: http://t.co/5qEYdPXe
"Haven't been able to tweet in a while as I'm neck deep in @TheTonyAwards prep, and rehearsing all this Spiderman wire work is taking MONTHS!"
"\u201c@EricTheActor11: @actuallynph When does the next Smurfs start?\u201d Filming now in Montreal. Out next year, I think."
"\u201c@EricTheActor11: I watched American Reunion today I didn't realize that you were in it.\u201d Indeed I was, Eric. Thanks for watching."
"\u201c@deadair311: just curious, will you ever post a negative theatre report?\u201d Not during Tony week. But I do choose my words very particularly."
Theatre Report: Saw Newsies. I'm a diehard and loved. @CGattelli 's choreography was spot on. Easily the best dancing on B'way right now.
AND thank you @Oprah for your gift:  Wine! @Davidburtka and I drank all 6 bottles &amp; promptly passed out. #deeeelicious http://t.co/aEM8gXmc
"Thank you, @Oprah, for that interview. You represented the day with positivity, accuracy and respect. Watching our parents was so emotional!"
Theatre Report: saw Clybourne Park. Loved. Kind of can't stop pondering it.  I suspect it'll be performed around America for years.
@ItsJennysTurn Well done.
"Theatre Report: saw Once. Intimate, heartfelt, emotional. @SteveKazee was truly great."
.@TheTonyAwards are one week from today. I really should start preparing something...
\u201c@athorn90: http://t.co/dTEMMzSG\u201d Well done. Picture 2: Circus clown. Head to toe. Full make up. Colorful wig. Silly nose.
@athorn90 Picture 1: Entire body covered in plastic wrap. But not just wrapped around you body - each extremity fully wrapped.
"\u201c@ezinder: @athorn90, I think us followers now have a completely legitimate vote on what pictures to ask for."" }} Agreed. Bring it."
\u201c@athorn90: @ActuallyNPH if you retweet this I will post 3 twitter pictures of whatever you want me to do in the picture. Not a lie.}} Done.
"Theatre Report: saw End of the Rainbow. Tracie Bennett rules, shouting and popping pills and belting out tunes. Made me miss my mom. I kid."
Theatre Report: saw Porgy &amp; Bess. Totally unfamiliar with the show - blown away. Best performances I've seen by Norm Lewis &amp; Audra McDonald.
LA friends: Buy tix now for a special screening for #rockofagesmovie w/Adam Shankman to benefit The Trevor Project: http://t.co/LgK7Fvp8
Here is one of my dishes from dinner: @ChefAntonioPark in the background. I love me some sushi. http://t.co/LArvJGvd
Great day. Ate another spectacular meal at @ChefAntonioPark. Unfortunately I'm filming all night long. So late night tweets are appreciated.
Maybe everyone should ask @OzBoateng to dress me for @TheTonyAwards. That seems to be the consensus.
"I Iove this British designer Ozwald Boateng, but D&amp;G is great. Paul Smith, too. I'm getting nervous for show time."
"\u201c@GarrettGrantham: @ActuallyNPH hey Neil, you wanna hang out in northern virginia?\u201d Umm... based on your pic, probably not."
What tux should I wear for @TheTonyAwards? I need to pick a great designer... Suggestions?
An awesome @DavidBurtka YouTube Birthday Mash up: http://t.co/GqhzfTqt \nThat dude's rad.
"Happy Birthday to You!\nHappy Birthday to You!\nHappy Birthday, @DavidBurtka,\nHappy Birthday to Yoooou!\n(I don't have to pay royalties, do I?)"
"It's officially @DavidBurtka 's birthday!! I'm in Montreal and can't be with him, so any well wishes that you can send would be appreciated!"
"A heartfelt thank you to all of the men and women who serve(d) in our military. What you did, and continue to do, is awesome."
"RT @derek_del: A violent sport, a delicate thing, a blind man, a blackout and a beautiful waste of life.  http://t.co/LCR78PzW"
"\u201c@Speezer13: I'm not picking sides but I show you wasted your 1000th tweet on Allyn too.\u201d  BURRN!: (thanks, @cmsugrad ) http://t.co/enqMCOJq"
"\u201c@Allyn101: @ActuallyNPH err, according to this, you aren't quite there yet... http://t.co/lSxKD1NK\u201d   Burn!: http://t.co/0NuHMCUZ"
My 1000th tweet!  Let's celebrate!   http://t.co/6zmzt5LD
This video made me laugh. I think I've found my new favorite catch phrase.  http://t.co/BVPlc52Y
\u201c@pubey3k: @ActuallyNPH This is my first time tweeting you and I DON'T want a reply ;) #ReversePsychology\u201d But... Wait... But...
In the Just So You Know Department: incessantly tweeting me to respond to you will almost assuredly achieve the opposite result.
"Theatre Report: saw Peter and the Starcatcher. Wonderful show! Inspired &amp; inspiring. Amazing troupe of actors. Stars, all of 'em. Catch it!"
Last night I had the honor of hosting a celebration of the brilliant @sleepnomorenyc 's 500th show. Loveliest people ever. Don't miss it!
"Theatre Report: saw matinee of Best Man yesterday. Great production, excellent cast. Perfect timing for a Presidential revival."
I just now came across this amazingly creative music video. http://t.co/kwIGjsZo  Be sure to also watch the making of. Super cool.
@trishlackey :)
Theatre report: saw Death of a Salesman tonight. Beautifully directed. What the actors go through each show..! It's masochistic.
Theatre Report: Saw the matinee of Nice Work If You Can Get It.
"Theatre Report: just saw One Man, Two Guvnors. Loved it - easily the funniest play on Broadway. Howled with laughter!"
"And now, to counterbalance the seriousness of my previous tweet, here's a video of a woman vacuuming her cat: http://t.co/wa4qy1RM"
An important read: http://t.co/SetAkNFb
Back in NYC for a few days to see shows and prep for @theTonyAwards. Gorgeous day! I love love love this town!
"Donna Summer passed away today.  Same day as Jim Henson, 22 years ago.  In honor of both: http://t.co/DfZNfexL"
Brilliant and hysterical: Gale-Force Winds Directly to the Face http://t.co/LcSnlBc3 via @itscolossal
"Today @thejoelstein 1st book, Man Made, comes out. I\u2019ve been told it\u2019s great. Albeit, by Joel. http://t.co/Y3KPuxlA #ManMade"
Loving the kind tweets and positive reaction to last night's HIMYM season finale! Thanks! Here's my favorite: http://t.co/Qs2qVR5T
"HIMYM season finale tonight! Back to back episodes, Barney's bride revealed, lots of magical surprises! I may even be naked. Do watch."
"Happy Mother's Day, @GladSheila. You are an amazing mom, a wonderful grandma, and a beautiful human being. Love you so much!"
"Oh my god. I just revealed that my mother eats people. On this, of all days. What have I done? What have I DONE?!?"
The more boobs the merrier!  Click here and let me give your mom Breast Wishes for Mother's Day! http://t.co/Bye7UXht @noreenfraser
"Every time I watch @KellyRipa these days, I just feel like she's cheating on me. #toopainful"
Oops. Wrong account. @NPHFoodPorn to continue...
2 nights ago I had another wonderful meal at Park. Just go and sit and let @ChefAntonioPark rule your world. Here's what I had:
"Course 1: Duck Tataki Salad w/ fresh watercress, garnished with shaved parmesan. Also yuzu caviar on a spicy pickle! http://t.co/ZbtCGqAo"
"\u201c@BarackObama: President Obama announces his support for same-sex marriage: http://t.co/MPfIBIUy\u201d  Bravo, Mr. President, and thank you."
"\u201c@BravoAndy: Psyched about #AroundTheWordIn80Plates premiere tonight!"" Me too! I love me some @catcora. Will it air in Canada?"
\u201c@Toooshie: Or members of the Pink Ladies and the T-Birds.\u201d Or Ninjas. Or modern dancers. Their futures are so bright!
"This, from yesterday. I miss my twins! Apparently they will grow up to be either bank robbers or mimes: http://t.co/7T04ds3P"
North Carolina passed Amendment One. Unbelievable.
"Happy birthday, @breckinmeyer.  You're awesome."
"@beaslma or....or.... watch these Dominos fall down :-) http://t.co/284S1DTZ  Ooh, hoo hoo.  Better.  Thanks."
"Ok, back to emails.  Or The Vow, can't decided.  Thanks for helping pass the inflight time.  xo, n"
@tkmlac How has your experience as a child actor helped you in your development of Barney?  Hard to answer in 140 characters. I'd have to sa
"@lexbarbershop Getting a NPH hug is on my bucket list, because I think autographs are dumb. Approval? Yes."
@LIZZYloveFINNY HAVE YOU EVER READ BED TIME STORIES TO YOUR KIDS??? Please stop shouting at me.
"@LizzyCody Cheese or Chips? Chips, tortilla.  With salsa, Pace picante sauce (medium)."
@timdaker What is the best thing you have had in your mouth ever?? Err\u2026 umm\u2026 next question.
@MouradLaila If you could act with anyone who would it be? Christopher Guest.
@Bonovox1984 Favorite Drink? Cold sake. Or an Old Fashioned. Or a pina colada. Or a mimosa. Or a margarita. Wow. That was revealing.
@MeganNormansell What's your favorite smell? Hawaiian flowers or the smell in the air while on Pirates of the Caribeean.
"@98RealStella If you could have any super power, what would it be? Teleportation. This airplane seat smarts."
"@schartrand77 Are we ever gonna see Scooter on HIMYM again?!  I sure hope so! Or a spin off, perhaps?"
"@delinage do you like HIMYM finale? Are you happy about it?  It's gonna be rad, yeah. Shouldn't dissappoint."
"@XOchrissy3 if you had to be any type of car what would it be, and why?  Inspector Gadget's Matra Murena, cuz LA traffic blows."
@carmenluigina Favorite author? Obsessed with Clayton Rawson at the moment.
@Bish93 If you tweet me I vow I stay up all night watching how i met your mother and nothing else!  Challenge accepted..!
@RBruceKerr Was it hard to decide to adopt? Didn't adopt. Went with surrogacy. Extremely happy with the outcome(s).
@Monkee_Ce if you could sit beside any superhero right now who would it be? Mandrake the Magician.
"@Killertvmd In your opinion, which of Doogie Howser's love interests was the hottest? Wanda Plenn. Her lips were amazing."
"@AliBSmith going to Vegas soon. What's the best show to see? Cirque: O, KA, Zumanity. Other: Absinthe (loved), La Reve. Magic: Penn &amp; Teller"
@couger8 what's the hardest roll that you acted in?  I'd have to go with sourdough. Freshly baked. Painful.
@foote_k why are you heading out to montreal?  Filming the Smurfs sequel. Already missing the family...
