RT @leonsearcy72: @JebBush was pushing 4 digital equality in 2001! I was w/him then &amp; I stand with him now!#allinforJeb #MLK2016 https://t.\u2026
NEW VIDEO: Ensuring every child has access to a quality education is the great civil rights challenge of our time.\nhttps://t.co/v7CrBH18yl
Our failing education system is threatening the American dream. My plan to ensure every child has the right to rise: https://t.co/qvcGVlBi2B
Our nation forever changed for the better b/c Dr. Martin Luther King Jr. stood up for freedom &amp; opportunity for all. https://t.co/c1J2k3WE10
Fact: @HillaryClinton and @realDonaldTrump have had the same views on ISIS. #DemDebate https://t.co/fj1JVPpS9p
Most passionate moments of #DemDebate are always about who will ban more guns &amp; who will give the gov't more control over your health care.
My record: 1.3 million new jobs. $19 billion in tax cuts. 8 balanced budgets. #DemDebate\n\n@HillaryClinton\u2019s record: https://t.co/0qjgw4UVzN
Berniecare vs Hillarycare is a debate without a difference. They\u2019ll both double-down on government controlled health care. #DemDebate
This is how @HillaryClinton would spend her first 100 days as president. #DemDebate https://t.co/dGW8rgpZ2W
RETWEET if you agree: We can\u2019t afford 4 more years of @HillaryClinton\u2019s failed liberal agenda. #DemDebate\nhttps://t.co/SMRMYQt4Vs
Will @HillaryClinton still insist we\u2019re \u201cwhere we need to be\u201d in the fight against ISIS at tonight\u2019s #DemDebate?\nhttps://t.co/M1j336EVuA
VOTE before tonight\u2019s #DemDebate: Would @HillaryClinton be President Obama\u2019s 3rd term or even worse?
.@HillaryClinton would force a liberal agenda at the expense of religious freedom. I\u2019ll protect this sacred right.\nhttps://t.co/fX1AIYufVx
Here\u2019s why @LindseyGrahamSC joined our team following last week\u2019s debate: https://t.co/5sKigeKgPR
"Thanks to the First-in-the-Nation voters who joined us at our town halls in Hollis, Amherst &amp; Hampstead this wknd! https://t.co/H2klfODhdU"
"Today we mark National Sanctity of Human Life Day as declared by Ronald Reagan. As president, I\u2019ll stand up for life and the unborn."
".@realDonaldTrump claims to be a conservative, but none of his actions align with conservative values. Watch:\nhttps://t.co/Mlxxq4KZcx"
Gave a pep talk &amp; took some team photos before the big Hollis-Brookline vs Hampstead game today! https://t.co/bYYrkBMP0V
Got in a snowball fight today at St. Anselm\u2019s in New Hampshire. Find me on Snapchat to watch: jebbush https://t.co/gAaZdSpHIt
Character matters. Is this the kind of person you want as President of the United States?\nhttps://t.co/pqIYnMbqhB
Prayers answered as American hostages coming home. Await more details on swap. They never should have been held at all.
".@POTUS marks Nat\u2019l Religious Freedom Day on the calendar, but he\u2019s been hostile to our 1st freedom at every turn: https://t.co/SgzOBaUe7F"
"As president, I\u2019ll always defend our 1st freedom. Watch our new video in honor of National Religious Freedom Day:\nhttps://t.co/nQfFjgkCJF"
"RT @chelsiphenry: Last evening, I chatted w/ @LindseyGrahamSC. He is endorsing the most qualified person in the race, @JebBush! #2016 https\u2026"
RT if you agree: @HillaryClinton would spend her first 100 days going from the White House to the courthouse.\nhttps://t.co/0heweSSJ1u
Ready for another swing through the Granite State! Join us: https://t.co/1u5sOtccwD\nhttps://t.co/xfVvhjFsxq
Religious liberty must be respected &amp; protected. Read my new @NRO op-ed on how I\u2019ll stand up for our 1st freedom: https://t.co/Xna6paPhnU
NEW VIDEO: Tomorrow we honor National Religious Freedom Day. I\u2019ll fight every day to protect this sacred right.\nhttps://t.co/rZPdhiMAF6
Great night in the Palmetto State for the #GOPDebate. Watch a recap of the highlights:\nhttps://t.co/i4dwWxMl8X
Here\u2019s my pledge: I will campaign with heart and conviction about the need to protect our national security and restore American leadership.
I\u2019m not a cut and run politician. Leadership requires moving towards the problem rather than moving away from it.\nhttps://t.co/ZmFtucZeVc
"Praying for the 12 Marines missing off Hawaii. At home or overseas, they do a dangerous job with great courage. https://t.co/O6pQf1MlUm"
WATCH: \u201cJeb is going to be a nominee that can win an election that as a party we can\u2019t afford to lose\u201d - @GrahamBlog\nhttps://t.co/qOAQNcdJwD
Proud to have @GrahamBlog's support. Help us build on our momentum by joining us today: https://t.co/hrDWteCQjd
RT @LindseyGrahamSC: I\u2019m endorsing @JebBush for President this morning. He\u2019s prepared to be Commander in Chief on Day 1. WATCH: https://t.c\u2026
Special announcement happening now from South Carolina with my friend @GrahamBlog! Watch live here: https://t.co/6BaAz4tRo8
Honored to have @GrahamBlog on our team. A proven leader with a clear understanding of the national security threats we face.
"RT @foxandfriends: ""My record is an open book, [Hillary's] is one where we have to get it pried out by an FBI investigation."" -@JebBush\nhtt\u2026"
"RT @foxandfriends: ""Is that how you lead the free world? And the answer is no."" @JebBush on Trump making divisive statements\nhttps://t.co/P\u2026"
My record is an open book. @HillaryClinton\u2019s record needs to be pried out by an FBI investigation.\nhttps://t.co/5VcgtBddYm
"NEW VIDEO: Together, we can build a safer and stronger America. #GOPDebate\nhttps://t.co/lBTdEvHEH8"
"RT @connorpfeiffer: Great debate for @JebBush, another demonstration that he is the serious candidate with a real record in the field #GOPD\u2026"
"You can count on Jeb to keep us safer, stronger and freer. Join us \u2192 https://t.co/LcE1kpwahf\nhttps://t.co/nCR0gxLb9J"
Fighting between backbench senators explains why people are frustrated with Washington. #GOPDebate\nhttps://t.co/cSO2FQfI62
"We need leadership, someone with a backbone. We don't need backbench senators arguing over amendments that never passed. #GOPDebate"
"""We need a president who will fix our immigration laws &amp; stick with it - not bend with the wind."" - Jeb #GOPDebate"
RT @Anthony_itf: @JebBush is sounding incredibly presidential tonight. #OurNextPresident.
Chip in $1 to stand with Jeb while he's on stage. #GOPDebate https://t.co/IKQxXug0Zp
Jeb\u2019s tax plan:\n\u2714 $2k tax cut for middle-class\n\u2714 Eliminate loopholes\n\u2714 3 Tax Brackets\n\u2714 Simplify tax code\n#GOPDebate
We need someone with a steady hand to be President of the United States. #GOPDebate\nhttps://t.co/7b7bEDo99s
"Ban all Muslims? Seriously, @realDonaldTrump? #GOPDebate\nhttps://t.co/X4FVoc8NZi"
"Jeb was the first candidate to put forward a comprehensive, serious strategy to destroy ISIS. #GOPDebate https://t.co/TRNJvXSzhy"
"Jeb to Donald: ""Every time we send signals like this we send signals of weakness not strength."" #GOPDebate"
"Yes, you are unhinged, @realDonaldTrump. #GOPDebate"
"As president, Jeb will stand with Israel. #GOPDebate https://t.co/KvPUQYpSgU"
Our planes are older than our pilots. Jeb will rebuild our military for the 21st Century. #GOPDebate https://t.co/oSvpbxGV4g
Jeb has the strongest record of defending the 2nd Amendment out of anyone on stage at #GOPDebate. See for yourself: https://t.co/mWCVBgX9rx
"""The 1st impulse of Barack Obama &amp; @HillaryClinton is to take rights away from law-abiding citizens."" - Jeb #GOPDebate"
"Our country can rise up again, but we need to have a compelling conservative agenda. Here's Jeb's: https://t.co/V9jER8jNFp #GOPDebate"
Here's Jeb's plan to rebuild our military and restore American leadership around the world: https://t.co/YrSfc9gGjC #GOPDebate
Jeb will have our military's back as Commander-in-Chief. #GOPDebate\nhttps://t.co/6tnUzJKkuj
Here's how @HillaryClinton would spend her first 100 days as president. #GOPDebate https://t.co/DLjZ7vuBU2
.@HillaryClinton would spend her first 100 days going from the White House to the court house. #GOPDebate
Team Jeb taking over! Follow along with us for tonight\u2019s #GOPDebate \u2192 https://t.co/KaAUqae0cf
Honored to have Medal of Honor recipient General James Livingston as our #GOPDebate guest tonight. https://t.co/mFNiIv4ND2
"It\u2019s the first #GOPDebate of 2016, and I\u2019m asking for your support. Chip in $1 to say you\u2019re with me: https://t.co/IKQxXug0Zp"
My vision and proven record is a stark contrast to the failed policies of @HillaryClinton and Pres. Obama. Watch:\nhttps://t.co/WMz2TgfZ8b
Is this the kind of person you want as President of the United States? #GOPDebate\nhttps://t.co/8lVWym04zR
"Before the #GOPDebate, learn about the conservative solutions I\u2019ve outlined to our nation\u2019s greatest challenges: https://t.co/40dQNqm5YI"
"After 7 years of historic cuts to our military &amp; a weak foreign policy, I\u2019ll restore America\u2019s role in the world: https://t.co/qmhFdq3uto"
".@realDonaldTrump lacks the leadership, integrity &amp; character worthy of the Oval Office. It\u2019s time to say: Enough.\nhttps://t.co/oVSG0zC9Yp"
We can make a difference in the fight against drug addiction. It just takes leadership.\nhttps://t.co/r1IeKjMBiF
.@realDonaldTrump is unfit to lead this country. Here\u2019s why: https://t.co/vmtktjNF0Z
We\u2019ve seen what happens when a president has no record of accomplishment. Here\u2019s mine:\nhttps://t.co/kkMArvNJqD
What kind of person mocks someone with a disability? Not the kind of person deserving of the presidency.\nhttps://t.co/HWzkRw5YBe
"For the 1st time in history, more U.S. businesses are failing than starting up. I\u2019ll get our economy back on track. https://t.co/tGKomFRfjr"
Are you on our team for the first #GOPDebate of 2016? Grab your official campaign gear: https://t.co/seXEPtXfs3
Thanks @djkhaled \u2014 had my green apples for breakfast https://t.co/aPiA7askZ8
"NEW AD: At what point do we say, enough?\nhttps://t.co/qAX7cz8pRz"
"South Carolina voters are taking a stand for proven, serious leadership. Watch:\nhttps://t.co/pkNwRoFZVz"
"After tomorrow\u2019s debate, we\u2019re off to New Hampshire! Find an event near you: https://t.co/lyL9ldmXNR https://t.co/KHnlUt4Yqz"
RT @mad4holly: Great new ad by @JebBush.  His best ad so far &amp; perhaps the best of the whole campaign.  #AllInForJeb https://t.co/Icb2Xdnq2z
You can join Sammi by signing up for #MissionNext here \u2192 https://t.co/4dv3HBHmU5 https://t.co/g7iTxI5hCO
Our support among Florida conservative leaders continues to grow. Proud to welcome these state reps to our team: https://t.co/z17wqxlM7R
I\u2019ve felt the heartbreak of addiction as a Dad and I can see it in the eyes of those that have gone through it too.\nhttps://t.co/cL3mrRs8tR
A fight for conservatism is a fight worth having and a fight I intend to win.  https://t.co/LMNZFGuU2c
Stopped by the IA Capitol this morning. Great catching up with Gov. @TerryBranstad &amp; meeting with state legislators. https://t.co/WFnSzm0VVD
Cybersecurity is national security. We can\u2019t trust someone to be POTUS who didn\u2019t take it seriously as Sec of State: https://t.co/90z10SInNk
Talked with Iowa voters at the Westside Conservative Club over breakfast. Thanks for joining me at the Machine Shed! https://t.co/CDYmlGAgey
The incompetent Obama Administration has failed our veterans. Here\u2019s how I\u2019ll ensure they\u2019re well provided for: https://t.co/miwRfqSmV9
"There\u2019s a solution to the heartbreaking epidemic of drug addiction, but it requires leadership. Watch our new ad:\nhttps://t.co/GtpQCdsHLj"
I joined @foxandfriends this morning to share my response to Pres. Obama\u2019s #SOTU &amp; his failed foreign policy. Watch:\nhttps://t.co/6GHxFmT5HV
Proud of my friend @nikkihaley for delivering a positive &amp; uplifting response to Pres. Obama\u2019s #SOTU. Clear vision for a brighter future.
Safer? ISIS on the rise. North Korea testing nukes. Syria in chaos. Taliban on march. This president is living in a different world. #SOTU
"They're not just ""killers and fanatics."" They're radical Islamic terrorists. Still can't call them by name. #SOTU"
It appears Obama is still under the impression ISIS is the JV team. Next President must understand the enemy and the threat. #SOTU
"Middle-class income has declined $2,000 under Obama's failed policies. That's not progress. That's not giving everyone a fair shot. #SOTU"
The economy might be the best this President can do. But it's not the best America can do. #SOTU https://t.co/3s6HCb8348
7 years of empty words. America deserves better. #SOTU https://t.co/XVcdHg9OfM
President Obama is living in a different world to think our country is safer and stronger. #SOTU\nhttps://t.co/NxWokQwaPW
The State of the Union: less secure than the day @POTUS took office. His legacy will be leading from behind. #SOTU https://t.co/MZFxuXyBAr
"After 7 years of President Obama\u2019s failed foreign policy, we need a Commander-in-Chief who is ready to lead. #SOTU\nhttps://t.co/eiJh5nVeO1"
You won\u2019t hear it at #SOTU but we\u2019re at war w/ radical Islamic terrorism. Here\u2019s how we win: https://t.co/VOWD6VBRXa
"If our sailors aren\u2019t coming home yet, they need to be now. No more bargaining. Obama\u2019s humiliatingly weak Iran policy is exposed again."
I have a comprehensive strategy to defeat ISIS. President Obama should take notes before tonight\u2019s #SOTU: https://t.co/1XTXm2C773
.@POTUS &amp; @HillaryClinton\u2019s liberal agenda has failed. We need new leadership. That\u2019s why I\u2019m running for president.\nhttps://t.co/JvgwDhrCyb
"Toured Brownells Firearms Manufacturing &amp; talked about defending 2nd Amend. Thank you Grinnell, IA for joining us! https://t.co/18JPlcxEMM"
Hugs for Hawkeyes on the trail today who braved the 2 degree weather! https://t.co/kgon0nEq0R
My conservative record of delivering results is unmatched in this race:\nhttps://t.co/dh6PKhSYAy
Proud to announce our Sportsmen\u2019s Coalition committed to sharing our message about defending the 2nd Amendment: https://t.co/ovZtVZ51bp
It\u2019s great to have Admiral Natter on the trail with us in Iowa today. Proud to have so many veterans on our team. https://t.co/QdHsme4BSP
What\u2019s the biggest failure of the Obama presidency? Vote before tonight\u2019s #SOTU:
"IOWA: We\u2019ll be in Coralville, Grinnell and Ankeny today. Get the details here &amp; join us: https://t.co/9ndCsoe5VF"
Trump's pal Putin deploys missiles that threaten NATO airspace. More evidence of failed Clinton Reset https://t.co/ExW7F4cJzW
Learn more about my welfare reform plan to expand opportunity for those stuck in poverty in the Obama-economy: https://t.co/CQ3wgsaRH7
"After 7 years of leading from behind, we need a president who believes in American leadership.\nhttps://t.co/Bt4jHuM1iY"
"I was humbled when Tim Dyar, a South Carolina small business owner, reached out to share his story &amp; join our team:\nhttps://t.co/vXY4TDcsP1"
My conservative record of leadership and results is a clear contrast to @HillaryClinton. https://t.co/yUNIBW2EWn
"This is the war of our time, and a struggle that will determine the fate of the free world.\nhttps://t.co/q7Fj7XaYXC"
"21 days to go, Iowa! Join Pieter &amp; sign up to volunteer \u2192 https://t.co/glA7ObOKgc\nhttps://t.co/EOEdkjDMtT"
Congratulations @SpeakerUpmeyer on your historic achievement today! We\u2019re all rooting for you.
No other candidate has put forward a more comprehensive set of policy solutions. Here\u2019s where I stand: https://t.co/R4UKGGVnL2
"One day, three town halls. Find out when &amp; where to meet us on the trail in Iowa tomorrow: https://t.co/STBDNgCA0r"
.@HillaryClinton considered instigating Palestinian protests against Israel? A colossally stupid &amp; vile policy. https://t.co/cGveZJNcI4
Get caught up on our latest swing through the Granite State:\nhttps://t.co/W0kQNNk2su
"Meet my friend, Breylen.\nhttps://t.co/gUx7eeyhff"
The Obama-Clinton-Trump position on foreign policy: weak\nhttps://t.co/fUYfqFuknX
"Every day, more and more First-in-the-Nation voters are joining our team and supporting proven leadership.\nhttps://t.co/Q34I0HuahI"
Gen. Hayden &amp; Former Secretary of Homeland Security Chertoff on my clear vision to defend America &amp; keep us safe: https://t.co/cDbVqjZQA0
Great article by @Heritage Foundation\u2019s David Shedd on why I\u2019m prepared to restore American leadership: https://t.co/sR6wYmhX3v
"This was so nice \u2192 ""I lived in Florida for 25 years and you were the best governor we've ever had.""\nhttps://t.co/kvTSZAUcuU"
".@realDonaldTrump is no conservative, and if he\u2019s the nominee he would hijack the conservative cause.\nhttps://t.co/50l33jft0O"
Thanks to the 700 South Carolinians who joined us in Hilton Head last night! https://t.co/Hcs0E4TKxV
Thanks for your support Kevin and Darlene! https://t.co/nnxFARe684
NEW VIDEO: Appreciate all the support in the Granite State this week. An inside look at some of the highlights:\nhttps://t.co/Q5Sva89Mhb
How to fix the mess in DC: Balance the budget. Don\u2019t pay absent politicians. 6-year lobbying ban.\nhttps://t.co/hxrEvdNaV3
"Join us in Hilton Head, SC today to hear my vision to get our economy back on track &amp; restore American leadership: https://t.co/eF1ZlZbwgm"
An honor to join others in standing up for life at the South Carolina Citizens for Life rally today in Columbia https://t.co/BkaCEEodEG
"At #KempForum16, I talked about how conservative policies lift people up. It just takes the right leadership. Watch:\nhttps://t.co/YhJlLL2eCY"
Thanks @PRyan &amp; @SenatorTimScott for the thoughtful dialogue at #KempForum16 today. We need conservative solutions to restore opportunity.
Sat down w/ @PRyan &amp; @senatortimscott today and shared my plan to expand opportunity &amp; reform our welfare programs:\nhttps://t.co/3BXcKZUvzB
We\u2019ve spent trillions on the \u2018War on Poverty\u2019 with little to show for it. It\u2019s Washington that's holding us back. https://t.co/BuiKFJ1I28
"We can do better, and we must. Conservative policies are the answer to expanding opportunity https://t.co/BuiKFJ1I28 https://t.co/5Nz57AcaN9"
"@grace_paschall I'm marking you down as neutral. Maybe after a few more tweets like this, I'll win you over in time for primary night!"
@shesa_MAZ_ing nice meeting you! Good luck on Monday!
In Clemson Country tonight. Beat Saban! https://t.co/mykCHo0ATw
"On the ground in South Carolina tonight and can feel the momentum building. Welcome to the team, Chad!\nhttps://t.co/Mw7QH5j5kV"
"Looking forward to our town hall in Hilton Head, SC tomorrow! Doors open at 4 pm. Get the details here: https://t.co/eF1ZlYTURM"
I\u2019ll be at the @kempfoundation forum tomorrow talking about conservative solutions to expand opportunity. Join us: https://t.co/oYqNLmHWTG
"What\u2019s the difference between @realDonaldTrump\u2019s ""foreign policy"" &amp; the Obama-Clinton team\u2019s?\nhttps://t.co/tTA0WnfWJv"
I\u2019m the only candidate w/ a comprehensive plan to repeal Obamacare &amp; enact conservative reform for the 21st century: https://t.co/aJnWPIASdX
Next year we\u2019ll have a new president. We need a nominee who can defeat @HillaryClinton &amp; finally repeal and replace Obamacare.
Praying for Officer Hartnett. Threats from homegrown radicalism continue to grow. We need a president who will lead the fight against it.
My advice for liberals and communists: Take an economics class.\nhttps://t.co/VfFBv2YJ62
6.8 million more Americans are living in poverty today than when @POTUS took office. The simple fact is the progressive agenda has failed.
"Plans for your Friday night? Join us at Dyar\u2019s Diner in Pendleton, SC. RSVP here: https://t.co/ezeMm0vNb2"
.@HillaryClinton &amp; the Democrats may be fine with the current status-quo of dependency &amp; poverty. I\u2019m not. My plan: https://t.co/BuiKFIK7aA
Talked with @seanhannity yesterday about how @HillaryClinton lied to families of Benghazi heroes. Listen here: https://t.co/6Y22Cnu1EB
Wrapped up a 3-day swing through New Hampshire. 400 strong in Peterborough last night! https://t.co/cjgHDFjZeG
Millions of Americans are stuck in poverty in the Obama-economy. Here\u2019s my plan to reform our broken welfare system: https://t.co/BuiKFIK7aA
Some of my favorite pictures w/ vets from the trail. Proud to have so many on our team in SC https://t.co/KCrJhmyJ7k https://t.co/4pblxGPD82
"Whether it\u2019s Iran holding US citizens hostage or Cuba holding a US missile hostage, Obama always caves. I won\u2019t. https://t.co/gBeK6lYL3z"
.@realDonaldTrump doesn\u2019t know what the nuclear triad is. @HillaryClinton won\u2019t modernize it. I will. https://t.co/F3sUPWd2Xl
".@TayaKyle, wife of Chris, gave thoughtful defense of 2nd Amend tonight &amp; asked @POTUS tough questions. Take a look: https://t.co/7gIXor3LYd"
We\u2019re at war and @POTUS is focused on more gun control. I\u2019ll protect the 2nd Amendment &amp; take the fight to ISIS.\nhttps://t.co/Ga3fkMs7XF
Hope my dad didn\u2019t mind me talking up his 71st anniversary plans. #JebNoFilter\nhttps://t.co/ficra8bpwM
Joined @FoxNews to discuss the greatest threats facing the U.S. in the 21st century:\nhttps://t.co/xXocwdHNsi
"Together we\u2019ll put an end to the atrocities at PP in 2016. It starts by defeating their candidate, @HillaryClinton. https://t.co/1ApgaHtfkR"
The 2nd Amend is the original Homeland Security Act. I fought to protect it as governor &amp; I\u2019ll do so as president.\nhttps://t.co/KKxnjjhoNg
"NEW VIDEO: When it comes to ISIS, @realDonaldTrump sounds just as wrong and weak as the Obama-Clinton team.\nhttps://t.co/RPuAZyEGHS"
Today marks 25 days until the Iowa Caucus. Join our team &amp; meet me on the trail next week: https://t.co/6N9pmCuUNS
"There\u2019s still time to RSVP for our town hall in Peterborough, NH tonight! Details here: https://t.co/1XBDJwXpYl https://t.co/fpboMtDe0h"
Stopped by L3-Insight Technology in NH this morning &amp; shared my vision to rebuild our military for the 21st Century. https://t.co/5AqJdPUgJX
North Korean nuclear test underscores the need to reverse Obama\u2019s defense cuts &amp; rebuild our military. Here\u2019s how: https://t.co/32jA2PusV5
"After 7 yrs of the Obama/Clinton foreign policy, we need a Commander-in-Chief who\u2019s ready to lead &amp; take out ISIS.\nhttps://t.co/LMQ1JV9OTD"
"Great crowd here in Meredith, NH tonight! Talking about everything from school choice to national security. https://t.co/ubCx7KBUll"
"My motto is listen, learn, lead. Take our survey to let us know where you stand on the issues at stake in 2016: https://t.co/upTUcEYi5Q"
We must restore our place as the leader and indispensable power of the free world. This is how we get there: https://t.co/UbYrXMSYsZ
"If @POTUS is serious about reducing gun violence, he should look to Florida. We did it while protecting 2nd Amend.\nhttps://t.co/dwkCICNHDm"
New on my Snapchat story: Wishing Mom and Dad a Happy Anniversary. Add me to check it out: https://t.co/wmqVVeNfR2
"Yesterday in New Hampshire, I talked about President Obama\u2019s naive &amp; incompetent foreign policy towards Iran. Watch:\nhttps://t.co/S7nhsfaEAI"
"Happy 71st Anniversary, Mom and Dad! Your love and commitment has always been an example to all of us. https://t.co/CZk6UZtOQU"
Stopped for breakfast in NH &amp; met a fellow space nerd. 7th grader Zacharie asked about my plans to restore NASA. https://t.co/nSRFoSAvwT
Join us and Commit to Caucus today \u2192 https://t.co/rc2tD5Qa4G https://t.co/YPGOjCDyjj
"President Obama\u2019s Syria policy: ignore growing threat, abandon allies, embolden adversaries, kick can down the road. https://t.co/3UmMHt2JGL"
Gov Ducey made a fantastic appt. Clint\u2019s respect for the Constitution &amp; commitment to federalism is second to none. https://t.co/OFpkpNilga
North Korean nuke test https://t.co/zNW3xU9cZD shows danger of continuing feckless Obama/Clinton foreign policy.
We\u2019re on Snapchat! Add us for snaps from the campaign trail: @jebbush https://t.co/c0WwJM0eqR
Spoke w/ Pat Robertson about my commitment to appoint conservative judges who strictly adhere to the Constitution:\nhttps://t.co/RchNWSdss1
We\u2019re safer because we have law-abiding citizens who are packing. I responded to @POTUS\u2019 exec actions in NH today:\nhttps://t.co/qsjW8YLiXM
Spoke with @SimonRadio1776 this morning about how Donald Trump would destroy the conservative cause. Listen here: https://t.co/ccU8ftjbON
Stakes in this election couldn\u2019t be higher for gun owners &amp; individual freedom. I will always defend the 2nd Amend.\nhttps://t.co/WgoXd1sPY0
"My personal story of how I fought the drug epidemic as a governor, and experienced it as a father: https://t.co/FzLASsKb88"
"As president, I\u2019ll make solving the complex problem of drug addiction a priority. That includes securing the border. https://t.co/FzLASt1LZG"
"We lost one of our finest today in Afghanistan, prayers for his family &amp; those injured. Grateful for all who serve. https://t.co/1k5gDysnXM"
Today is another reminder that we can\u2019t afford to give @HillaryClinton the opportunity to expand on @POTUS\u2019 gun-grabbing agenda.
Today Obama proved again why he\u2019s 1 of most liberal &amp; divisive presidents in history. I\u2019ll repeal his exec orders &amp; protect 2nd Amend.
Read my op-ed in @gazettedotcom today: Pres. Obama's executive orders trample on the 2nd Amendment. https://t.co/4O6CFL1exA
NEW VIDEO: I will fight as hard as I can against any effort by Pres. Obama to challenge our 2nd Amendment rights.\nhttps://t.co/zdiunpuwDd
"Our policies in FL reduced drug abuse. Today in NH, I\u2019ll outline my plan to combat the heroin epidemic nationwide.\nhttps://t.co/Y6jioNypcM"
