Tune in for my interview with @FacetheNation tomorrow at 10:30 am to hear my strategy to defeat ISIS &amp; address national security threats.
"Hotty Toddy, @CoachHughFreeze! https://t.co/iASEqQ9K5E"
RT @Austin_Barbour: Mammoth crowd showed up to see @JebBush in the Junction in Starkville. https://t.co/JBl3U5k8CQ
Great seeing you at the Egg Bowl Lt. Governor @tatereeves! https://t.co/hQLxLnLrfr
RT @tatereeves: @JebBush has been a conservative leader on education reform &amp; raising student achievement. Enjoy your visit to the #EggBowl!
"Good luck in your final home game, Dak https://t.co/DSkI3ru47N"
Touring the field with @MStateCRs Chairman Gavin King &amp; getting the GameDay rundown from Mark Keenum &amp; his family. https://t.co/2mzoDkz02c
"Colleen, would love to have you on the team \u2014&gt; https://t.co/Baj7xKWxtl https://t.co/VEO8PFHKda"
RT @larafrie: We are #allin4jeb in the Junction @JebBush #HailState https://t.co/nr7rcpZSFN
Couldn\u2019t resist the cowbell in Starkville. https://t.co/N9nImqJDEw
Stopping by @TheLittleDooeys for some Southern BBQ before heading to the Junction! https://t.co/sS8xToC9RK
"After years of reckless defense cuts &amp; leading from behind, global challenges facing next president will be profound https://t.co/LJrl1Bmpy7"
"Hoodies, koozies, camo hats &amp; more \u2014 it\u2019s all still 20% off! Show you\u2019re on our team with our official campaign gear https://t.co/KFwYRhL6g4"
Had a blast with UGA IX in Athens. Heading to Starkville to see some different SEC Bulldogs &amp; the Rebels!\nhttps://t.co/fwGYPKQAyk
I\u2019ll reverse the failed Obama/Clinton foreign policy. Read my new op-ed in New Hampshire\u2019s @ConMonitorNews: https://t.co/LJrl1Bmpy7
Can\u2019t wait for the Egg Bowl tomorrow! Come tailgate with us: https://t.co/61mNHuYEfL https://t.co/f8cOvfK8R8
Football &gt; Shopping. But you should still check out our online store for 20% off: https://t.co/XzJoDOJaYl
I hope everyone had a wonderful Thanksgiving with family &amp; friends. Now it\u2019s time for some football!\nhttps://t.co/OyHbNsnRZ2
"God bless the @USMC. As Commander-in-Chief, I will ensure they maintain their edge over all enemies. https://t.co/UlZKMTMLTc"
"Giving thanks for all the blessings God has given us. From my family to yours, Happy Thanksgiving! https://t.co/RwDiS5JDZX"
.@POTUS has been trampling all over the Constitution with the terrible Iran deal. I discussed with @hughhewitt: https://t.co/F88UAB2SvX
Tune in for my conversation with @hughhewitt at 6 pm ET: https://t.co/dpv062iuAB https://t.co/LBW6HtCaEe
I match up best against @HillaryClinton b/c I have a proven track record \u2014 strong contrast to her failed leadership. https://t.co/3NLCeUMpFP
It\u2019s simply baffling that President Obama views climate change as a bigger threat than radical Islamic terrorism.\nhttps://t.co/fvJCQJChHi
I\u2019m especially thankful for our troops overseas &amp; their families here at home as we prepare for Thanksgiving:\nhttps://t.co/wk8yZ4c9IO
A trip to Spartanburg isn\u2019t complete without a stop at the legendary @BeaconDriveInSC! Thanks for having us. https://t.co/CBnFCLRxF7
"Nice meeting you, Jamie! Thank you for supporting @SalvationArmyUS &amp; making a difference in your community. https://t.co/LG9PVfXVPq"
We shouldn\u2019t need the British to spot us choppers. We should have the most cutting-edge military in the world. https://t.co/XwCO4R2qgW
We can no longer tie the hands of our military &amp; make it harder for them to fight. We need a strategy to defeat ISIS\nhttps://t.co/ImH3mm0Hnq
Just spoke to President-elect Macri of Argentina. Impressive vision for Arg people; I\u2019m optimistic about prospects for US-Arg relations.
"Thanks for your support, Gov. Ridge. We need proven leadership in the White House. https://t.co/wNXnArSDu6"
I\u2019m going On the Record with @greta tonight to discuss national security &amp; my plan to defeat ISIS. Tune in to @FoxNews at 7 pm ET.
1st actions I\u2019ll take as President: Repeal Obama\u2019s regulations. Move US embassy to Jerusalem. Close embassy in Cuba.\nhttps://t.co/tisrlAHW2Q
"RT @Frank_Underwood: @JebBush You're welcome, Jeb. Heritage is worth saving. #peachoid"
Excited to announce our Louisiana leadership team. We're committed to victory on March 5: https://t.co/0FNb9jlTBJ
Destroying ISIS starts with American leadership. Listen to my NH Today interview with @JackHeathRadio: https://t.co/5pzF6GLKZR
Obama\u2019s na\xefve nuke deal exposed again as Iran ramps up cyberattacks on US. Mullahs don\u2019t go quietly into the night. https://t.co/ieYl1C74TD
My #RedKettleReason: I give to follow Christ. https://t.co/LcNde5AyiU
Kicked off the #AngelTree Program in Greenville. Visit your local @SalvationArmyUS &amp; support kids in need. https://t.co/iWaMWm3eQt
"Confirmed: The Peachoid is still standing. Thanks for saving it, @Frank_Underwood. https://t.co/fKsAbr0s7B"
"The B-52, the backbone of our bomber fleet, took its 1st flight when Harry Truman was President. https://t.co/mFfYyRo9au"
"""We need someone who believes in those serving in uniform and gives them the capability to get the job done.""\nhttps://t.co/W45ZdDi2Uw"
South Carolina: We have events in Spartanburg and Rock Hill today. Join us \u2014&gt; https://t.co/yS9yoHe1sg
\u201cThat kind of executive experience is what\u2019s needed in the White House.\u201d\nhttps://t.co/u3mvAYAl5u
"If @HillaryClinton &amp; @POTUS want to criticize individuals over Syrian refugee crisis, they should look in the mirror https://t.co/k1PBOrwMcN"
Here\u2019s what these Medal of Honor recipients want in their next commander-in-chief: https://t.co/poduDteQtI
Colonel Leo Thorsness stopped by the office &amp; was sporting one of my favorite store items: https://t.co/j4nXlodhNm https://t.co/qQFpm3xTiW
You would be hard-pressed these days to find a U.S. armed forces member who feels DC is doing right by the military. https://t.co/4mc4zi2Wx6
"Thanks for your support, Marshall! https://t.co/wkx70BoTZA"
Getting excited for the Egg Bowl this weekend! RSVP to join the tailgate: https://t.co/VpWvaIP2ro
"If you missed my @WMUR9 interview with @JoshMcElveen that aired Sunday on my plan to destroy ISIS, watch it here:\nhttps://t.co/kjWaWGpsUG"
Joining @wkxlnhchris with New Hampshire\u2019s Concord News Radio this morning. Listen live at 10:05 am ET: https://t.co/xAIG3CPLs1
We asked a few of our supporters why they\u2019re #AllinForJeb. Here\u2019s what they said:\nhttps://t.co/VcMP14OnuL
There\u2019s a lot at stake in 2016. What issues matter most to you? Take our quick survey: https://t.co/rkaE0aBn27
Thank you @mggwaltz for your service to our nation &amp; your support for my strategy to restore U.S. leadership. https://t.co/krlo5BJOEB
It was great to have @abelmaldonado speaking to caucus-goers at our Reno office this weekend! https://t.co/UzEI2IO6JD
Obama Administration has allowed America\u2019s naval power to decay. Vice Admiral Bill Burke on how I\u2019ll restore it: https://t.co/bBQviMKqKL
Looking for more college campus leaders like Jimmy! Sign up: https://t.co/kS9kYL3FwX https://t.co/cEOKUzAYja
"Samantha, you can join the team here: https://t.co/svfLpXUfiW We\u2019d love to have you! https://t.co/bFZjkbni7s"
"""Right now, this nation hungers for leadership."" \u2014 Colonel Jay Vargas, Medal of Honor Recipient\nhttps://t.co/0AMrFxxfQF"
"You\u2019re invited: RSVP for your chance to join me for dinner on the campaign trail, all-expenses paid. https://t.co/TF7Qby21iH"
"We face a stark choice: rebuild our military &amp; start leading again, or allow our global influence to further erode. https://t.co/xDt89Gtjja"
Americans don\u2019t need lectures on compassion from @HillaryClinton &amp; @POTUS who have failed to address Syrian conflict https://t.co/lQkn1kp5yA
We need a commander-in-chief who is ready to lead on day one. I\u2019m ready.\nhttps://t.co/fv68b0ObtQ
"This is the war of our time, and a struggle that will determine the fate of the free world. Here\u2019s the path forward: https://t.co/xDt89Gtjja"
"These men and women are the future of our nation. As commander-in-chief, I\u2019ll have their back.\nhttps://t.co/17FOLlw9re"
ISIS has declared war on us and we\u2019re treating it like a law enforcement exercise.\nhttps://t.co/2lKoOUyk7I
Read my new @NRO op-ed on the need to restore our role as leader of the free world and rebuild our military forces: https://t.co/nBdzd3fhk6
Radical Islamic terrorists despise freedom &amp; everything we stand for. We must be vigilant in protecting the homeland\nhttps://t.co/wwZSXPsBXD
Americans have had enough of poll-tested politicians like @HillaryClinton. That's not leadership.\nhttps://t.co/T2JsifUnm7
"We must be resolute in this fight, but that doesn't mean abandoning American values.\nhttps://t.co/bj45JskHXg"
Breakfast of champions at @foxandfriends... @dominos https://t.co/Loe5KGe3nE
Headed from @MariaBartiromo to @foxandfriends at 720. Talking horror in Mali &amp; need to defeat radical Islamic terror https://t.co/0N3lvEG5nw
@alfiansibarani thank you!
@Soojin_Yoon @PassengerShame That's not ok. But resolving this issue is a job for you and your fellow passengers not the government
@kyork20 @Dyn good to meet you. Jokes were funny-ish!
@nhkevinsmith was a great town hall. Look forward to getting back to Londonderry soon
Ready to lead.\nhttps://t.co/YTCEI5PQOo
"It was a privilege to be there, Tom. Thank you for your service in the @USNavy. \nhttps://t.co/R43zVWTQPT"
Latest piece of evidence that Obamacare must be repealed: https://t.co/rc1YyGxxwK My plan to repeal &amp; replace it: https://t.co/mYfBFrCJzl
"Praying for the recent victims of Palestinian terror. We must stand with Israel, and against all forms of terror. https://t.co/W0UEtMRoQs"
Set a new precedent at @Citadel1842 yesterday. You can\u2019t give a speech to cadets without first doing some PT: https://t.co/o5FrATtQgq
"Taking questions at our town hall in Londonderry, NH tonight. Stop by if you\u2019re in the area: https://t.co/PgRBf9JqAy"
"I thank these top American military leaders for their support, but more importantly, for their service. https://t.co/pC5RjhF7I2"
It\u2019s official. I filed for the New Hampshire primary #FITN today. Let\u2019s go win this thing! https://t.co/QqtyqGs4LN
\U0001f418\U0001f418\U0001f422 https://t.co/uZUztnc1nr
Dunkin drive thru #2. Caught up with Victoria and Jacqueline about school. https://t.co/QSHmaaHsVr
I'm in. God Bless America. https://t.co/YGlsiSJZls
"Thanks for hosting, Jeremy! https://t.co/vkuFUubsST"
Best place for an interview with  @Newsmax_media? Dunkin drive-thru in Concord. Filing at NH state house next! https://t.co/6bXOFoT7J5
"Touring Dynamic Network Services in NH, a tech company at the forefront of American innovation. https://t.co/MU1Ww64i9C"
Couldn\u2019t have asked for a better audience yesterday. Leaders dedicated to this country's future. https://t.co/wUl1CzO9UD
Humbled to have the support of these Medal of Honor recipients &amp; American heroes. Watch our new video:\nhttps://t.co/6oHCJDCpHR
"Defending our national interests always involves risk, but greatest risk of all is the risk of military inferiority https://t.co/uTXLCraJVZ"
The fate of millions and the cause of human freedom itself all depend on the decisions we make in the coming years. https://t.co/uTXLCraJVZ
We can\u2019t withdraw from this threat or negotiate with it. We have one choice: Defeat it.\nhttps://t.co/OqFGaRp4pe
"We don\u2019t need to be the world\u2019s policemen, but we must restore our place as the leader of the free world. https://t.co/uTXLCraJVZ"
"I will work with Congress to rebuild our military forces: 40,000 more active-duty soldiers and 4,000 more Marines. https://t.co/nnVDlzbPrb"
Next president will take office after an 8-year drawdown of American military power. My plan to restore it: https://t.co/5HJa8JNlIU
We will not allow our pilots to fly 20th century aircraft into the face of 21st-Century air defenses. https://t.co/4L14OvR684
.@POTUS\u2019 defense cuts have weakened our standing in the world &amp; undermined our national security. I\u2019ll restore them. https://t.co/XZU34wCIQk
Paris attacks are a reminder of what\u2019s at stake in this election. We are choosing the leader of the free world.\nhttps://t.co/MeOXYblz18
"Spent some time with two American heroes before taking the stage, Lt Gen Rosa &amp; Captain Paluso. https://t.co/uyoEBtqjYJ"
It was a privilege to address the cadets at The Citadel today. Read my remarks here: https://t.co/uTXLCraJVZ https://t.co/bvf7KII1IT
"Today at The Citadel, I\u2019ll share my plan to defeat ISIS &amp; rebuild our military. Watch live at 12 PM ET: https://t.co/1byNfZosxb"
We need a fierce force to defeat ISIS. This is not a law enforcement exercise.\nhttps://t.co/MclUncuBT6
We must restore American leadership. That requires restoring our armed forces. https://t.co/Kbg7mCP4f4
.@HillaryClinton\u2019s approach to ISIS is nothing but wishful thinking. America must step up and lead.\nhttps://t.co/MjcSeLC7Ic
"In The Citadel spirit, got to the Parade Deck early this AM and went for a run w/ the Summerall Guards. Go Bulldogs! https://t.co/o8HOx8DtAg"
.@JohnKerry\u2019s comments sum up the left's distorted view of barbaric Islamic terrorism.\nhttps://t.co/Vqk5iWX9Ge
Want to grab dinner? Add your name for your chance to win:  https://t.co/TF7Qby21iH
Stay tuned for my speech at The Citadel tomorrow on rebuilding our military in light of Paris attacks. https://t.co/J3U7y1S6zG
".@BobbyJindal is a good, conservative, policy-focused governor. Am confident he will continue to play an important role in the party"
"Clinton wants us to ""empathize"" with terrorists. Kerry sees ""rationale."" Wrong. This is a barbaric ideology. https://t.co/nkpdFpfzxg"
A terrorist caliphate the size of Indiana can\u2019t be contained. It must be destroyed. https://t.co/kxJVUNMYPx
"Today in South Carolina, I spoke about the leadership role America must play to defeat ISIS. Watch:\nhttps://t.co/KAqBXX9anH"
Thanks for the welcome and the BBQ @WhollySmokin https://t.co/2LT4SMIkMe
The story you missed about @realDonaldTrump when we cut to commercial break at the debate: https://t.co/F0dVkK6wiV
"If America doesn\u2019t lead, who will? @HillaryClinton couldn\u2019t be more wrong on this. Here\u2019s the contrast:\nhttps://t.co/vZNG1IOfjZ"
"I was on @foxandfriends, @meetthepress &amp; @CBSThisMorning yesterday to call for a strategy to destroy ISIS. Watch:\nhttps://t.co/R6XbismesI"
Taking our campaign to the Palmetto State today. Meet me on the trail \u2014&gt; https://t.co/Rj7aKBSQjZ
"We can either continue @HillaryClinton's weak foreign policy, or we can change course. That\u2019s the choice in 2016.\nhttps://t.co/O9aSzKmsiT"
"Instead of cutting benefits for poor retirees, Jeb proposes raising them https://t.co/3rxcKLLgrm"
"We need to start leading again. In August, I laid out a strategy to defeat ISIS. @POTUS needs to follow suit.\nhttps://t.co/DcBIUzlHH0"
Now is the time to boost our intelligence efforts \u2013 that includes restoring the NSA Metadata program to keep us safe\nhttps://t.co/vmHuYi7ZsI
"Unlike Obama Administration, I stood up for the intelligence community: https://t.co/o9KfrBCxMz"
"CIA Director is warning Congress weakened NSA, but President Obama was the one who signed the bill into law. https://t.co/Z8A1CRoXS3"
"Congrats @SchuetteOnDuty, newly elected @RepublicanAGs Chairman. And thank you @PamBondi for your leadership in fighting federal overreach."
.@HillaryClinton &amp; @BarackObama think mullahs go quietly into the night. \n\nReality check: They don\u2019t.\nhttps://t.co/q0On9YNlO9
We should have no empathy for radical Islamic terrorists. We should destroy them \u2013 plain and simple.\nhttps://t.co/qSNge6vKnD
President Obama doesn\u2019t understand we are at war. Defeating ISIS requires America leading and America winning. https://t.co/OBawzKIRaF
Obama Admin has no strategy to defeat ISIS but is obsessed with closing Gitmo. This is Alice in Wonderland logic.\nhttps://t.co/vg8RHenpfc
ICYMI: I joined @meetthepress on Sunday to call for American leadership &amp; outline a strategy to defeat ISIS. Watch:\nhttps://t.co/0sjATTcOQr
"For generations, American-led alliances have defended freedom. This is the only way forward.\nhttps://t.co/aszAMNfqOn"
"We have to be in this fight, there is no other option. We can\u2019t run out the clock on ISIS, we need to take them out\nhttps://t.co/zKt8J0I38L"
This isn\u2019t a law enforcement exercise. We must declare war on ISIS.\nhttps://t.co/7IM5kGRkbl
A policy of containment isn\u2019t going to stop ISIS that\u2019s growing like a pandemic across the Middle East.\nhttps://t.co/K5VUnu7lL0
"This is our fight. Defeating ISIS requires the strength, unity &amp; resolve that only American leadership can provide. https://t.co/l7ZiayXw30"
"If you\u2019re ready for a president who believes in US leadership, you didn\u2019t find one at tonight\u2019s #DemDebate. Join us: https://t.co/KaDIFO963R"
I addressed this at the Reagan Library in August. Threat of radical Islamic terrorism demands US leadership. https://t.co/EdZPkq6yGB
"Yes, we are at war with radical Islamic terrorism. #DemDebate"
ISIS is Assad's responsibility? Clinton proposes more leading from behind. World needs us to lead from front. #DemDebate
"A powerful message from our academies. There is no doubt, our armed forces will stand with France. @USNavy @USArmy https://t.co/9RbcisOJSe"
I'll be on @CNNSotu at 9 AM ET tomorrow &amp; @meetthepress to discuss Paris terrorist attacks &amp; need for US leadership. Hope you can tune in.
The terror attack in Paris is part of an organized effort to destroy Western Civilization and we must defeat it https://t.co/MGBV2NTyxs
Praying for Paris tonight. America will stand with you against terror.
.@HillaryClinton grades on a curve apparently when she says @BarackObama should earn an A. \u2014 Jeb at #SunshineSummit
Back in the stomping grounds. Looking forward to reuniting with Floridians for the Sunshine Summit! Watch live: https://t.co/RESAGtwb3j
Stopped by Franklin VFW this AM to talk about the need to take care of our veterans &amp; restore American leadership. https://t.co/7JC1zZIohS
Another cute supporter. Get a onesie for your little one here: https://t.co/0euioR8Dye https://t.co/YaSAuGTcvH
When it comes to Obama-era regulations \u2014 we need to repeal every single one of them.\nhttps://t.co/63Qx4avNHy
Are you in? Join us today: https://t.co/aOYdBtnhIs\nhttps://t.co/8rQFZJxpm3
This was a first. https://t.co/QnErj1pN0r
Always great to be in Michigan \u2014 I\u2019ll be back soon! https://t.co/Oqn0s1ly8G
"RT @mattmayberrynh: .@JebBush taking every ? from education to heroin @BBBNH barn, well done @nhkillion @NathanSLamb #nhpolitics https://t.\u2026"
Heading back to the Granite State tonight! RSVP for our town hall in Franklin tomorrow \u2014&gt; https://t.co/sEiQlj8AWk\nhttps://t.co/nZLvtqXC0l
It was a privilege to have Colonel Leo K. Thorsness with us in IA yesterday. Honored to have him on our team. https://t.co/9Akuf09ajW
"In a @HillaryClinton Admin., ""the losers will be the poor parents and children who Democrats claim to represent."" https://t.co/4KUuG20962"
Why doesn\u2019t @HillaryClinton care about families trapped in failing schools? I discussed w/ @SenScottBrown this AM https://t.co/1bWY9C8AEv
Cheers! Thanks for hosting us. https://t.co/oSWxuRjOl1
Can\u2019t make my town hall in Grand Rapids? We have you covered. Watch live here: https://t.co/5VC1z4wacI
Heroes like Capt. Groberg are the reason we\u2019re the greatest country in the history of the world. Thank you for your service. #MedalOfHonor
The Waukee Fire Department was a great spot for our Veterans Day town hall in Iowa. Thanks for hosting @dcgopia! https://t.co/QHBYQLM2qM
Back in Pure Michigan today. RSVP for my town hall in Grand Rapids this afternoon: https://t.co/7D77ub1Nvd
"Apologies to die-hard Cyclone fan @ddkochel, but the Hawkeye hat made an appearance on the campaign trail.\nhttps://t.co/evx1Wxcza4"
We should all agree that it\u2019s time to put an end to the VA\u2019s incompetence. That\u2019s what I\u2019ll do as president.\nhttps://t.co/VFS4Eq61Bg
RT @UNH4Jeb: Door knocking through the rain in Dover with the UNH for Jeb team #AllIn4Jeb  @JebBush @JebBushJr @kierstinkoppel_ https://t.c\u2026
.@HillaryClinton &amp; @BarackObama don\u2019t believe in American leadership. I do.\nhttps://t.co/1sgVhs1uGt
We put together a few of our favorite moments from last night\u2019s debate &amp; can\u2019t decide on a favorite. Vote here: https://t.co/s8kd8htfhO
I\u2019m humbled to have Sen. Bob Dole\u2019s support &amp; grateful for his service. An American hero with a remarkable story: https://t.co/EdA73o9YTp
"My Dad is the greatest man I\u2019ve ever known. Today, I\u2019m incredibly proud of him and all our veterans. #VeteransDay\nhttps://t.co/aZiDMNfQ9N"
I\u2019m heading to Michigan tomorrow. RSVP for our town hall in Grand Rapids here: https://t.co/7D77ub1Nvd
A tribute to Dad and all those who have worn the uniform to defend our freedoms: https://t.co/RYOj5kXLA7 #VeteransDay
I took the fight to @HillaryClinton last night. Vote on your favorite moment here: https://t.co/s8kd8htfhO
Spent the morning meeting veterans in Iowa and serving coffee. Appreciate @HyVee for honoring those who have served. https://t.co/FJkxif2Si1
"Last night, I drew a clear contrast between my conservative vision &amp; @HillaryClinton's failed policies. Watch:\nhttps://t.co/EB94BxZvwq"
Honored to welcome Sen Bob Dole to the team as National Veterans' Chairman. Thankful for his service to our country. https://t.co/zwIKvwaH3g
Iowa friends: I\u2019m heading to HyVee in Johnston for #VeteransDay breakfast! Swing by: https://t.co/GBjzRCSLFU
"God bless those who have served &amp; their families. Today &amp; every day, we thank you for the sacrifices you\u2019ve made. https://t.co/AEtiUi8Mid"
Milwaukee's Best:\nhttps://t.co/NDbzB3874V
Help me build on tonight\u2019s #GOPDebate by joining the team now: https://t.co/lCeRBeMHS2
"If you agree it's time for a commander-in-chief, not a divider-in-chief, join us today: https://t.co/MLPji980C9\nhttps://t.co/p3RSg7ZiOC"
Jeb: We Need a Commander-In-Chief That Will Respect Our Veterans #GOPDebate
.@HillaryClinton &amp; @POTUS think we should lock up our energy resources. Jeb will embrace them. #GOPDebate https://t.co/FIm50AsBmi
.@HillaryClinton will double-down on failed policies. Jeb will get the economy back on track. #GOPDebate https://t.co/WZTvcnxUwt
Commercial break! Check out our online store &amp; get 10% off before midnight. #GOPDebate https://t.co/MA8sXdSqz3
Vast DC overreach has created a huge problem for this country. @HillaryClinton wants to double-down on that. - Jeb #GOPDebate
.@HillaryClinton and @BarackObama don't believe in American leadership. Jeb will restore it. #GOPDebate https://t.co/ngxBhPCPpG
Syrian Americans and families like Nora's are waiting for America to step up and lead. #GOPDebate\nhttps://t.co/RL89tJ7SK0
"""We're not going to be the world's policeman, but we sure as heck better be the world's leader."" - Jeb #GOPDebate"
American leadership is desperately needed right now. Jeb will restore it. #GOPDebate https://t.co/sJtAWgxbq7
.@HillaryClinton wants a top-down economy. Jeb will give money back to American families. #GOPDebate https://t.co/s61d5yfbPI
RT @TravisBrauer: #AllInForJeb all the way from #Oklahoma!!  @JebBush is the ONLY candidate with the experience to better America! https://\u2026
".@HillaryClinton doesn't believe we can grow at greater than 2%, Jeb does. #GOPDebate https://t.co/CH5Ryk9EFk"
Here's what Jeb's tax plan means to Reagan in South Carolina: https://t.co/nz8NLqwObr #GOPDebate https://t.co/gl1w1Iankg
"Awesome! Here's where you can donate, too: https://t.co/XSVwQ4nUQg https://t.co/pxzJ5cOHTz"
Ronald Reagan had it right. Jeb will lower the top tax bracket to 28%. #GOPDebate https://t.co/MKsYm2HDkI
"Jeb would have to disagree, @HillaryClinton. #GOPDebate https://t.co/NLFuYubdrl"
RT @AshleyBeall101: Listening to @JebBush kill that first question he got on the debates tonight shows exactly why I'm #allinforjeb https:/\u2026
Hillary Clinton thinks Obama economy is good enough. I don't. We can do better. #GOPDebate https://t.co/YZZE9g6dmQ
"Hillary Gives Obama an ""A"" -- Really? https://t.co/y3dkQVfnZq"
This economy might be the best Hillary can do but its not the best America can do. #GOPDebate
"""We need to repeal every rule Barack Obama has in progress."" - Jeb #GOPDebate"
DC is broken &amp; Jeb is a proven conservative reformer with a plan to fix it. Join us: https://t.co/wiA7P01GMj https://t.co/5N17ixZxwU
Thanks for coming out! https://t.co/LMPtFwZrME
Handing my feed over to @Timodc @kristymcampbell @DannyLopezDiaz @sallybradshaw @aebrandenburger @embena @CGeorgia @QuentinCantu #GOPDebate
Less than an hour to go! Chip in just $1 right now to show your support before tonight\u2019s debate: https://t.co/lCeRBeMHS2
New pre-debate ritual: Bocce ball. https://t.co/J1aRyy5KuT
"I believe America\u2019s best days are not behind us, but squarely in front of us \u2014  if we elect the right leadership.\nhttps://t.co/NuX9kKQeKd"
Thanks Lauren! Join our #GOPDebate team too -&gt; https://t.co/wiA7P01GMj https://t.co/AOID1jE52f
"""That is a conservative record."" - @seanhannity #GOPDebate\nhttps://t.co/jMPdyz90pR"
Show you\u2019re #Allinforjeb tonight &amp; get 10% off at our online store with promo code \u201cDEBATESALE\u201d https://t.co/MA8sXdSqz3
Nice! Join our #GOPDebate team -&gt; https://t.co/wiA7P01GMj https://t.co/8mmB9qBHF8
"If we ever look on heaven's scenes, we'll find they're guarded by U.S Marines. Happy Birthday @USMC and Semper Fi! https://t.co/jKVekhdUvu"
