ICYMI: I\u2019m the only one who took on @realDonaldTrump &amp; exposed the flaws in his candidacy. He is not a conservative.\nhttps://t.co/MJYETvhE1X
"Unlike @JohnKasich, I fought against Obamacare expansion every step of the way. The next president must do the same.\nhttps://t.co/CWXcoGqrSO"
RSVP now for tomorrow\u2019s Charleston rally. We hope to see you there! https://t.co/HETjKZiZZJ
Great night at the #GOPDebate. I took on @realDonaldTrump to show he is unfit to serve as Commander-in-Chief. WATCH:\nhttps://t.co/Id5FhflgUV
We must replace Justice Scalia with a constitutionalist. The Senate should block @POTUS's inevitably liberal nominee\nhttps://t.co/Udhfi9W4RL
Join Michelle &amp; the rest of our team \u2192 https://t.co/KsETyWoYAo https://t.co/5Vj06YHedl
"Happy Valentine\u2019s Day to the love of my life, @ColumbaBush. https://t.co/cLd4Uw7d6U"
Jeb won last night\u2019s #GOPDebate. Let's keep the momentum going \u2014 Chip in $1 today. https://t.co/zDVe2Ifn3W
"My plan to destroy ISIS, restore the US military &amp; reverse @POTUS\u2019s damaging policies: https://t.co/J0FOFJ1NkO https://t.co/hJRkzXvSPD"
"NEW VIDEO: Once again, I was the only candidate on the #GOPDebate stage to take on @realDonaldTrump.\nhttps://t.co/yDgiSTRmqx"
"Happy Valentine's Day, Columba! https://t.co/8YO8LjYOvW"
.@realDonaldTrump is no Ronald Reagan - not even close. #GOPDebate https://t.co/Mtd8sV8b7r
"We need someone with a servant's heart, that has a backbone \u2014 that isn't going to focus on polls but the American people to keep us safe."
I will unite this country around common purpose because I did it as governor of Florida. #GOPDebate
"Jeb\u2019s the only one on stage taking on Trump, but he needs your help. Have his back by chipping in just $1 now: https://t.co/zDVe2Ifn3W"
All you do is win @realDonaldTrump? Really? https://t.co/uzaiRwttRM #GOPDebate
"We need a president with a proven record, not someone who went bankrupt like @realDonaldTrump. #GOPDebate\nhttps://t.co/hDXR1E0I7h"
We need a proven leader with a record of solving problems -- someone who doesn't cut &amp; run. #GOPDebate
"While @realDonaldTrump was building a reality TV show, my brother was keeping us safe. #GOPDebate\nhttps://t.co/nPLQ5SUbeO"
Ronald Reagan didn't tear people down like @realDonaldTrump. He tore down the Berlin Wall. #GOPDebate
Taking an elderly woman's home to build a parking lot for a failed casino isn't the proper use of eminent domain @realDonaldTrump #GOPDebate
"Chip in $1 right now &amp; stand with Jeb, the only candidate taking on Trump &amp; defending our Party tonight. #GOPDebate https://t.co/zDVe2Ifn3W"
"You know what's weak @realDonaldTrump? Disparaging women, hispanics &amp; American heroes like John McCain. #GOPDebate"
"We need a president who will stand up to Putin, not coddle him @realDonaldTrump. #GOPDebate\nhttps://t.co/fDzJnrSQvI"
We should be fighting Obamacare &amp; repealing &amp; replacing it - not expanding it @johnkasich. #GOPDebate https://t.co/LR7qxIux19
"When you match Jeb\u2019s record with @johnkasich's, there\u2019s simply no comparison. #GOPDebate\nhttps://t.co/nJ36uqcQqP"
I'm sick and tired of Trump attacking my family. This isn't about my family or his family. It's about your family. #GOPDebate
Guess @realDonaldTrump doesn't want an invite. But thought you all might: https://t.co/ljSzfAgeDI #GOPDebate
"While @realDonaldTrump was building a reality TV show, my brother was building a security apparatus to keep us safe. #GOPDebate"
.@realDonaldTrump's buddy Putin is not an ally of the United States. Plain and simple. #GOPDebate
It is ludicrous to suggest that Russia is a partner in defeating ISIS. It is time for American leadership. #GOPDebate
"We need to fight, fight, fight for conservative judges. I will. https://t.co/zN8CH8fn5c #GOPDebate"
Team Jeb taking over. Follow along with us during the #GOPDebate here \u2192 https://t.co/FjWodRIinn
"Before tonight\u2019s #GOPDebate, chip in $1 to show you\u2019re on Team Jeb. https://t.co/zDVe2Ifn3W"
"In the last #GOPDebate we saw the difference between the talkers &amp; leaders. We need a proven, conservative reformer.\nhttps://t.co/Aei7VZDUYQ"
"At Mass, Columba &amp; I prayed for Justice Scalia, who was devout in\nfaith and has been brought home to God in heaven. https://t.co/Bumxa6Ikrs"
"I will provide serious, steady leadership and real results. Read my plan for a safer, stronger, freer America. https://t.co/8JeBYrCFA9"
"Other candidates talk about defunding Planned Parenthood, but I\u2019m the only one who's actually done it. WATCH:\nhttps://t.co/a0IUaxjk4S"
Our grandkids make an appearance in today\u2019s Snapchat story. \n\nCheck it out here \u2192 https://t.co/cC0eGNA3Us https://t.co/y2odGM6w34
"Happy birthday, @GenChuckYeager. Thank you for your service to our great country. You are an American hero."
Honored to have the endorsements of both @mySA and @HoustonChron: https://t.co/9GaUB0N9Te
"Today in South Carolina I was asked my view on defending the 2nd Amendment:\n\n\u201cI\u2019m all in, brother.""\nhttps://t.co/gdTdp8WQGm"
NEW VIDEO: Who has the most conservative record on tonight\u2019s #GOPDebate stage? Watch and see for yourself.\nhttps://t.co/6cUMCdTXhD
With sustained economic growth we can create an America where there is opportunity for all\nhttps://t.co/SWK3p2F104
"Got a letter in the mail from our future president, Maggie. Hope I can count on your mom\u2019s vote! https://t.co/gDiWZpuFJF"
2% economic growth means declining incomes &amp; fewer opportunities for future generations.\n\nMy plan for 4% growth \u2192 https://t.co/T4LDfGiUd3
Hey @realDonaldTrump \u2014 The people of South Carolina are sick and tired of people tearing down George W. Bush.\nhttps://t.co/TZfF4xakfR
Today we honor one of our greatest presidents. An incredible man who dedicated his life to ensuring freedom for all https://t.co/li9uJ5mZrk
Tomorrow we\u2019ll be hosting an event in Fountain Inn \u2014 hope to see you there! https://t.co/I3xgHnDXOM
My health care plan will move us from a system stuck in 1965 to one that empowers people and embraces innovation https://t.co/VTPpSei8oV
We need a president with a servant\u2019s heart \u2014 someone who can fix the VA &amp; protect and defend our veterans.\nhttps://t.co/ArmglmPnhW
"Hope you can join us, Megan! https://t.co/ljSzfAgeDI https://t.co/mHLHVX043V"
"As governor, I earned an A+ rating from the NRA. I\u2019ll continue to protect &amp; defend our 2nd Amendment rights. https://t.co/cTYEVQ76gn"
What a way to end my birthday! Great town hall at the University of South Carolina. https://t.co/YMOmkjPNUb
Honored that these American heroes &amp; Medal of Honor recipients endorse me for Commander-in-Chief\nhttps://t.co/sBqw6KrmMW
"RT @jackkingston9: Happy Birthday to our next President of the United States, @JebBush #allinforjeb"
"In order to achieve economic growth, we have to change how Washington works &amp; who we send there to lead. https://t.co/QFKfyyKhzu"
Honored to have my brother joining me on the trail this week. Join us Monday in Charleston. https://t.co/HETjKZiZZJ
RT @Goodypasture: @JebBush Happy Birthday! Time to rock S.C.! #allinforjeb
"The US is less safe from @POTUS's weak, leading-from-behind foreign policy. I believe in peace through strength. https://t.co/4TiZ6b5yez"
RT @KyleBodkins: America needs someone with experience and a track record of proven success. That's why I'm #allinforjeb @JebBush
Proud to have the strongest national organization and the support of these state leaders: https://t.co/vHzJrjA4lR
"Thank you, Lynn! https://t.co/szP9fv5j0B"
It\u2019s Jeb\u2019s birthday today &amp; we couldn\u2019t resist sneaking the stache into his card. Wish him a happy bday! -Team Jeb https://t.co/2unSEFLUVn
We must transform our education system so all children are prepared to succeed: https://t.co/FIL4puFg6R
My policies will unleash higher wages and sustained 4% economic growth \u2014 all while reducing the deficit. https://t.co/qr6tnmD3qR
"Economy under @POTUS: low growth, crony capitalism &amp; easy debt \n\nMy plan for economic growth: lower taxes, close loopholes &amp; reform tax code"
Proud to have these South Carolina volunteers on the team. Working hard last night making calls https://t.co/GhJwS2dZzS
"Standing room only in Mount Pleasant. Thank you, all! https://t.co/QA4KUyUEIX"
"With the strongest ground game in the state \u2014 we\u2019re ready, South Carolina. Join the team today. https://t.co/chD5NG1mSi"
"As president, I won't cut &amp; run when the going gets tough. \n\nI'll stand by my word \u2014 that's leadership.\nhttps://t.co/pAqjhnlgZu"
By shifting power to the states we would put money back into Americans\u2019 pockets. My plan to restore states' rights \u2192 https://t.co/nmVuHg0Vve
"When it comes to experience, accomplishments and temperament, I\u2019m the candidate most fit to command and lead.\nhttps://t.co/VyODSzrO0m"
RT @colinsmith161: Experience matters. That's why I'm supporting @JebBush for president #allinforjeb
South Carolina is Jeb Country https://t.co/C1TwNMlFL4
.@realDonaldTrump's \u201csolutions\u201d need to be challenged and so far I\u2019m the only candidate who has. WATCH:\nhttps://t.co/2zFhPhR5W4
Excited to be in South Carolina. \n\nJoin me at one of our events this week \u2192 https://t.co/SOr3G2cMe5
My last visit to the Palmetto State was a good one. Check out highlights from the debate. WATCH:\nhttps://t.co/CQOhkFc4xg
"Thank you for your help, Bruce! Lucky to have you &amp; your boys on the team. https://t.co/chPyKNmm4B"
I\u2019m proud we made a difference in Florida. We are on the verge of the greatest time to be alive &amp; I'm ready to lead.\nhttps://t.co/sqp0f2Skmg
RT @Morning_Joe: .@JebBush on Trump and natl. security: To show my steadiness and his lack of steadiness is part of the process https://t.c\u2026
RT @foxandfriends: .@JebBush: Other candidates prey on people's fears rather than showcase their skills to solve problems\nhttps://t.co/AhBI\u2026
Good morning South Carolina! Excited to get going. Will be on @CBSThisMorning&gt;@foxandfriends&gt;@Morning_Joe&gt;@NewDay https://t.co/pLNOSLVcdY
"Thank you, New Hampshire. Off to South Carolina!\nhttps://t.co/AIHvKseG0p"
32 years in the private sector and 8 years turning the government upside down. \n\nThat\u2019s a proven record.\nhttps://t.co/kMRSLFYTML
RT @LouImbriano: Get out and vote today. I think Jeb Bush is the right person for the job. #myvote. #vote ##vote2016 #Jeb #GoDo https://t.c\u2026
RT @Melissa_Joy14: Bedford is #allinforJEB \u2757\ufe0f#cleareyesfullhearts https://t.co/nnpdjCc7kl
RT @1153red: The right choice for me. The right choice for America #IVoted #AllInForJeb @JebBush #FITN #nh #nhprimary https://t.co/GZU9asbu\u2026
"Only a couple more hours left to vote, Granite Staters. \n\nFind your polling location: https://t.co/KjJSigCAlt https://t.co/iXORhbK4iv"
"In June, I pledged to run with heart &amp; run to win. Honored to have shared my optimistic message with New Hampshire.\nhttps://t.co/tWOnkagbIN"
RT @NoraBarre1: #AllInForJeb #Fitn #NHPrimary #nhpolitics https://t.co/lVh2TiIVib
Today is an important day for NH &amp; the country. I hope to have your support to get our nation on the right track\nhttps://t.co/NNcdho5YQH
"RT @reginakeenan: Dear #NewHampshire,\n\nPlease vote @JebBush\nHe was my governor and he is awesome. \n\nSincerely,\nRegina\n\n#nhprimary \n#Jeb #Je\u2026"
During my 8 years as governor of Florida we didn\u2019t just mark time \u2014 we filled those years with hard work and real reform.
"Allison arrived undecided, but 5 minutes before entering one of Bedford's voting booths she made the right decision\nhttps://t.co/O0RFa7SJh8"
RT @kaeleygemmill: Go @JebBush go! Happy New Hampshire primary day \U0001f44f\U0001f3fc#AllinForJeb
Campaigning in New Hampshire has made me a better candidate and a better person.\nhttps://t.co/ffS8fv2lpN
"When it comes to my conservative record of accomplishments, the numbers speak for themselves.\nhttps://t.co/s9W0ADlckr"
"As governor, I was a reform-minded conservative. My plan to lead in the same direction \u2192 https://t.co/VI4b2sEMC3 https://t.co/gBcKtwBZUG"
Half a foot of snow didn\u2019t stop Portsmouth from joining last night\u2019s town hall. Thank you all for coming! https://t.co/BvLdkymog6
"As governor, I challenged everything to improve the lives of Floridians. I'll take this same zeal for reform to DC.\nhttps://t.co/Cg5yMvs6Yn"
"Closing my time in New Hampshire the same way I began: giving it my all, speaking to every voter and being true to what I believe."
RT @shonkori: Your tweet inspired me to sign up for #snapchat \nGREAT behind the scenes campaign footage. \n\n#Bush2016 https://t.co/dtLmsbFfRe
NEW VIDEO: Tomorrow New Hampshire votes for who they want as Commander-in-Chief and I hope you\u2019ll stand with me.\nhttps://t.co/I7qUou3U1J
"No other candidate has a more detailed &amp; conservative governing agenda. My plan for a safer, stronger, freer America:https://t.co/8JeBYrCFA9"
My plan for economic growth will restore the American dream for those who forgot what it looks like.\nhttps://t.co/HBsaMELW3L
"I vetoed $2 billion in spending, cut taxes by $19 billion, created 1.3 million new jobs &amp; balanced 8 budgets.\n\nThat\u2019s a conservative record."
I refuse to accept the \u201cnew normal\u201d of 2% growth. My plan will create millions of new high-paying jobs every year. https://t.co/6DaqxulJhw
The United States can\u2019t continue to withdraw from the threat of ISIS. \n\nWe have one choice: to defeat it. https://t.co/FmSiuAOq0m
My conservative record of accomplishments illustrates what we can do for America with true leadership. WATCH:\nhttps://t.co/FnclQoRXrH
"Thank you, Congressman @dgvaladao, for talking with our Nevada team &amp; caucus-goers this weekend https://t.co/JBqSWr0SXK"
RT @AllVetGroup: There is a change the air! Proudly supporting @jebbush #election2016 https://t.co/3VkeFptuzl
Obama's incremental and na\xefve foreign policy is not rooted in reality. I will restore US leadership. https://t.co/kvUhZRgH2i
Big thanks to all those who joined me in Nashua yesterday. RSVP to our Portsmouth town hall: https://t.co/vK17CGguVU https://t.co/3N3yFXNdUx
"NEW VIDEO: @JohnKasich and I served as governors, but when you match our records there\u2019s no comparison.\nhttps://t.co/AjWXGgDeFO"
".@realDonaldTrump, you aren\u2019t just a loser, you are a liar and a whiner. John McCain is a hero. Over and out."
"I will restore our country\u2019s legacy as the world\u2019s leading economic &amp; military power, an obligation @POTUS ignored. https://t.co/uVyr5KJ7jC"
We need a president willing to challenge the culture of overspending &amp; overreaching in our nation\u2019s capital.\nhttps://t.co/tJBm68oMae
Congrats on the Super Bowl victory Peyton. The steady hand prevails!  #ThanksPeyton #GoBroncos
Pulling for another Super Bowl win for my friend Peyton Manning tonight. Go Broncos!\nhttps://t.co/SpUNNhLN9Y
.@realDonaldTrump chose his own personal gains over protecting an elderly widow\u2019s home. WATCH:\nhttps://t.co/XgE7O69VVV
Last night was a big win. Chip in now to stand with Jeb. https://t.co/zDVe2Ifn3W
"The people that know @marcorubio and me best all like him, but see why they're supporting me. WATCH:\nhttps://t.co/5RvR4vsqlm"
Agree with Gordon England. I wish @POTUS spent more time trying to defeat the terrorists than trying to close Gitmo. https://t.co/vIOHlGWSbO
Another packed town hall in Salem this morning. Thank you all for coming https://t.co/Jtvgoin8Hq
See for yourself \u2192 https://t.co/cC0eGNA3Us https://t.co/jnyTn5zpp8
NEW VIDEO: Last night we saw the difference between the talkers &amp; the leaders\nhttps://t.co/FCYcDfNIP6
RT @meetthepress: Trump was booed 4 times during the 2 minute exchange with @JebBush during #GOPdebate https://t.co/c2igauLmEy
Results are in: We won the #GOPDebate. Get your Jeb gear today \u2014 everything is 10% off.  https://t.co/tWKeNvF6bx
"When I got to HQ, I found last night's pizza... https://t.co/iWNykRwNwW"
Came to HQ before @FoxNewsSunday and @meetthepress to put together walk books for volunteers. Thanks all! https://t.co/QMjY75aO4N
The most tweeted moment of tonight's #GOPDebate\nhttps://t.co/vxukigSNJE
.@HillaryClinton\u2019s stance on the VA scandal is outrageous. Watch what I had to say at tonight\u2019s #GOPDebate:\nhttps://t.co/ja9OHTsI93
"RT @lynslife: @JebBush They are hearing your message, keep showing NH who you are!  #allinforjeb"
"I ask for your support to keep America safer, stronger and freer. #GOPDebate\nhttps://t.co/QG7jCx8eUA"
"RT @ThisWeekABC: .@jebbush's closing statement: ""I ask for your support on Tuesday to keep America and make America safer, stronger and fre\u2026"
We need someone with a proven record to take our case to the American people. Join us: https://t.co/T4l68OtwYS #GOPDebate
"Under Jeb's leadership, Florida created the nation's 1st ""Choose Life"" license plates. #GOPDebate https://t.co/e7DkrbUoAX"
I'm the most pro-life candidate on stage. I acted on it for 8 years as governor of Florida. #GOPDebate
Tough Night Donald. #GOPDebate https://t.co/bIq9JSBK4g
The sheer incompetence at the VA is outrageous. @HillaryClinton ignores it. I'll fix it. #GOPDebate
Nobody else will challenge Donald's domain. I did. I will. #GOPDebate #eminentdomain
"The state capitals should be the source of reform &amp; innovation in this country, not DC. #GOPDebate"
Donald getting a lesson on conservatism tonight.
"Closing Guantanamo is a complete disaster. As president, I will keep us safe. #GOPDebate"
"We have to lead. Without the United States, nothing seems to work. #GOPDebate"
Jeb is the only candidate with a comprehensive strategy to defeat ISIS &amp; restore US leadership. #GOPDebate https://t.co/1z3gprRYrv
Jeb cut more taxes than all the other governors on stage combined. #GOPDebate https://t.co/LilKznsjty
The truth about @realDonaldTrump and eminent domain: https://t.co/BoleJkZlsR
Its not tough to take an elderly woman's home @realDonaldTrump. #GOPDebate https://t.co/lnqkemi5DN
Jeb has a proven record of leadership. #GOPDebate\nhttps://t.co/RmtSXo17Nf
"We have a lot of talkers in DC. To fix our broken immigration system, we need leadership. Jeb\u2019s plan: https://t.co/Qp6veYivYC #GOPDebate"
"After 8 years of President Obama's weak foreign policy, Jeb will restore American leadership in the world. #GOPDebate"
"When we pull back, voids are filled. Next president has to get America back in the game. #GOPDebate"
Take a look at Jeb\u2019s record as a conservative reformer vs @MarcoRubio\u2019s record as a do-nothing senator. #GOPDebate https://t.co/xQd2jm66D6
Jeb has the support of 12 Medal of Honor recipients who know that he\u2019s ready to be Commander-in-Chief. #GOPDebate https://t.co/lDrZIKSTZS
"Jeb is the one candidate with the experience, plans &amp; temperament to be the next president. Join us: https://t.co/T4l68OtwYS #GOPDebate"
"Before I step on stage for tonight\u2019s #GOPDebate, chip in $1 to show you have my back. https://t.co/zDVe2Ifn3W"
"Mom couldn\u2019t make it out to knock doors today, but that didn\u2019t stop her from talking to New Hampshire voters\nhttps://t.co/4KWUnMgNsx"
A consistent conservative record of accomplishments vs. \u2026nothing? https://t.co/KjyKXLP2q4
This Kennebunkport crew geared up to knock on some Portsmouth doors today https://t.co/WSblvI0zQE
3 more days. Join the team: https://t.co/Yl0WLTUGSp https://t.co/6dNYAzoL07
"Thank you, Bedford. \n\nJoin me tomorrow in Salem &amp; Nashua: https://t.co/gnYEYWaK02 https://t.co/WBiMYE6XmN"
"I\u2019m sorry you weren\u2019t able to get into today\u2019s town hall, but I hope your mom likes the surprise https://t.co/LmgfLLxF5k"
"Over capacity for our Bedford town hall. For those who couldn\u2019t make it inside, I\u2019m glad we got to meet beforehand! https://t.co/CImP4HY7nH"
NEW VIDEO: Fired up about the next few days in the Granite State.\nhttps://t.co/8aCd1TnYqG
Boys on the bus https://t.co/MpeUAyADGT
"If you can\u2019t list one accomplishment by @MarcoRubio, how do you know he has the leadership skills to be president?\nhttps://t.co/izXfdUN2vG"
Get your Jeb bumper sticker here \u2192 https://t.co/ji3A86MXq6 https://t.co/e1MUsNZUj6
RT @AdamSextonWMUR: A mother's love: 90 year old Barbara Bush forging ahead through #FITN snow for @JebBush #WMUR https://t.co/e6znu6c25t
Granite Staters vote in 4 days &amp; this New Hampshire snowstorm won't stop our volunteers https://t.co/YYLxr5dcO0
These two volunteers from the Sunshine State are bundled up &amp; ready to knock on doors today in New Hampshire. https://t.co/BTo4m0342G
NEW AD: My conservative record of accomplishments vs. @MarcoRubio\u2019s record of doing nothing in the Senate.\nhttps://t.co/vKbtrVGlmF
".@realDonaldTrump My 90 year old mother made it out to campaign. She met Destiny, age 5. https://t.co/Xue8HwpTS3"
Grateful Mom could join me on this journey.\nhttps://t.co/ZyXD4rXkCX
Look what I caught!\n\nProud to land these four legendary conservationists. Welcome to the team: https://t.co/k5WmWBAAW8
"We need a president whose ambition is to serve others, not to serve themselves.\nhttps://t.co/wrx6LVP2Vx"
Mom\u2019s prediction on who\u2019s going to win #FITN:\nhttps://t.co/6c8fOAHHbN
"RT @JamesShrum: ""You think he's going to win?"" \nBarbara Bush-""Darn right!"" \n#AllinforJeb @JebBush"
Get an inside look at what it\u2019s like being on the campaign trail with Mom: https://t.co/cC0eGNA3Us https://t.co/yVzd9M4JME
An overflowing crowd tonight in Derry. https://t.co/MzSrthAP6F
Great day in the Granite State. Join me tomorrow in Concord for another town hall: https://t.co/GBTiQU2mKR https://t.co/P5LiLssLa0
Full house tonight in Derry! Thank you to all those who came out. https://t.co/j4ElxhupAc
Tune into @CBSThisMorning tomorrow to see my interview with Mom &amp; @NorahODonnell https://t.co/taxd4GunBM
I will restore America's legacy as the world\u2019s leading economic &amp; military power \u2013 an obligation @POTUS has ignored. https://t.co/OuBMal8EYN
"Four legends #AllInForJeb. Hook, line and sinker: https://t.co/dUeAZZyRyI"
Join me \u2014 and a very special guest \u2014 tonight for our Derry town hall: https://t.co/Ge9StbsNkk https://t.co/G4Du6uzcuN
NEW TV AD: I have the steady hand needed to be a Commander-in-Chief you would be proud of.\nhttps://t.co/u5nP6Lo4Cr
"The nation needs a tax system that is simpler, fairer &amp; can jumpstart economic growth.\n\nMy plan for reform &amp; growth: https://t.co/nuNzEsXutj"
"Lunch at the Tilt'n Diner, grabbed a seat at the bar next to Pat from Northfield https://t.co/Oh8MSfbGzC"
Only one candidate lands the big fish. Proud to have these legendary conservationists on the team: https://t.co/RKDxmwJmkA
"Thank you, @ConwayDailySun. I will work hard to win New Hampshire with your support: https://t.co/cejeqJfiFv https://t.co/To4QtCPMUN"
Mom\u2019s joining me on the trail in New Hampshire today. Add us on Snapchat to follow along \u2192 https://t.co/cC0eGNA3Us
"ISIS now 2x more powerful in Libya than Admin estimate \u2014 no, @HillaryClinton, Libya was NOT smart power at its best. https://t.co/DDDQNKJa2T"
NEW TV AD: Do you want a president who has a backbone? Or do you want a president who makes it all about them?\nhttps://t.co/dNbXjsOtuw
"After 8 years of an inexperienced leader, it\u2019s time for a president with a proven &amp; consistent record.\nhttps://t.co/LOa6eWiBjy"
"Restoring the right to rise in America requires accelerating growth, and that can\u2019t be done without real tax reform.\nhttps://t.co/1THpbUaxzp"
Up next with @jaketapper on CNN \u26c8 https://t.co/RwS3f5x5EK
"RT @harris2weeter: Dang that's a good ad. I'm calling it, #allinforjeb @JebBush is a positive candidate with solid ideas.  https://t.co/Wmc\u2026"
Jeb supporters come in all ages. Get your Jeb onesie today: https://t.co/T5bIDHUhb6 https://t.co/EoEkmnizM8
RT @TeamJebBush: NEW POLL from @HarperPolling shows @JebBush in 2nd place in New Hampshire &gt;&gt; https://t.co/9PH0Ld3Y8Z #AllInForJeb https://\u2026
"My plan for reform and growth will create 19 million new jobs. \n\nI can do it, because I did it in Florida. https://t.co/iQAoZQqtCH"
Our message should be one of optimism \u2014 to give Americans the opportunity to pursue their dreams with a vengeance. https://t.co/jJTvARPT1p
Turn off Trump. https://t.co/jJTvAS7upZ https://t.co/skGcz1eozJ
I\u2019ll be making stops across New Hampshire this week. RSVP to a town hall near you. https://t.co/A7PhXTOLJv
America's words must be backed up by action. Allies must trust us and enemies fear us. Obama/Kerry don't get it. https://t.co/t7y6SHRi16
"Enough with playground pranks and disparaging Americans, @realDonaldTrump. We need a real leader: https://t.co/jJTvARPT1p"
My sister Doro spent yesterday campaigning \u2014 and taking selfies \u2014 with our South Carolina volunteers. https://t.co/4jjug92rQ7
Obama &amp; Clinton should stop being dishonest &amp; admit their incrementalist ISIS strategy is failing. https://t.co/5ou5ChaUXX
@grantbosse @MollyLineFNC great stop. @nhkillion went all-in and got a cinnamon sugar donut
Caught up with @MollyLineFNC at Lindy's in Keene. https://t.co/8iMscSPJ60
"US debt hits $19 trillion, nearly half under @POTUS\u2019 failed leadership.\n\nMy plan for sustained 4% economic growth \u2192 https://t.co/xnikBltP7H"
"Great questions from the crowd at our Rindge town hall this morning! Thanks for hosting, @FPUniversity. https://t.co/msyLV01bkU"
"As ISIS terror threat grows, Secretary of State\u2019s words are hollow without credible US leadership &amp; action: https://t.co/iTFW53hzTU"
".@POTUS doesn't believe US leadership in the world is a force for good. Because of that, we suffered as a nation.\nhttps://t.co/qrZaCzxZ6Z"
