"Check out this powerful story from Kate, a @FLVS student. We need to break down the barriers to #edchoice  https://t.co/tmqG5Plmqb-"
"Hage &amp; Tuthill: Private, Charter, Voucher\u2014School Reformers Unite to Give Families Diverse Choices, Kids Win @the74 https://t.co/6OdEQXXV3q"
Give Medicaid Dollars Directly to Patients Empower states to reform  https://t.co/d9Dq0ZO597
"RT @SchoolChoiceNow: Governor @JebBush will deliver a keynote address at our National Policy Summit! Don't miss out, register today: https:\u2026"
A special read by my friend Doug Mackinnon during this Holy Week. https://t.co/g4x6qlBDMl
"In Striking Syria, Trump Made All the Right Calls https://t.co/5znIAuE8ET"
Congratulations to Justice Gorsuch! He is a fair and impartial jurist who is committed to our Constitution and will serve our nation well.
Congratulations to @dougducey and the Arizona Legislature for scoring a big win for Arizona students and parents! https://t.co/TVj3XE8vHn
When are children old enough to mow the lawn and wash windows? A guide to chores by age  https://t.co/AtXO0kINlW via @WSJ Great advice.
Arizona is a leader in #edreform. Thanks to @dougducey and all the Arizona leaders working to advance the cause thi\u2026 https://t.co/S1CcoeiFrD
"RT @ExcelinAction: NH students, families deserve the power of #SchoolChoice. Great op-ed by @JebBush via @UnionLeader https://t.co/uxFfXDSi\u2026"
RT @ScottWalker: Best Presidential First Pitch. EVER. https://t.co/NdE652YiE8
Betsy DeVos\u2019s Many Choices https://t.co/TMFcQsN3II
Shale Drillers Pioneer New Ways to Profit ...America at its best.  https://t.co/AYtZ8YBwwP
Venezuela Moves a Step Closer to One-Man Rule - https://t.co/WP4AUwp4S4. It's time for a strong policy for freedom. https://t.co/InNk94K3Ck
"Fantastic speech on #schoolchoice from @BetsyDeVos. ""There is no perfect, one-size-fits-all system of education"" https://t.co/iPx9goUbwi"
Great look at the important work @georgepbush is doing in the Texas General Land Office @txglo https://t.co/EU6F82PShs
Coding Camps\u2019 Business Model Offers Job Pledges\n https://t.co/xw94wdYhKR
.@GovernorVA's decision to block educational choices is more evidence he puts union special interests ahead of Virg\u2026 https://t.co/qfQTrQ8RDl
"Daniel Henninger: Trump\u2019s Russia House, ""an open ended fiasco"". https://t.co/4tPaHyKLDG"
Great piece defending the rights of parents in determining the best learning environment for their child. https://t.co/gw7TWKGCDs
Bret Stephens: \u2018Other People\u2019s Babies\u2019 America's way forward.. shared values and diverse ethnicity. https://t.co/nGeDJaLGSK
Such an unnecessary distraction given all the challenges and opportunities we face. Focus on the important stuff. https://t.co/pVDJBjahQM
The CBO has a history of overestimating benefits of progressive policy and underestimating market approaches. https://t.co/3mgv1ubvQF
Congratulations @GovMattBevin and @BamCarney for passing HB 520 #CharterSchools empowering #Kentucky\u2019s students and families! #edreform
"Jim Donovan will be an exceptional Deputy Secretary of Treasury. He\u2019s a capable, talented man of integrity. Proud to call him a friend."
Here is why Arizona must expand its Empowerment Scholarship Accounts. #schoolchoice #edreform https://t.co/QuX78pUqjJ
America is a nation of immigrants. The sentiment expressed by Steve King doesn't reflect our shared history or valu\u2026 https://t.co/RdIAA2jTad
A fantastic story about a group of Florida high school students setting an example for us all. https://t.co/AsBELCmfnY
How Trump Can Expand School Choice. Strong advocacy from Cardinal Dolan. https://t.co/ua7mLGHodV
WikiLeaks\u2019s New Damage How lax can we be? This is so dangerous for our national security. https://t.co/oCCXpNWI2z
The Mob at Middlebury. Alumni should rise up against this.  https://t.co/AbMp0rYkPQ
Brian Murphy and I opine on the power of #schoolchoice and thank Governor @EricGreitens and the #MOLeg for their le\u2026 https://t.co/x7jCfyLspo
"RT @MissouriChamber: Today's education model needs to be updated for today's workforce needs, says @JebBush during his news conference with\u2026"
Thanks to our Missouri #edreform partners for the invitation to visit the #MOLeg today to talk #schoolchoice\u2026 https://t.co/1aP5viOGAC
Great to see @DenishaMweather recognized at tonight\u2019s #JointSession. She is a remarkable example of the power and potential of school choice
"I hope folks take an opportunity to check out my brother\u2019s book, coming out tomorrow. It\u2019s an incredible tribute to\u2026 https://t.co/sEXnun49Uv"
I\u2019m with @EricCantor. @TerryMcAuliffe has a huge opportunity to improve education in Virginia and change the course\u2026 https://t.co/NGnkH5VmGC
It was remarkable to see Katherine Johnson on stage at the Oscars tonight. She's an American icon. https://t.co/922XyWxnO4
Best of luck to my friend @jimmykimmel tonight. Let's see if he can top his ride to the last awards ceremony. https://t.co/q5PIuLbyOf
"Great News from the White House: In sweeping move, Trump puts regulation monitors in U.S. agencies https://t.co/beNTcKsvK6 via @Reuters"
"Beware of slippery slope. Dutch Doctor Forces Assisted Suicide Dose On Sedated, Protesting Patient https://t.co/AIFqb16niT"
The Drive to Unionize Charter Schools. Let States decide this.  https://t.co/Tb9Slvhw5H
My fellow Floridian Alex Acosta is a leader with tremendous integrity and experience. He will be an outstanding addition to the Cabinet.
"A Trump Statistical Trade Trick Keep focus on regulatory and tax reform, not gimmicks. https://t.co/cXgXGIE14W"
Florida Space Coast Set for Jobs Liftoff\nGood news for Florida and the USA. https://t.co/8iuJ8QRJKz
Congratulations to Scott Pruitt on his confirmation. He will be an exceptional leader of the EPA. https://t.co/J4fXwPYtsb
Reality sets in. https://t.co/OnjcBTelhV
.@justinamash is setting the right example. Conservatives should be ready (and eager) to defend and discuss our pos\u2026 https://t.co/WVspTGFdhr
Incredible run for the Miami Heat.
Notable &amp; Quotable: Elizabeth Warren on School Vouchers https://t.co/GCmxHHt5Qd
A moving personal piece from @arthurbrooks on Catholicism and capitalism. https://t.co/aWyI9QqGfO
I congratulate @BetsyDeVos on her confirmation as our nation\u2019s next Secretary of Education. The President made an e\u2026 https://t.co/4TA3VU1jY9
Lamar is right. @BetsyDeVos will be a phenomenal Secretary of Education. Call your senators and urge them to vote f\u2026 https://t.co/LkiWjzBWaM
The war on @BetsyDeVos is all about the teachers unions https://t.co/5Un70f3fuy
Hyundai ad of US soldiers serving in Poland was amazing. Thank all those that are serving us overseas to keep us safe.
"Strong coin toss to kick off the big game, Dad! @GeorgeHWBush https://t.co/GVsp8zgM3f"
Concerning: Middle East Christians Fear Trump Ban Will Backfire: https://t.co/AcYfBNTi62
"Great piece by @rpondiscio: A reflection on race, social justice, and education reform https://t.co/CMr4xCzheR"
Meghan O'Sullivan delivers a substantive and accurate case against the travel ban. The Admin should take steps to r\u2026 https://t.co/UxZI6BJOJs
I applaud President's nom of Neil Gorsuch to serve on the Court. He is a thoughtful conservative jurist &amp; worthy successor to Justice Scalia
"Betsy DeVos is a true champion of students and parents, and she deserves confirmation by the full Senate. This is a\u2026 https://t.co/E4Rcy1HgO6"
https://t.co/idaiRouDgW Domestic Violence is a curse.
U.S. to Deploy Tanks to the Baltics Strong signal of US commitment to NATO. https://t.co/WZ1kfJegy6
My family and I thank you all for your prayers for my parents and their speedy recoveries! https://t.co/6JqZmlcDnj
Great look at @GeorgeHWBush's time as a naval aviator. Many thanks to the incredible @NavalMuseum team! https://t.co/lRCP7Tqqns
The Economist | Venezuela: Maduro\u2019s dance of disaster\nhttps://t.co/N99CS3naq5 via @TheEconomist
"RT @EducationNext: ""What's ahead for #SchoolChoice""? We asked three #edpolicy experts. Here's a response from @JebBush. \n@ExcelinEd @school\u2026"
RT @ExcelinEd: . @SenatorTimScott: For the last 28 years @BetsyDeVos has been dedicated to #SchoolChoice. https://t.co/BWYsUb3LQB @washingt\u2026
"Huge support for #edreform: #SchoolChoice Week 2017 has more 21,000 events planned w/ 6+ million attendees in all 5\u2026 https://t.co/Z2Da9KaS4T"
https://t.co/KaSHSoIgdn
Great piece by @RepRooney making the historical case for scaling back the size and reach of the federal government. https://t.co/qGSdYHGQcP
Congratulations to @woodyjohnson4! He's a great American and will be a fine ambassador to the UK.
"Congratulations, Mr. President!"
"In the year since the nuclear deal, Iran's destabilizing presence has grown. @AmbDennisRoss and I share a path forw\u2026 https://t.co/JHTNtOoie4"
Ruling marks a monumental moment in lives of 90k students who receive a quality education through Florida\u2019s Tax-Cre\u2026 https://t.co/fTrzUfNipN
Scott Pruitt is ready to turn around the EPA. https://t.co/rWLS42uLbs #confirmpruitt
.@BetsyDeVos will take on the entrenched special interests in education that have put the interests of adults ahead\u2026 https://t.co/vg65voz5Cq
"RT @SenAlexander: ""Betsy believes deeply that each child should be equipped with the knowledge required to succeed in life."" - @JebBush"
"As @BetsyDeVos' confirmation hearing begins, my thoughts on her capacity to transform education in America #edreform https://t.co/jSaSToKThp"
An important read on this #MLKDay A quality education is critical to ensuring all students can rise up and achieve\u2026 https://t.co/Fz3wI1WyEE
.@MartinOMalley and I preview our massive win over the grad students at the @BushSchool horseshoe showdown yesterday https://t.co/QnyXlZQG8k
Great to have my old wingman @WCraigFugate at the @BushSchool this morning to talk to our public service students a\u2026 https://t.co/C1CEPU9Pmx
Thanks so much to @Sen_JoeManchin for skyping into our class on gubernatorial leadership at the @BushSchool. It was\u2026 https://t.co/ngMa28O7gy
Learn more about our course on gubernatorial leadership at @TAMU's @BushSchool https://t.co/zDuByHDE4s
Tonight I'll join the @Bush41Library to discuss gubernatorial leadership. Watch @ 6:00 pm CT: https://t.co/mn4WxmBdco
"As Secretary of Ed, @BetsyDeVos will pursue every opportunity to improve our schools and empower states and parents https://t.co/07meukw406"
A big thanks to my friend and former Lt. Gov. Toni Jennings for joining me at the @BushSchool to talk about guberna\u2026 https://t.co/x0AkxCdBER
"Wish the Dolphins had pulled a win out, but had a great weekend cheering on the Texans with my Dad! https://t.co/0B5et2mryx"
"America has incredible teachers. Unfortunately, these are their union reps. What a disservice. https://t.co/4LhMuIOZhI"
Venezuela Tees Up Its Next Dictator Hopefully new administration will focus on Venezuela. https://t.co/VtReIAVwif
Great first day teaching at the @BushSchool! Thanks to @HaleyBarbour for helping us kick off the class. https://t.co/WLNwVbJjDJ
Celebrating with my parents their 72nd anniversary tonight. Blessed to be their son.
Five Ways for Trump to Put Tehran on Notice https://t.co/s0iOni4qhi
USS George H.W. Bush is returning to the fight against ISIS https://t.co/MQgnXMYSDf
What the movie \u2018Lion\u2019 tells us about our vision of humanity https://t.co/m98cNUNWWQ
The remarkable Thomas Sowell's final column: https://t.co/sGHQZmMz80
"Merry Christmas and Happy Hanukkah to all, especially those in the Armed Forces protecting our nation and their families. We pray for you."
My take on why Scott Pruitt is ready to turn around the EPA. https://t.co/lxPkb4jle4
"The Company Founder\u2019s Special Sauce...an owners mindset, sense of urgency and front line obsession. https://t.co/mmjdz58AU8"
"All of the finalists were great candidates. I applaud Rick Scott for appointing Alan Lawson, who will be an excellent Supreme Court justice."
The massive tragedy in Aleppo only escalates as America continues our withdrawal. Just devastating. https://t.co/eLVp8TWyCq
"Congratulations to my friend @GovernorPerry! Through his leadership and experience, he will make an excellent Secretary of Energy."
Rex Tillerson is a good man and accomplished leader who will serve our country well as Secretary of State.
The Spoils of the Republican State Conquest This is an under reported story. The action will move to the States. https://t.co/XiDgzRNEOb
Important Florida read from @alevine014: Florida's economic future depends on a new education goal: https://t.co/zUilcdTMIM
Check out the National Council on Teacher Quality's new analysis of teacher prep programs. Congrats to @purduemitch\u2026 https://t.co/3OMHPleX1A
Another good pick: @AndyPuzder is a strong conservative leader and successful businessman who will do a phenomenal job as Labor Secretary.
"God bless this great American hero. Godspeed, John Glenn. https://t.co/u4sfG6w1qU"
"On the 75th anniversary of the Pearl Harbor attack, I hope you check out @GeorgeHWBush's speech from 25 years ago.  https://t.co/DZ88Zjql4A"
Can't imagine a better pick than my friend @AGScottPruitt to reform an out-of-control EPA. He'll bring common sense\u2026 https://t.co/qrgpo3bkt9
General Kelly is a great choice to lead the Department of Homeland Security. https://t.co/mBgK6eQVpN
Honored to meet @angeladuckw at #EIE16. Learn how her groundbreaking research is revolutionizing education: https://t.co/l738JFVhp5.
"USA Today: George H.W. Bush: 75 years after Pearl Harbor, strength renewed: https://t.co/yArm4GhaHW"
A Trump SWAT Team for Regulation ....a great idea! https://t.co/i2cPkEqLt5
It was exciting to feature @khanacademy &amp; @CollegeBoard at #EIE16. Partnership gives all students chance at success: https://t.co/iTU8EeDDdN
"A heartwrenching, but beautiful reminder that we live in the greatest country on earth. https://t.co/hNPH7NQTIK"
A big thanks to the @ExcelinEd team for a successful #EIE16! Inspiring to see 1100 ed reformers convene to transfor\u2026 https://t.co/WDpKgfNxmn
"RT @ExcelinEd: Opening Keynote from Gov. @JebBush to 1,000+ education leaders from 49 states and 4 countries. https://t.co/ir6QOmqnFR"
The Foundation for Excellence in Education is excited to kick off our 9th annual National Summit on Education Refor\u2026 https://t.co/o6i1IwGNDb
Great to have so many MVP students from the @DCISchool here at #EIE16 @ExcelinEd https://t.co/CjmmLu7cO9
Good piece on the potential for bold education reform under the new administration. https://t.co/6GOUXdQ0dF
"On this #GivingTuesday, help us transform the quality of education in America by supporting @ExcelinEd. #edreform"
Please keep the Florida Coalition Against Domestic Violence in mind on this #GivingTuesday. It's a great organizati\u2026 https://t.co/bv1K6WdZKf
An important cause to remember on this #GivingTuesday. Visit https://t.co/pu5X4pPp7V for more info. https://t.co/CgccGiERgt
RT @ExcelinEd: Will we see you at #EIE16 on Thursday? https://t.co/49ws17N95M
"RT @greggutfeld: the worst thing you could be in Cuba, is a Cuban. the best thing to be is a American, naive celebrity tourist."
Failing to mention that millions have suffered because of Fidel Castro is a tragedy. https://t.co/SbhImMuqa5
Fidel Castro\u2019s passing marks a symbolic end to more than a half-century of tyranny and oppression. Viva Cuba libre! https://t.co/mlU8vXCf5A
My take on where Republicans go from here. https://t.co/CgFcSYfcn5
"Thankful for the men and women serving our nation and keeping us safe, especially those who are away from their fam\u2026 https://t.co/dLGqRa3sJh"
Betsy DeVos is an outstanding pick for Secretary of Education. I look forward to her bold leadership at the USDOE.\nhttps://t.co/PioGyTQe4t
This is the right thing to do. President Obama should heed this request. https://t.co/0Wi07aHx1M
@RosLehtinen @EduardoJPadron @MDCollege @BarackObama GREAT choice!!!
Great pick by the President-elect. Mauricio Claver-Carone is one of the strongest advocates for a free Cuba. https://t.co/P9sgzaREvu
President-elect Trump made a great choice in asking Mike Pompeo to lead the CIA. https://t.co/q4G3ItZYiL
Good piece by Mauricio Claver-Carone in the @MiamiHerald: Obama\u2019s Cuba Policy Makes Bad Situation Worse https://t.co/7mO2tD4ESz
I hope you join me for @ExcelinEd's 2016 National Summit on #EdReform. Here's a preview: https://t.co/bwqFBMDTEM https://t.co/wFFB1FZ6xl
Fascinating profile from @reason: Meet Johannesburg's New Libertarian Mayor: https://t.co/FoFsBU6Yr9
Justice O\u2019Connor deserves great credit for her work. Never has restoring civics education been so important. https://t.co/uoSOWubM7Z
Great news for Congress and our country. https://t.co/7bJ3G9QHka
"Our nation is grateful for the service and sacrifice of our veterans, active duty troops and their families, today\u2026 https://t.co/7emtPpbzIE"
Semper fi! #HappyBirthdayMarines https://t.co/hWdcC7qo2c
Last night was a great night for the @The_RGA. Congratulations to all the new Republican governors! https://t.co/r04pzt894y
"Congratulations on your victory @realDonaldTrump. As our President, Columba and I will pray for you in the days and months to come."
"What a great win for Wisconsin and our country. Congratulations, @RonJohnsonWI! https://t.co/c0NN82OMrU"
"Proud of my friend, @carloslcurbelo. Well deserved win for a great Florida leader and congressman. We need more like him in Washington."
"Congratulations on the great victory, @marcorubio! Florida is critical to keeping the Senate."
Vote #Yeson2MA! Best of luck with your #edreform agenda @MassGovernor! https://t.co/3HlYb2y8cQ
"Thanks for sharing your powerful story, Jackie. Ellen sounds amazing. Next time you see her, tell her I said so. https://t.co/ejuwjEhBmv"
I have a confession to make. #gigem https://t.co/ceT27G7XB6
The fact that this brutal dictator remains in power is an unfortunate consequence of our failure to lead abroad. https://t.co/Mqk5K5Zoj9
Michael Mukasey's sobering account on the state of Hillary Clinton's email scandal and role of Obama White House: https://t.co/A8TpNQtHRP
Join us next month for @ExcelinEd's 2106 National Summit on Education Reform: https://t.co/wFFB1FHvFN #EIE16
WSJ: The American left tries to stigmatize Muslim reformers: https://t.co/yKb00wyjfE
Mark Helprin raises important questions about President Obama's failed foreign policy strategy when it comes to Ira\u2026 https://t.co/EqOMmoafJ5
Holding veterans responsible for gross mismanagement by California officials is detestable. https://t.co/Mib2Yakw8r
"Good reminders. Thanks, Canada. https://t.co/IxHXsnOF59"
Great to have @PRyan in Miami to support our friend and great Florida leader @carloslcurbelo! https://t.co/fSw25lf6xl
RT @NavyOutreach: @USNavy Sailors from @CVN77_GHWB and USS Houston had the honor to meet with @GeorgeHWBush and Barbara Bush during Houston\u2026
RT @ExcelinEd: Today's #NAACP vote sends a harmful message to the nation's nearly 3 million charter school students. https://t.co/y0YuOch6mf
Robby George is right. The anti-Catholic bigotry - and bigotry generally against people of faith - displayed by Tea\u2026 https://t.co/HsAuTqQTCv
Many thanks to the PEPG and @Paul_E_Peterson for opportunity to teach at @Harvard this fall. The students and facul\u2026 https://t.co/r0t8n7XP51
RT @ChoiceMediaTV: LIVE: Watch the @hgse #Askwith Forum with @JebBush on #EdPolicy https://t.co/LP3ozIzYpf @ExcelinEd
"So proud of @ColumbaBush &amp; FL Coalition Against Dom Violence. This weekend, we raised more than $400k to empower wo\u2026 https://t.co/4yw24r2F4I"
Important piece by George Will on the repercussions of our withdrawal from the world. https://t.co/PTcc8muWFZ
"As the grandfather of two precious girls, I find that no apology can excuse away Donald Trump's reprehensible comments degrading women."
Thanks and congrats to @onetoughnerd and the Michigan Legislature for passing landmark literacy reform. https://t.co/t6cQpBlxqN #edreform
Prayers for and thanks to Florida's first responders and first responders across the nation. #Matthew https://t.co/qWt3paJzAB
I encourage both presidential campaigns to be sensitive to all affected by Hurricane #Matthew in the coming days. https://t.co/bmM99VlUqm
Good piece from @SenJohnMcCain. https://t.co/sZMhXYKeH2
"Florida friends, Hurricane #Matthew is serious. Get a plan, heed warnings from officials and follow @NHC_Atlantic and @FLSERT for updates."
"Proud to support @ALOpportunitySF, which is giving thousands of Alabama families access to a quality education. https://t.co/BBqCpoWg35"
Yet another legacy of Hugo Chavez comes to light as the media finally discovers Venezuela's horrors: https://t.co/qcxHLxo8QB
"At 6:00 pm, I\u2019ll kick off 2016 Godkin Lecture at the @JFKJrForum for a discussion on economic mobility. Watch live: https://t.co/08z7piryMD"
Thanks to my friends at the @ManhattanInst for hosting a great event today regarding the future of accountability i\u2026 https://t.co/oikWoNcUek
"How should states design their accountability systems? In @EducationNext, I advocate they should look to Florida: https://t.co/rjWIUgIrVn"
RT @jgm41: Statement by former President @GeorgeHWBush on the passing of former Israeli President Shimon Peres at age 93. https://t.co/QTkA\u2026
Prayers for the family of @JDFernandez16 and the Marlins organization. A great talent lost too soon. https://t.co/pnUyeMzHdG
Museum is incredible tribute to rich history and achievements of African Americans. Thanks to all who made possible. https://t.co/eEXDgdSLZp
"Proud to support @JohnCouriel, my future state house representative! He is a principled, conservative leader and wi\u2026 https://t.co/H4DLkEgyss"
RT @UANI: False Narrative? Lawmakers Say @WhiteHouse Did Not Disclose #Iran Wire Payments. Read via @weeklystandard https://t.co/hODvhi5mBV\u2026
"If you are looking for a laugh today, this is worth a watch. My Mom and @BradMeltzer make quite the pair - just lik\u2026 https://t.co/kW7J8dPbre"
Thanks to Gov @onetoughnerd and MI Leg for commitment to making sure all Michigan kids can read by end of 3rd grade. https://t.co/3gwRzZdydE
Great ad. Great project and cause. Congratulations to @RonJohnsonWI on success of The Joseph Project: https://t.co/CxVCpvgvPY
Great to catch up with my friend @dougducey today. cc: @JebBushJr https://t.co/IUgsTC7fo4
Pretty cool to spend a day with @ericschmidt and the @google team at #zeitgeist16 https://t.co/g8NripYKti
"Hey, @jimmykimmel, I'm giving you 5 stars! How about a little something,\nyou know, for the effort, you know? https://t.co/tsm5fZ1aDW"
The Washington Post editorial board gets this right: Cubans don\u2019t benefit from American business \u2014 Castro does: https://t.co/vQnG5X8rEb
This is a travesty. https://t.co/7nKyXSMhXF
Admiral @billmcraven gets this right. Stand up for our National Anthem. Period. Read his memo: https://t.co/jchvOzI2m4.
President Obama's failure to effectively confront ISIS &amp; broader conflict in region undermining America's allies. https://t.co/VFHTx3sGF7
RT @UANI: ICYMI: #UANI released results of a nat'l poll of likely voter attitudes on #Iran. Key finding? #Iran is bad for biz. https://t.co\u2026
"Proud to join Advisory Board of @UANI, which is raising awareness of the dangers the Iranian regime poses to world. https://t.co/jfEMY54vtH"
God bless America. https://t.co/N4ibK5qcNJ
"On 15th anniv, we honor the victims and first responders of 9/11, and the Americans who continue to defend our freedom and security today."
"Congratulations, @GeorgePBush, honored by University of Texas as an outstanding Young Alum at today\u2019s game #HookEm https://t.co/qzyBk71CTb"
Honor to help! You all are doing incredible work! https://t.co/JyPDWJq8Xu
"RT @ExcelinEd: .@JebBush at @ALOpportunitySF event: If we don't empower parents to have choices, the despair will cascade out during their\u2026"
RT @ExcelinEd: .@JebBush: Schools get better when there's the pressure that a student can choose another school. @ALOpportunitySF https://t\u2026
"God bless you, @JaneMHorton. We will always honor SPC Chris Horton's ultimate sacrifice. https://t.co/MQm5lsqhjx"
Great to be in Birmingham today to raise awareness for the Alabama Opportunity Scholarship Fund! #edchoice https://t.co/0Uu2877jPV
Important piece from @JoeLieberman. https://t.co/3QmJhB6auY
Rest in peace AF Pilot Elaine Harmon. Credit to @RepMcSally for securing her rightful place at @ArlingtonNatl. https://t.co/wtaYOkeBIo #WASP
This situation is heartbreaking. No parent should have to go through this to get the best education for her children https://t.co/Pcii8u34xE
"Back where he belongs. @SteveSpurrierUF is a good man, says this Canes' fan. https://t.co/Jo3rVVOPMf"
God bless Saint Teresa and God bless the Sisters of the Poor. https://t.co/rxKXqmdVPH
Great to join @RitaCosby and @77WABCradio to talk #edreform and @excelined! #BacktotheBooks https://t.co/P5BJ5JIfxk
Stunning and disturbing concessions provided - in secret - to Iran by the Obama Administration. https://t.co/XPLUiBXOWE
Praying for my fellow Floridians who are impacted by #Hermine. Be safe and heed guidance of emergency mngt officials https://t.co/ZgkMhtUqT5
Charlie Baker is right. Dems should put students before unions when it comes to #CharterSchools @MassGovernor https://t.co/rR7mlXkyKK
A nice respite from politics. #FSU WR Travis Rudolph is a solid young man.  https://t.co/1f06qFOvXS
Kayla Mueller\u2019s tragic death is a reminder Of President Obama\u2019s failed policies: https://t.co/r8imp7IMtN
cc: @iamjohnoliver @LastWeekTonight https://t.co/QdXObxE9FA
Good charter schools are closing the achievement gap. Caving to unions on this issue is a disservice to students. https://t.co/SBschcfsqZ
