"Our military is building and is rapidly becoming stronger than ever before. Frankly, we have no choice!"
Someone should look into who paid for the small organized rallies yesterday. The election is over!
I did what was an almost an impossible thing to do for a Republican-easily won the Electoral College! Now Tax Returns are brought up again?
Happy Easter to everyone!
Why would I call China a currency manipulator when they are working with us on the North Korean problem? We will see what happens!
RT @FLOTUS: Looking forward to hosting the annual Easter Egg Roll at the @WhiteHouse on Monday! https://t.co/nz7vucugx9
Weekly Address- https://t.co/tpZ7eqJLUH https://t.co/B2NQzj53ft
RT @DRUDGE_REPORT: GREAT AGAIN: FEDS ARREST MURDER SUSPECT IN 'FAST AND FURIOUS' SCANDAL... https://t.co/clOLxTE3D4
It was a great honor to welcome Atlanta's heroic first responders to the White House this afternoon! https://t.co/ZtC14AJ0xs
Things will work out fine between the U.S.A. and Russia. At the right time everyone will come to their senses &amp; there will be lasting peace!
"I have great confidence that China will properly deal with North Korea. If they are unable to do so, the U.S., with its allies, will! U.S.A."
"Jobs are returning, illegal immigration is plummeting, law, order and justice are being restored. We are truly making America great again!"
"One by one we are keeping our promises - on the border, on energy, on jobs, on regulations. Big changes are happening!"
Economic confidence is soaring as we unleash the power of private sector job creation and stand up for the American Workers. #AmericaFirst
Great meeting w/ NATO Sec. Gen. We agreed on the importance of getting countries to pay their fair share &amp; focus on\u2026 https://t.co/G9TdjWezmH
"Great win in Kansas last night for Ron Estes, easily winning the Congressional race against the Dems, who spent heavily &amp; predicted victory!"
Had a very good call last night with the President of China concerning the menace of North Korea.
I will be interviewed by @MariaBartiromo at 6:00 A.M. @FoxBusiness. Enjoy!
Great Strategic &amp; Policy CEO Forum today with my Cabinet Secretaries and top CEO's from around the United States.\u2026 https://t.co/pmGIL08OpP
"Ron Estes is running TODAY for Congress in the Great State of Kansas. A wonderful guy, I need his help on Healthcare &amp; Tax Cuts (Reform)."
"North Korea is looking for trouble. If China decides to help, that would be great. If not, we will solve the problem without them!  U.S.A."
I explained to the President of China that a trade deal with the U.S. will be far better for them if they solve the North Korean problem!
RT @foxnation: Grateful Syrians React To @realDonaldTrump Strike: 'I'll Name My Son Donald' https://t.co/7KexXsXLUx #SyrianStrikes
"Happy Passover to everyone celebrating in the United States of America, Israel, and around the world. #ChagSameach"
Congratulations to Justice Neil Gorsuch on his elevation to the United States Supreme Court. A great day for Americ\u2026 https://t.co/RM9lfTaePS
Thank you @USNavy! #USA https://t.co/oD7L8vPgjq
...confidence that President Al Sisi will handle situation properly.
So sad to hear of the terrorist attack in Egypt. U.S. strongly condemns. I have great...
Judge Gorsuch will be sworn in at the Rose Garden of the White House on Monday at 11:00 A.M. He will be a great Justice. Very proud of him!
The reason you don't generally hit runways is that they are easy and inexpensive to quickly fix (fill in and top)!
"Congratulations to our great military men and women for representing the United States, and the world, so well in the Syria attack."
"...goodwill and friendship was formed, but only time will tell on trade."
It was a great honor to have President Xi Jinping and Madame Peng Liyuan of China as our guests in the United States. Tremendous...
RT @IvankaTrump: Very proud of Arabella and Joseph for their performance in honor of President Xi Jinping and Madame Peng Liyuan's official\u2026
"It was an honor to host our American heroes from the @WWP #SoldierRideDC at the @WhiteHouse today with @FLOTUS, @VP\u2026 https://t.co/u5AI1pupVV"
"JOBS, JOBS, JOBS!\nhttps://t.co/XGOQPHywrt https://t.co/B5Qbn6llzE"
I am deeply committed to preserving our strong relationship &amp; to strengthening America's long-standing support for\u2026 https://t.co/GxrOR3ALCE
Great to talk jobs with #NABTU2017. Tremendous spirit &amp; optimism - we will deliver! https://t.co/6lRuQZZHrc
Thank you Sean McGarvey &amp; the entire Governing Board of Presidents for honoring me w/an invite to speak. #NABTU2017\u2026 https://t.co/dJlZvlq6Tj
.@WhiteHouse #CEOTownHall\n\u27a1\ufe0fhttps://t.co/ADSKuUXf1b https://t.co/XHfQ6zmF2H
RT @DRUDGE_REPORT: RICE ORDERED SPY DOCS ON TRUMP? https://t.co/bL2nZRFxk9
It was an honor to welcome President Al Sisi of Egypt to the @WhiteHouse as we renew the historic partnership betwe\u2026 https://t.co/9mRaGvcPHz
Looking forward to hosting our heroes from the Wounded Warrior Project (@WWP) Soldier Ride to the @WhiteHouse on Th\u2026 https://t.co/QLC0qFD94x
"Getting ready to meet President al-Sisi of Egypt. On behalf of the United States, I look forward to a long and wonderful relationship."
".@FoxNews from multiple sources: ""There was electronic surveillance of Trump, and people close to Trump. This is unprecedented."" @FBI"
Did Hillary Clinton ever apologize for receiving the answers to the debate? Just asking!
Was the brother of John Podesta paid big money to get the sanctions on Russia lifted? Did Hillary know?
"Such amazing reporting on unmasking and the crooked scheme against us by @foxandfriends. ""Spied on before nomination."" The real story."
"Melania and I are honored to light up the @WhiteHouse this evening, for \n#WorldAutismAwarenessDay. Join us &amp; #LIUB.\u2026 https://t.co/tR3hqqyWvv"
The real story turns out to be SURVEILLANCE and LEAKING! Find the leakers.
"Talks on Repealing and Replacing ObamaCare are, and have been, going on, and will continue until such time as a deal is hopefully struck."
Anybody (especially  Fake News media) who thinks that Repeal &amp; Replace of ObamaCare is dead does not know the love and strength in R Party!
Thank you @JCLayfield -- will get even better as my Administration continues to put #AmericaFirst\U0001f1fa\U0001f1f8 https://t.co/AQQzmt10x7
"..not associated with Russia. Trump team spied on before he was nominated."" If this is true, does not get much bigger. Would be sad for U.S."
"Wow, @FoxNews just reporting big news. Source: ""Official behind unmasking is high up. Known Intel official is responsible. Some unmasked...."
"...use subsidies to buy health plans."" In other words, Ocare is dead. Good things will happen, however, either with Republicans or Dems."
"The failing @nytimes finally gets it - ""In places where no insurance company offers plans, there will be no way for ObamaCare customers to.."
"It is the same Fake News Media that said there is ""no path to victory for Trump"" that is now pushing the phony Russia story. A total scam!"
When will Sleepy Eyes Chuck Todd and @NBCNews start talking about the Obama SURVEILLANCE SCANDAL and stop with the Fake Trump/Russia story?
We are going to defend our industry &amp; create a level playing field for the American worker. It is time to put\u2026 https://t.co/dzPKJMghj1
'Trump Celebrates American Manufacturing Survey Showing Highest Level of Optimism in 20 Years' \u27a1\ufe0f\u2026 https://t.co/cVWXOa1MjY
It is an exciting time for our country!\n#WeeklyAddress #ConfirmGorsuch https://t.co/tP4bkvTOBq
#ConfirmGorsuch #SCOTUS https://t.co/WkqHYMcYa3
"Great meeting with a wonderful woman today, former Secretary of State, Condoleezza Rice! #USA\U0001f1fa\U0001f1f8 https://t.co/ZuriIC3YwG"
"It was an honor to welcome the Prime Minister of Denmark, Lars L\xf8kke Rasmussen {@larsloekke} to the @WhiteHouse yes\u2026 https://t.co/N1g0TiVnSp"
"Mike Flynn should ask for immunity in that this is a witch hunt (excuse for big election loss), by media &amp; Dems, of historic proportion!"
Only by enlisting the full potential of women in our society will we be truly able to #MakeAmericaGreatAgain\U0001f1fa\U0001f1f8\u2026 https://t.co/cxhgYaxiek
...and job losses. American companies must be prepared to look at other alternatives.
The meeting next week with China will be a very difficult one in that we can no longer have massive trade deficits...
"Where are @RepMarkMeadows, @Jim_Jordan and @Raul_Labrador?\n#RepealANDReplace #Obamacare"
"If @RepMarkMeadows, @Jim_Jordan and @Raul_Labrador would get on board we would have both great healthcare and massive tax cuts &amp; reform."
Great op-ed from @RepKenBuck. Looks like some in the Freedom Caucus are helping me end #Obamacare. https://t.co/Y2vTnIBTBZ
The failing @nytimes has disgraced the media world. Gotten me wrong for two solid years. Change libel laws? https://t.co/QIqLgvYLLi
"The Freedom Caucus will hurt the entire Republican agenda if they don't get on the team, &amp; fast. We must fight them, &amp; Dems, in 2018!"
Today we honored our true American heroes on the first-ever National Vietnam War Veterans Day.\n#ThankAVeteran\u2026 https://t.co/deOHapcV4J
.@FLOTUS Melania and I were honored to stop by the Women's Empowerment  Panel this afternoon at the @WhiteHouse.\u2026 https://t.co/phLPw8lgTu
Today's EO established a commission on combating drug addiction and the opioid crisis. Watch listening session\u27a1\ufe0f\u2026 https://t.co/ooF2ediqSt
If the people of our great country could only see how viciously and inaccurately my administration is covered by certain media!
"Remember when the failing @nytimes apologized to its subscribers, right after the election, because their coverage was so wrong. Now worse!"
Why doesn't Fake News talk about Podesta ties to Russia as covered by @FoxNews or money from Russia to Clinton - sale of  Uranium?
A NEW ERA IN AMERICAN ENERGY! \n#MadeInTheUSA\U0001f1fa\U0001f1f8\nWatch here: https://t.co/EG02Fdlkba https://t.co/XT12jqoIqj
It was an honor to welcome @GLFOP to the @WhiteHouse today with @VP Pence &amp; Attorney General Sessions. THANK YOU fo\u2026 https://t.co/VHzTB4c69h
The failing @NYTimes would do much better if they were honest! \nhttps://t.co/ATy8R3knS2
Watch @foxandfriends now on Podesta and Russia!
Big announcement by Ford today. Major investment to be made in three Michigan plants. Car companies coming back to U.S.  JOBS! JOBS! JOBS!
"The Democrats will make a deal with me on healthcare as soon as ObamaCare folds - not long. Do not worry, we are in very  good shape!"
The Republican House Freedom Caucus was able to snatch defeat from the jaws of victory. After so many bad years they were ready for a win!
"...money to Bill, the Hillary Russian ""reset,"" praise of Russia by Hillary, or Podesta Russian Company. Trump Russia story is a hoax. #MAGA!"
"Why isn't the House Intelligence Committee looking into the Bill &amp; Hillary deal that allowed big Uranium to go to Russia, Russian speech...."
General Kelly is doing a great job at the border. Numbers are way down. Many are not even trying to come in anymore.
"Democrats are smiling in D.C. that the Freedom Caucus, with the help of Club For Growth and Heritage, have saved Planned Parenthood &amp; Ocare!"
Thanks you for all of the Trump Rallies today. Amazing support. We will all MAKE AMERICA GREAT AGAIN!
Watch @JudgeJeanine on @FoxNews tonight at 9:00 P.M.
ObamaCare will explode and we will all get together and piece together a great healthcare plan for THE PEOPLE. Do not worry!
Happy #MedalOfHonorDay to our heroes! \u27a1\ufe0fhttps://t.co/juAB1RmMh0 https://t.co/Sw5ea1OwUf
"Today, I was thrilled to announce a commitment of $25 BILLION &amp; 20K AMERICAN JOBS over the next 4 years. THANK YOU\u2026 https://t.co/nWJ1hNmzoR"
"Today, I was pleased to announce the official approval of the presidential permit for the #KeystonePipeline. A grea\u2026 https://t.co/GWNo2XAueg"
"The irony is that the Freedom Caucus, which is very pro-life and against Planned Parenthood, allows P.P. to continue if they stop this plan!"
"After seven horrible years of ObamaCare (skyrocketing premiums &amp; deductibles, bad healthcare), this is finally your chance for a great plan!"
It was an honor to welcome so many truckers and trucking industry leaders to the @WhiteHouse today! https://t.co/M1veooVBNE
We are taking action to #RepealANDReplace #Obamacare! Contact your Rep &amp; tell them you support #AHCA. #PassTheBill\u2026 https://t.co/5lsrDJXfzb
"A great American, Kurt Cochran, was killed in the London terror attack. My prayers and condolences are with his family and friends."
Just watched the totally biased and fake news reports of the so-called Russia story on NBC and ABC. Such dishonesty!
Spoke to U.K. Prime Minister Theresa May today to offer condolences on the terrorist attack in London. She is strong and doing very well.
RT @mitchellvii: Trump always ends up being right.  It's almost a little freaky.
RT @mitchellvii: EXACTLY AS I SAID - House Intel Chair: We Cannot Rule Out Sr. Obama Officials Were Involved in Trump Surveillance https://\u2026
Big day for healthcare. Working hard!
"Today on #NationalAgDay, we honor our great American farmers &amp; ranchers. Their hard work &amp; dedication are ingrained\u2026 https://t.co/IpGRhly2zj"
"Honored to sign S.442 today. With this legislation, we support @NASA's scientists, engineers, and astronauts in the\u2026 https://t.co/Z5VwluvJQx"
Joined the @HouseGOP Conference this morning at the U.S. Capitol. https://t.co/03e4YBIWr0 #PassTheBill #MAGA\U0001f1fa\U0001f1f8\u2026 https://t.co/3swdFWGQtP
"Thank you Louisville, Kentucky. Together, we will MAKE AMERICA SAFE AND GREAT AGAIN! https://t.co/qGgWEWUvek"
"Thank you Louisville, Kentucky- on my way! #MAGA\U0001f1fa\U0001f1f8 https://t.co/3QsBsib6kt"
Congratulations Eric &amp; Lara. Very proud and happy for the two of you! https://t.co/s0T3cTQc40
"What about all of the contact with the Clinton campaign and the Russians? Also, is it true that the DNC would not let the FBI in to look?"
Just heard Fake News CNN is doing polls again despite the fact that their election polls were a WAY OFF disaster. Much higher ratings at Fox
"The real story that Congress, the FBI and all others should be looking into is the leaking of Classified information. Must find leaker now!"
The Democrats made up and pushed the Russian story as an excuse for running a terrible campaign. Big advantage in Electoral College &amp; lost!
James Clapper and others stated that there is no evidence Potus colluded with Russia. This story is FAKE NEWS and everyone knows it!
#ICYMI: Weekly Address \n\u27a1\ufe0fhttps://t.co/ckVx2zgA1x https://t.co/dTGZLvlsGv
"...vast sums of money to NATO &amp; the United States must be paid more for the powerful, and very expensive, defense it provides to Germany!"
"Despite what you have heard from the FAKE NEWS, I had a GREAT meeting with German Chancellor Angela Merkel. Nevertheless, Germany owes....."
Great meeting with the @RepublicanStudy Committee this morning at the @WhiteHouse! https://t.co/8Y2UoHoYaY
"""The President Changed. So Has Small Businesses' Confidence""\nhttps://t.co/daTGjPmYeJ"
"North Korea is behaving very badly. They have been ""playing"" the United States for years. China has done little to help!"
"RT @foxandfriends: FOX NEWS ALERT: Jihadis using religious visa to enter US, experts warn (via @FoxFriendsFirst) https://t.co/pwXeR9OMQC"
RT @foxandfriends: VIDEO: Rep. Scalise \u2014 GOP agrees on over 85 percent of health care bill https://t.co/05dtfjAUbx
RT @AmericaFirstPol: MAJOR IMPACT: @POTUS Trump is 50 Days in and moving swiftly to get America back on the right track. #MAGA \nhttps://t.c\u2026
RT @FoxNews: Jobs created in February. https://t.co/sOaMDxxTA8
Happy L\xe1 Fheile Phadraig to all of my great Irish friends!
"RT @DiamondandSilk: When the President says ""You're Fired""     That means: ""Pack Yo Stuff and Go, Not Say ""You Refuse to Go!  #DrainTheSwam\u2026"
My representatives had a great meeting w/ the Hispanic Chamber of Commerce at the WH today. Look forward to tremendous growth &amp; future mtgs!
Great progress on healthcare. Improvements being made - Republicans coming together!
RT @USHCC: USHCC was delighted to host @IvankaTrump for a roundtable discussion w/ Hispanic women biz owners today in Washington #USHCCLegi\u2026
"An honor to welcome the Taoiseach of Ireland, @EndaKennyTD to the @WhiteHouse today with @VP Pence. \U0001f1fa\U0001f1f8\U0001f1ee\U0001f1ea https://t.co/J3iTl2iSiQ"
A budget that puts #AmericaFirst must make safety its no. 1 priority\u2014without safety there can be no prosperity: https://t.co/9lxx1iQo7m
"Thank you Nashville, Tennessee! https://t.co/6snvQ0DzXN"
"In Nashville, Tennessee! Lets MAKE AMERICA GREAT AGAIN! https://t.co/m5UR4vv6UH"
Thank you Andrew Jackson! #POTUS7 #USA\U0001f1fa\U0001f1f8 https://t.co/GToWsWXiNv
I will be interviewed by @TuckerCarlson tonight at 9:00 P.M. on @FoxNews. Enjoy!
CEO's most optimistic since 2009. It will only get better as we continue to slash unnecessary regulations and when we begin our big tax cut!
"Looking forward to a big rally in Nashville, Tennessee, tonight. Big crowd of great people expected. Will be fun!"
"Will be going to Detroit, Michigan (love), today for a big meeting on bringing back car production to State &amp; U.S. Already happening!"
"Can you imagine what the outcry would be if @SnoopDogg, failing career and all, had aimed and fired the gun at President Obama? Jail time!"
"Does anybody really believe that a reporter, who nobody ever heard of, ""went to his mailbox"" and found my tax returns? @NBCNews  FAKE NEWS!"
Great optimism in America \u2013 and the results will be even better! https://t.co/SYBl47CsZn
"JOBS, JOBS, JOBS! https://t.co/wAkQMKdPXA"
"Meeting w/ Washington, D.C. @MayorBowser and Metro GM Paul Wiedefeld about incoming winter storm preparations here\u2026 https://t.co/mg0A4Hq3bD"
Proud to welcome our great Cabinet this afternoon for our first meeting. Unfortunately 4 seats were empty because S\u2026 https://t.co/bMYph832hF
Healthcare listening session w/ @VP &amp; @SecPriceMD. Watch: https://t.co/5ayQ4dr8Ip #ReadTheBill:\u2026 https://t.co/1cQI0ZBUv8
"ObamaCare is imploding. It is a disaster and 2017 will be the worst year yet, by far! Republicans will come together and save the day."
"It is amazing how rude much of the media is to my very hard working representatives. Be nice, you will do much better!"
"RT @AmericaFirstPol: .@POTUS Trump led a historic journey to the White House. 50 days in, that historic journey continues. Take a look \U0001f449 ht\u2026"
We are making great progress with healthcare. ObamaCare is imploding and will only get worse. Republicans coming together to get job done!
Weekly Address - 11:00 A.M. at the @WhiteHouse! #MAGA\U0001f1fa\U0001f1f8\n\u27a1\ufe0fhttps://t.co/YSaPJnSX2i https://t.co/Gb8iTGzb6j
"RT @DRUDGE_REPORT: GREAT AGAIN:  +235,000 https://t.co/GkockGNdtC"
"RT @foxandfriends: ""Never give up....that's the worst thing you could do. There's always a chance."" -Kyle Coddington's message to those als\u2026"
Honored to meet this years @SenateYouth delegates w/ @VP Pence in the East Room of the @WhiteHouse. Congratulations\u2026 https://t.co/oQIx7LybCV
'U.S. Consumer Comfort Just Reached Its Highest Level in a Decade' \u27a1\ufe0fhttps://t.co/S8nZgmeMMV https://t.co/xC0piRa6eP
"Despite what you hear in the press, healthcare is coming along great. We are talking to many groups and it will end in a beautiful picture!"
RT @foxnation: .@realDonaldTrump's First Full Month in Office Sees Biggest Jobs Gain 'In Years': Report: https://t.co/rx4bgI1MWK
"Great news. We are only just beginning. Together, we are going to #MAGA! https://t.co/BSp685Q9Qf https://t.co/K7yeBZsf6r"
Met with @RepCummings today at the @WhiteHouse. Great discussion!
LinkedIn Workforce Report: January and February were the strongest consecutive months for hiring since August and September 2015
"On International Women's Day, join me in honoring the critical role of women here in America &amp; around the world."
I have tremendous respect for women and the many roles they serve that are vital to the fabric of our society and our economy.
I feel sure that my friend @RandPaul will come along with the new and great health care program because he knows Obamacare is a disaster!
"Don't let the FAKE NEWS tell you that there is big infighting in the Trump Admin. We are getting along great, and getting major things done!"
I am working on a new system where there will be competition in the Drug Industry. Pricing for the American people will come way down!
"Don't worry, getting rid of state lines, which will promote competition, will be in phase 2 &amp; 3 of healthcare rollout. @foxandfriends"
"For eight years Russia ""ran over"" President Obama, got stronger and stronger, picked-off Crimea and added missiles. Weak! @foxandfriends"
Our wonderful new Healthcare Bill is now out for review and negotiation. ObamaCare is a complete and total disaster - is imploding fast!
"122 vicious prisoners, released by the Obama Administration from Gitmo, have returned to the battlefield. Just another terrible decision!"
"Thank you to @exxonmobil for your $20 billion investment that is creating more than 45,000 manufacturing &amp; construction jobs in the USA!"
"Buy American &amp; hire American are the principles at the core of my agenda, which is: JOBS, JOBS, JOBS! Thank you @exxonmobil."
There is an incredible spirit of optimism sweeping the country right now\u2014we're bringing back the JOBS! https://t.co/BNSLvKiEVj
"45,000 construction &amp; manufacturing jobs in the U.S. Gulf Coast region. $20 billion investment. We are already winning again, America!"
'President Trump Congratulates Exxon Mobil for Job-Creating Investment Program'\nhttps://t.co/adBzWhtq8S
Thank you for the great rallies all across the country. Tremendous support. Make America Great Again!
"Who was it that secretly said to Russian President, ""Tell Vladimir that after the election I'll have more flexibility?"" @foxandfriends"
Is it true the DNC would not allow the FBI access to check server or other equipment after learning it was hacked? Can that be possible?
"Arnold Schwarzenegger isn't voluntarily leaving the Apprentice, he was fired by his bad (pathetic) ratings, not by me. Sad end to great show"
How low has President Obama gone to tapp my phones during the very sacred election process. This is Nixon/Watergate. Bad (or sick) guy!
"I'd bet a good lawyer could make a great case out of the fact that President Obama was tapping my phones in October, just prior to Election!"
"Is it legal for a sitting President to be ""wire tapping"" a race for president prior to an election? Turned down by court earlier. A NEW LOW!"
"Just out: The same Russian Ambassador that met Jeff Sessions visited the Obama White House 22 times, and 4 times last year alone."
"Terrible! Just found out that Obama had my ""wires tapped"" in Trump Tower just before the victory. Nothing found. This is McCarthyism!"
The first meeting Jeff Sessions had with the Russian Amb was set up by the Obama Administration under education program for 100 Ambs......
MAKE AMERICA GREAT AGAIN! https://t.co/kuQiZDz4rA
"I hereby demand a second investigation, after Schumer, of Pelosi for her close ties to Russia, and lying about it. https://t.co/qCDljfF3wN"
We must fix our education system for our kids to Make America Great Again. Wonderful day at Saint Andrew in Orlando. https://t.co/OTJaHcvLzf
We should start an immediate investigation into @SenSchumer and his ties to Russia and Putin. A total hypocrite! https://t.co/Ik3yqjHzsA
Weekly Address\nJoin me here: https://t.co/SEavQK5zy5 https://t.co/EnyXYeqgcp
It is so pathetic that the Dems have still not approved my full Cabinet.
"Nick Adams new book, Green Card Warrior, is a must read. The merit-based system is the way to go. Canada, Australia! @foxandfriends"
"...is all of the illegal leaks of classified and other information. It is a total ""witch hunt!"""
"...to win. The Democrats are overplaying their hand. They lost the election, and now they have lost their grip on reality. The real story..."
...intentional. This whole narrative is a way of saving face for Democrats losing an election that everyone thought they were supposed.....
"Jeff Sessions is an honest man. He did not say anything wrong. He could have stated his response more accurately, but it was clearly not...."
"Since November 8th, Election Day, the Stock Market has posted $3.2 trillion in GAINS and consumer confidence is at a 15 year high. Jobs!"
THANK YOU!
#JointSession #MAGA\U0001f1fa\U0001f1f8\nhttps://t.co/RDO6Jt2pip
Join me live at 9:00 P.M. \n#JointAddress https://t.co/J882zbyVkJ https://t.co/gTtK3vJmkU
I will be interviewed on @foxandfriends at 6:00 A.M. Enjoy!
"GOP now viewed more favorably than Dems, in Trump era (per NBC/WSJ poll) via @HotlineJosh:\nhttps://t.co/Soebxtg2Zd"
Great meeting with CEOs of leading U.S. health insurance companies who provide great healthcare to the American peo\u2026 https://t.co/60jigi6ffS
"Big dinner with Governors tonight at White House. Much to be discussed, including healthcare."
"Russia talk is FAKE NEWS put out by the Dems, and played up by the media, in order to mask the big election defeat and the illegal leaks!"
For first time the failing @nytimes will take an ad (a bad one) to help save its failing reputation. Try reporting accurately &amp; fairly!
"The race for DNC Chairman was, of course, totally ""rigged."" Bernie's guy, like Bernie himself, never had a chance. Clinton demanded Perez!"
