"Unbelievable evening in Melbourne, Florida w/ 15,000 supporters- and an additional 12,000 who could not get in. Tha\u2026 https://t.co/VU5wh2zXBU"
"Join me for a 3pm rally - tomorrow at the Mid-America Center in Council Bluffs, Iowa! Tickets:\u2026 https://t.co/dfzsbICiXc"
"Once again, we will have a government of, by and for the people. Join the MOVEMENT today! https://t.co/lWjYDbPHav https://t.co/uYwJrtZkAe"
"RT @GOP: On National #VoterRegistrationDay, make sure you're registered to vote so we can #MakeAmericaGreatAgain https://t.co/GKcaLkx8C8 ht\u2026"
Hillary Clinton's Campaign Continues To Make False Claims About Foundation Disclosure: \nhttps://t.co/zhkEfUouHH
"'CNBC, Time magazine online polls say Donald Trump won the first presidential debate' via @WashTimes. #MAGA\nhttps://t.co/PGimqYKPoJ"
Great afternoon in Little Havana with Hispanic community leaders. Thank you for your support! #ImWithYou https://t.co/vxWZ2tyJTF
"In the last 24 hrs. we have raised over $13M from online donations and National Call Day, and we\u2019re still going! Thank you America! #MAGA"
"Well, now they're saying that I not only won the NBC Presidential Forum, but last night the big debate. Nice!"
"Thank you for your endorsement, @GovernorSununu. #MAGA \nhttps://t.co/8BEeQPsuyd"
Such a great honor. Final debate polls are in - and the MOVEMENT wins!\n#AmericaFirst #MAGA #ImWithYou\u2026 https://t.co/DV1BKMwHEM
'U.S. Murders Increased 10.8% in 2015' via @WSJ: https://t.co/CIJMQJhLqp
Thank you! #TrumpWon #MAGA \nhttps://t.co/a5rr1i38km
Hillary's been failing for 30 years in not getting the job done - it will never change.
'True blue-collar billionaire Donald Trump shows Hillary Clinton is out of touch' https://t.co/NHO1OicfVm
The #1 trend on Twitter right now is #TrumpWon - thank you!
I won every poll from last nights Presidential Debate - except for the little watched @CNN poll.
'How Trump won over a bar full of undecideds and Democrats'\nhttps://t.co/WWO39kxn8Y
I really enjoyed the debate last night.Crooked Hillary says she is going to do so many things.Why hasn't she done them in her last 30 years?
Great debate poll numbers - I will be on @foxandfriends at 7:00 to discuss. Enjoy!
"Thank you! Four new #DebateNight polls with the MOVEMENT winning. Together, we will MAKE AMERICA SAFE &amp; GREAT AGAIN\u2026 https://t.co/39FCnUf8Pb"
.@DRUDGE_REPORT's First Presidential Debate Poll:\nTrump: 80%\nClinton: 20%\nJoin the MOVEMENT today &amp; lets #MAGA!\u2026 https://t.co/B12lgC97tn
"Thank you! CNBC #DebateNight poll with over 400,000 votes. \nTrump 61%\nClinton 39%\n#AmericaFirst #ImWithYou\u2026 https://t.co/MJ3NwA98op"
"TIME #DebateNight poll - over 800,000 votes. Thank you! \n#AmericaFirst #MAGA https://t.co/bTPX9E0wKu"
".@newtgingrich just said ""a historic victory for Trump."" NICE!"
"Wow, did great in the debate polls (except for @CNN - which I don't watch). Thank you!"
Thank you Governor @TerryBranstad! \n#AmericaFirst #Debates2016 https://t.co/yIeZctdQy8
Thank you Governor @Mike_Pence!\nLets MAKE AMERICA SAFE AND GREAT AGAIN with the American people. \n#AmericaFirst\u2026 https://t.co/6k7qP9X8nC
Thank you Senator @TedCruz!\n#Debates2016 #MAGA https://t.co/cgO6109USJ
.@HillaryClinton\u2019s Nuclear Agreement Paved The Way For The $400 Million Ransom Payment #DebateNight\nhttps://t.co/qfZTx6aKYs
Nothing on emails. Nothing on the corrupt Clinton Foundation. And nothing on #Benghazi. #Debates2016 #debatenight
.@HillaryClinton - Obama #ISIS Strategy Has Allowed It To Expand To Become A Global Threat #DebateNight https://t.co/f7PctDE31L
RT @TeamTrump: .@realDonaldTrump calling out @HillaryClinton's support for NAFTA = most searched moment during tonight's debate. #Debates20\u2026
"Russia has more warheads than ever, N Korea is testing nukes, and Iran got a sweetheart deal to keep theirs. Thanks, @HillaryClinton."
Hillary Clinton failed all over the world. \n\u274cLIBYA\n\u274cSYRIA\n\u274cIRAN\n\u274cIRAQ\n\u274cASIA PIVOT\n\u274cRUSSIAN RESET\n\u274cBENGHAZI\u2026 https://t.co/OoakXs2rij
RT @TeamTrump: 100% TRUE --&gt; @realDonaldTrump is right - @HillaryClinton did call TPP \u2018the gold standard\u2019 #Debates2016 \nhttps://t.co/W7L7a9\u2026
Hillary Clinton is the only candidate on stage who voted for the Iraq War. #Debates2016 #MAGA https://t.co/Um5WJXEEKr
.@HillaryClinton's 2008 Campaign And Supporters Trafficked In Rumors About Obama's Heritage #DebateNight \nhttps://t.co/6EEOAaCiNv
"RT @TeamTrump: Hillary's policies have made America less safe, that's why 200+ general and military leaders have endorsed @realDonaldTrump!\u2026"
RT @DanScavino: Jesse Jackson on @realDonaldTrump - when he donated space for the Rainbow/Push Coalition. \n#DebateNight https://t.co/JTbqO0\u2026
I will stand with police and protect ALL Americans! #Debates2016 #MAGA https://t.co/CX4oEWgEMp
"RT @TeamTrump: When @realDonaldTrump is POTUS, families are going to be safe and secure. Law and order will be RESTORED! #MAGA #Debates #De\u2026"
RT @TeamTrump: WATCH: @realDonaldTrump on the stakes in this election #Debates2016 https://t.co/l7DSbPXDGh
"This is the simple fact about @HillaryClinton: she is a typical politician - all talk, no action. #Debates2016"
HILLARY'S BAD TAX HABIT! https://t.co/x3FBy8Hdq2
A Clinton economy = more taxes and more spending! #DebateNight https://t.co/oFlaAhrwe5
.@HillaryClinton has been part of the rigged DC system for 30 years? Why would we take policy advice from her? #Debates2016
"Instead of driving jobs and wealth away, AMERICA will become the world's great magnet for innovation and job creati\u2026 https://t.co/02NMQn3ZNQ"
.@HillaryClinton channels John Kerry on trade: she was for bad trade deals before she was against them. #TPP #Debates2016
.@HillaryClinton and Obama policies increased debt by $9trillion over the last 8 years
RT @TeamTrump: A @realDonaldTrump Administration will bring JOBS BACK! #Debates2016 https://t.co/4O3rIyycyW
Why isn't Hillary Clinton 50 points ahead?\n#DebateNight https://t.co/iux7icIkaT
RT @DanScavino: Join @realDonaldTrump on his official social media platforms during tonight's debate ~ as @TeamTrump manages rapid response\u2026
My team of deplorables will be managing my Twitter account for this evenings debate. Tune in!\n#DebateNight #TrumpPence16
"RT @KellyannePolls: #Polls showing @realDonaldTrump surging, @hillaryclinton #slipping, have HER camp on defense/lowering expectations, goi\u2026"
New national Bloomberg poll just released - thank you! Join the MOVEMENT: https://t.co/3KWOl2ibaW. \n#TrumpTrain\u2026 https://t.co/xDGCwYVK0Q
"Really sad news: The great Arnold Palmer, the ""King,"" has died. There was no-one like him - a true champion! He will be truly missed."
Five people killed in Washington State by a Middle Eastern immigrant. Many people died this weekend in Ohio from drug overdoses. N.C. riots!
Readout of my meeting with Israeli Prime Minister Benjamin Netanyahu:\nhttps://t.co/VHuyE65hgi https://t.co/6KDPrQxSED
Looking forward to my meeting with Benjamin Netanyahu in Trump Tower at 10:00 A.M.
Bernie Sanders gave Hillary the Dem nomination when he gave up on the e-mails. That issue has only gotten bigger!
"Many on the team and staff of Bernie Sanders have been treated badly by the Hillary Clinton campaign - and they like Trump on trade, a lot!"
"Thank you Roanoke, Virginia - this a MOVEMENT - join us today!\nSign up: https://t.co/NQEgRxQN2m\n#AmericaFirst\u2026 https://t.co/Rz3DkpBQJu"
"If dopey Mark Cuban of failed Benefactor fame wants to sit in the front row, perhaps I will put Gennifer Flowers right alongside of him!"
Will be back in Virginia tonight- for a 6pm rally at the Berglund Center in Roanoke. Join me! Tickets:\u2026 https://t.co/6pQMSgPWuN
"""@KellyannePolls: Trump is headed for a win, says professor who has predicted 30 years of presidential outcomes   https://t.co/68WEMcuHSO"""
The @SenTedCruz endorsement was a wonderful surprise. I greatly appreciate his support! We will have a tremendous victory on November 8th.
Today is the day! Knock on doors and make calls with us on National Day of Action! #TrumpTrain #MAGA\u2026 https://t.co/4iW06ROvsT
"Crooked Hillary's bad judgement forced her to announce that she would go to Charlotte on Saturday to grandstand. Dem pols said no way, dumb!"
"Join me in Roanoke, Virginia tomorrow at the Berglund Center- Coliseum ~ 6pm! Tickets available at:\u2026 https://t.co/bnEE6NX41Z"
'How Trump Would Stimulate the U.S. Economy'\nhttps://t.co/jU3HHglnIu
"Hillary Clinton just lost every Republican she ever had, including Never Trump, all farmers &amp; sm. biz, by saying she\u2019ll tax estates at 65%."
Tomorrow's the day! Knock on doors and make calls with us on National Day of Action! #TrumpTrain #MAGA\u2026 https://t.co/05NY0wJHkL
RT @dcexaminer: EXCLUSIVE: How Donald Trump's 30 million followers are crashing the Internet https://t.co/hV2z4yrTU7 https://t.co/lWkjmdyQ7Q
Spoke with Governor @PatMcCroryNC of North Carolina today. He is doing a tremendous job under tough circumstances.
This is more than a campaign- it is a movement. #MakeAmericaGreatAgain\nSIGN UP TODAY &amp; WE WILL WIN! https://t.co/2XBs5SSRC3
"Join me in Roanoke, Virginia on Saturday evening at 6pm! #MAGA\nhttps://t.co/uKG55Pznwu"
Will be on @foxandfriends now.
"I will be interviewed from Cleveland, Ohio, on @seanhannity - Tonight at 10:00 P.M. Enjoy!"
"""@ThAllenSBoucher: @DiamondandSilk @realDonaldTrump @seanhannity I love those beautiful gals."" D + S = Two amazing women!"
.@YoungDems4Trump  Thank you!
"Great new polls! Thank you Nevada, North Carolina &amp; Ohio. Join the MOVEMENT today &amp; lets #MAGA!\u2026 https://t.co/Y8Sb8MNyXA"
"Thank you Toledo, Ohio! It is so important for you to get out and VOTE on November 8, 2016! Lets MAKE AMERICA SAFE\u2026 https://t.co/MQdp4GgLIE"
"RT @GMA: WATCH: @IvankaTrump on ""women who work;"" empowering campaign celebrates modern women.  https://t.co/rMFe9o6WcL"
"Hopefully the violence &amp; unrest in Charlotte will come to an immediate end. To those injured, get well soon. We need unity &amp; leadership."
The situations in Tulsa and Charlotte are tragic. We must come together to make America safe again.
"It is a MOVEMENT - not a campaign. Leaving the past behind, changing our future. Together, we will MAKE AMERICA SAF\u2026 https://t.co/Lt2L3NKzyi"
"Thank you Kenansville, North Carolina! Remember- on November 8th, that special interest gravy train is coming to a\u2026 https://t.co/AysJRMzvKw"
"Thank you High Point, NC! I will fight for every neglected part of this nation &amp; I will fight to bring us together\u2026 https://t.co/DSaUpSptBz"
"Hillary Clinton is taking the day off again, she needs the rest. Sleep well Hillary - see you at the debate!"
Heading to North Carolina for two big rallies. Will be there soon. We will bring jobs back where they belong!
Do people notice Hillary is copying my airplane rallies - she puts the plane behind her like I have been doing from the beginning.
Thank you Nevada! #AmericaFirst\n#MakeAmericaGreatAgain \nhttps://t.co/3KWOl2ibaW https://t.co/RJqHgq2Rn0
Thank you Georgia! #AmericaFirst\n#MakeAmericaGreatAgain \nhttps://t.co/3KWOl2ibaW https://t.co/y01qpON7h7
"Crooked Hillary has been fighting ISIS, or whatever she has been doing, for years. Now she has new ideas. It is time for change."
Amazing rally in Florida - this is a MOVEMENT! Join us today at https://t.co/3KWOl2ibaW. https://t.co/BF1IqPXNho
"Together, we will MAKE AMERICA SAFE AND GREAT AGAIN! #ImWithYou #AmericaFirst https://t.co/XhwUGw0v2H"
"I will be interviewed on the @oreillyfactor - tonight from Florida, now. Enjoy!"
Philly FOP Chief On Presidential Endorsement: Clinton \u2018Blew The Police Off' https://t.co/ATBY343pS1
"Hillary Clinton's weakness while she was Secretary of State, has emboldened terrorists all over the world..cont: https://t.co/E5BdTiwlur"
Once again someone we were told is ok turns out to be a terrorist who wants to destroy our country &amp; its people- how did he get thru system?
"Great job once again by law enforcement! We are proud of them and should embrace them - without them, we don't have a country!"
"""@TarukMatuk: @CNN @FoxNews @realDonaldTrump @RogerRice10 Refugees from Syria over 10k plus more coming. Lots young males, poorly vetted."
"""@AngPiazza: @foxandfriends  @realDonaldTrump he's the ONLY candidate that will keep us safe!"""
Will be on @foxandfriends at 7:02 A.M.  Enjoy.
"Terrible attacks in NY, NJ and MN this weekend. Thinking of victims, their families and all Americans! We need to be strong!"
"Under the leadership of Obama &amp; Clinton, Americans have experienced more attacks at home than victories abroad. Time to change the playbook!"
HAPPY BIRTHDAY - to the United States Air Force!! https://t.co/5Gwi1M5R2t
RT @KellyannePolls: more media #polls showing @realDonaldTrump ahead in states Pres Obama won twice. https://t.co/EGySAz6Am1
"I would like to express my warmest regards, best wishes and condolences to all of the families and victims of the horrible bombing in NYC."
"Never met but never liked dopey Robert Gates. Look at the mess the U.S. is in. Always speaks badly of his many bosses, including Obama."
"Heading to Colorado for a big rally. Massive crowd, great people! Will be there soon - the polls are looking good."
"My lawyers want to sue the failing @nytimes so badly for irresponsible intent. I said no (for now), but they are watching. Really disgusting"
"The failing @nytimes has gone nuts that Crooked Hillary is doing so badly. They are willing to say anything, has become a laughingstock rag!"
"Crazy Maureen Dowd, the wacky columnist for the failing @nytimes, pretends she knows me well--wrong!"
"Wacky @NYTimesDowd, who hardly knows me, makes up things that I never said for her boring interviews and column. A neurotic dope!"
".@CNN just doesn't get it, and that's why their ratings are so low - and getting worse. Boring anti-Trump panelists, mostly losers in life!"
I never met former Defense Secretary Robert Gates. He knows nothing about me. But look at the results under his guidance - a total disaster!
Crooked Hillary wants to take your 2nd Amendment rights away. Will guns be taken from her heavily armed Secret Service detail? Maybe not!
My thoughts and prayers go out to the @PhillyPolice &amp; @Penn police officers- in Philadelphia. https://t.co/eyC3W1mweY
"""Donald Trump\u2019s birther event is the greatest trick he\u2019s ever pulled""\nhttps://t.co/zvVQnxeiQ9"
A very interesting take from @KatiePavlich: https://t.co/XaM9yEYCHL
Just arrived in Texas - have been informed two @fortworthpd officers have been shot. My thoughts and prayers are with them.
"Just leaving Miami for Houston, Oklahoma and Colorado. Miami crowd was fantastic!"
Great parade in The Villages- I love you all. We will #MAGA. Thank you for the incredible support-I will not forget! https://t.co/5qTDijU3hn
I am truly honored and grateful for receiving SO much support from our American heroes...https://t.co/S9bvbysiOr https://t.co/JJQncd3zhf
"I am now going to the brand new Trump International, Hotel D.C. for a major statement."
"Thank you for a great evening - Laconia, New Hampshire -- will be back soon! #AmericaFirst\nhttps://t.co/3KWOl2ibaW https://t.co/QWbYm2lY7B"
"""@AK_TWEET: #TheDonald's hair gets the #JimmyFallon treatment on #TheTonightShow #TrumpPence16 https://t.co/0RRPbfIgXH""  So true!"
"""@jimmyfallon: Tonight: @realDonaldTrump, @normmacdonald, a performance by Kiiara,and your funniest #MyTeacherIsWeird tweets. #FallonTonight"
"Instead of driving jobs and wealth away, AMERICA will become the WORLD'S great magnet for innovation &amp; job creation! https://t.co/cvu20ZQSVJ"
Will be joining @jimmyfallon on @FallonTonight at 11:35pmE tonight. Enjoy!
RT @EricTrump: What a scary statistic! Americans are working harder and making less! We need competent leadership! https://t.co/jcGCbVOf6v
I will be interviewed by @jessebwatters on @oreillyfactor tonight at 8pm. Enjoy!
Full transcript of economic plan- delivered to the Economic Club of New York. #MAGA https://t.co/xiu9AUiSSD https://t.co/Fsy1diPWjU
Thank you @JerryJrFalwell! https://t.co/jzUQxkW4tB
Thank you to all of our law enforcement officers - across America! #LESM #MAGA \nhttps://t.co/Mcbc2JzhN2 https://t.co/4MTmR8kXVb
Thank you for having me! I enjoyed the tour and spending time with everyone. See you soon. #MAGA https://t.co/eNtS7IBPDo
Will be on @foxandfriends at 7:00 A.M. Enjoy!
"""@ghfanlovessonny: @realDonaldTrump you have my vote in Pennsylvania. Trump 2016"" Thank you!"
I was never a fan of Colin Powell after his weak understanding of weapons of mass destruction in Iraq = disaster. We can do much better!
I will be interviewed on @foxandfriends tomorrow at 7am. Enjoy!
Great poll out of Nevada- thank you! See you soon. #MAGA #AmericaFirst\nhttps://t.co/3KWOl2ibaW https://t.co/27sR3MjjXc
"Great evening in Canton, Ohio-thank you! We are going to MAKE AMERICA GREAT AGAIN! Join us: \nhttps://t.co/3KWOl2ibaW https://t.co/4MvwUj9eX9"
Honor to have been interviewed by the very wonderful @bishopwtjackson in Detroit last week - tune in at 9pmE. Enjoy! https://t.co/9ahPnfhQ5N
Thank you Ohio! Just landed in Canton for a rally at the Civic Center. Join me at 7pm: https://t.co/s0XVVNyBKf https://t.co/UtCRxykurW
Thank you Florida- can't wait to see you Friday in Miami! Join me:\nhttps://t.co/rsx313493u https://t.co/JxsWXz05T9
Thank you @ATFD17! #ImWithYou\nVideo: https://t.co/z9Yg83VTF4
Great poll Florida - thank you! \n#ImWithYou #AmericaFirst https://t.co/6Odle7j1hd
Thank you Ohio - see you tonight! https://t.co/0DyHkzzWvj
Russia took Crimea during the so-called Obama years. Who wouldn't know this and why does Obama get a free pass?
Why isn't President Obama working instead of campaigning for Hillary Clinton?
Thank you Rep. @CynthiaLummis!\nhttps://t.co/4S4pnx4Q6r https://t.co/PLUKlsPXPR
Thank you Rep. @MarshaBlackburn!\nhttps://t.co/vxEk0X4ntS https://t.co/9gAk0FWqZ8
Thank you @RepReneeEllmers!\nhttps://t.co/1DrZpfa6je https://t.co/rzEw8pQhds
RT @LouDobbs: Trump outlines new child-care policy proposals via the @FoxNews App @realDonaldTrump seems a candidate of destiny https://t.c\u2026
CHILD CARE REFORMS THAT WILL MAKE AMERICA GREAT AGAIN!\nTranscript: https://t.co/rntyxBSb9J\nhttps://t.co/5SWmxfVfto https://t.co/j389Quo4bg
"RT @IvankaTrump: Ivanka penned an Op-Ed that ran in the @WSJ this afternoon, read it here. https://t.co/3QE4nRXzLZ @realDonaldTrump https:/\u2026"
#ImWithYou #AmericaFirst https://t.co/Ne4pI7FyU7
RT @IvankaTrump: Ivanka is joining @realDonaldTrump to outline an innovative new child care policy to support American families. Tune in to\u2026
"Thank you Clive, Iowa!\nhttps://t.co/tuZ35BkD9J"
"Join us today! Together, we will \n#MakeAmericaGreatAgain!\nhttps://t.co/v40n8RXgti https://t.co/e3KQfBR2K8"
Heading to Iowa- join me today at noon! #MakeAmericaGreatAgain\nTickets: https://t.co/TEY6BbCyxt https://t.co/QyR2MDYYbZ
"Join me in Clive, Iowa tomorrow at noon! #AmericaFirst #MAGA\nTickets: https://t.co/TEY6BbCyxt https://t.co/l17uzRPyLs"
"""@brimyers813: Saw ur speech on Twitter. U give me hope and optimism. I feel as though I am in the room with u. I pray 4 ur/our success."""
"Just got back from Asheville,  North Carolina, where we had a massive rally. The spirit of the crowd was unbelievable. Thank you!  #MAGA"
Stopped by @TrumpDC to thank all of the tremendous men &amp; women for their hard work! https://t.co/oGcJL4N454
Will be on @CNBC at @7:22. Enjoy!
I will be interviewed on @foxandfriends at 7:00 A.M.
#NeverForget\nhttps://t.co/G5TMAUzy0z
"The seriously failing @nytimes, despite so much winning and poll numbers that will soon put me in first place, only writes dishonest hits!"
Hillary Clinton just had her 47% moment. What a terrible thing she said about so many great Americans!
"RT @BarackObama: RT if you agree: We need a President who is fighting for all Americans, not one who writes off nearly half the country."
"While Hillary said horrible things about my supporters, and while many of her supporters will never vote for me, I still respect them all!"
"Really sad that Republicans would allow themselves to be used in a Clinton ad. Lindsey Graham, Romney, Flake, Sass. SUPREME COURT, REMEMBER!"
"Wow, Hillary Clinton was SO INSULTING to my supporters, millions of amazing, hard working people. I think it will cost her at the Polls!"
"Will be in Missouri today with Melania for the funeral of a wonderful and truly respected woman, Phyllis S!"
"""@Stvzbnk: Just Watched @tonyschwartz. Obviously Tony is a Total Whack Job @realDonaldTrump"""
"Just returned from Pensacola, Florida, where the crowd was incredible."
"I havn't seen @tonyschwartz in many years, he hardly knows me. Never liked his style. Super lib, Crooked H supporter. Irrelevant dope!"
"Dummy writer @tonyschwartz, who wanted to do a second book with me for years (I said no), is now a hostile basket case who feels jilted!"
Thank you Florida - we are going to MAKE AMERICA GREAT AGAIN! Join us: https://t.co/3KWOl2ibaW. \n#AmericaFirst https://t.co/vzKtRxzvwv
"Will be delivering a major speech tonight - live on @oreillyfactor at 8:10pm from Pensacola, Florida."
"Thank you Ohio. Together, we will MAKE AMERICA GREAT AGAIN!\nhttps://t.co/3KWOl20zMm https://t.co/n026nE4XIp"
Great honor to be endorsed by popular &amp; successful @gov_gilmore of VA. A state that I very much want to win-THX Jim! https://t.co/x4Y1TAFHvn
MAKE AMERICA GREAT AGAIN!\n#AmericaFirst #ImWithYou https://t.co/JIlNW7myEN
"Henry McMaster, Lt. Governor of South Carolina who endorsed me, beat failed @CNN announcer Bakari Sellers, so badly. Funny!"
RT @EricTrump: Join @TeamTrump on Saturday for National Day of Action as we work to #MakeAmericaGreatAgain! https://t.co/hyclkzPoBR https:/\u2026
Jeff Zucker failed @NBC and he is now failing @CNN.
.@CNN is unwatchable. Their news on me is fiction. They\nare a disgrace to the broadcasting industry and an arm of the Clinton campaign.
The documentary of me that @CNN just aired is a total waste of time. I don't even know many of the people who spoke about me. A joke!
Final poll results from NBC on last nights Commander-in-Chief Forum. Thank you! #ImWithYou #MAGA https://t.co/C5ipaxUN7B
It wasn't Matt Lauer that hurt Hillary last night. It was her very dumb answer about emails &amp; the veteran who said she should be in jail.
More poll results from last nights Commander-in-Chief Forum. \n#AmericaFirst #TrumpTrain https://t.co/FxyBL6fO1h
Last nights results - in poll taken by NBC. #AmericaFirst #ImWithYou https://t.co/sCOnny1fl3
"With Luis, Mexico and the United States would have made wonderful deals together - where both Mexico and the US would have benefitted."
Mexico has lost a brilliant finance minister and wonderful man who I know is highly respected by President Pe\xf1a Nieto.
Hillary Clinton answered email questions differently last night than she has in the past. She is totally confused. Unfit to serve as #POTUS.
Hillary just gave a disastrous news conference on the tarmac to make up for poor performance last night. She's being decimated by the media!
RT @DanScavino: Last nights winner was clear &amp; it will be proven time &amp; time again - lets #MAGA!! Lets WIN!! #TrumpTrain https://t.co/sGqp9\u2026
"""A rough night for Hillary Clinton""  ABC News."
"Wow, reviews are in - THANK YOU!"
COMING UP @GenFlynn @newtgingrich on @foxandfriends
Thank you to @foxandfriends for the nice reviews of last night.
Thank you America - great #CommanderInChiefForum polls! https://t.co/Rcu6KaRGCB
Thank you to our fantastic veterans. The reviews and polls from almost everyone of my Commander-in-Chief presentation were great. Nice!
"Thank you Peter - if elected, I will think big for our country &amp; never let the American people down! #AmericaFirst https://t.co/6Nwu7EMJ9d"
"Wow - thank you Pensacola, FL. See you Friday at 7pm -- join me!\nhttps://t.co/JCO7Za78tV https://t.co/LYmpRyY0Hq"
#AmericaFirst! https://t.co/fQGxwAjXD7
"'Donald Trump leads Hillary Clinton by 19 points among military, veteran voters: poll' #AmericaFirst #MAGA\nhttps://t.co/5FmxGtLkwt"
"""@adhd_fa:Kudos to @PARISDENNARD for standing up to CNN's attempt to bully you and shout you down for defending @realDonaldTrump #media bias"
I will be interviewed on @oreillyfactor tonight at 11pmE @FoxNews. Enjoy!
Thank you North Carolina- get out &amp; #VoteTrump on 11/8/2016!\n#MakeAmericaGreatAgain https://t.co/HX2LRYs4Vq
"Great meeting with military spouses in Virginia- joined by @IvankaTrump, @LaraLeaTrump, @GenFlynn &amp; @MayorRGiuliani. https://t.co/00GNH9nLet"
"Thank you to all of our amazing military families, service members, and veterans. #ImWithYou https://t.co/RmQJt0Wxcq"
"Join me in Pensacola, Florida this Friday at 7pm! #VoteTrump \nhttps://t.co/L8Ui56dcrJ https://t.co/0ciDCuoFeO"
Thank you! #VoteTrump #ImWithYou https://t.co/SCEq9LqTTj
"Mainstream media never covered Hillary\u2019s massive \u201chacking\u201d\nor coughing attack, yet it is #1 trending. What\u2019s up?"
"""@Ler: Message for undecided voters: Please wake up and vote DonaldTrump now! Trump/Pence very important save our America before too late!"""
Thank you! #AmericaFirst https://t.co/6v4C8ykDVl
"As a tribute to the late, great Phyllis Schlafly, I hope everybody can go out and get her latest book, THE CONSERVATIVE CASE FOR TRUMP."
"China wouldn't provide a red carpet stairway from Air Force One and then Philippines President calls Obama ""the son of a whore."" Terrible!"
"The truly great Phyllis Schlafly, who honored me with her strong endorsement for president, has passed away at 92. She was very special!"
Thank you Ohio! #AmericaFirst https://t.co/p68GAJdhwu
